source,title,url,content,article
Motley Fool,"Down 37% From Its All-Time High, Is This Growth Stock a Once-in-a-Generation Investment Opportunity?",https://finance.yahoo.com/news/down-37-time-high-growth-171700660.html,Planet Fitness is growing revenue and posting consistent earnings.,"Due to the temporary closures of gyms and other public spaces enacted to slow the spread of COVID-19, Planet Fitness (NYSE: PLNT) took a big financial hit during the early stages of the pandemic. But shares eventually recovered before hitting a new peak in November 2021.It's been a difficult ride for shareholders in this profitable and scalable business since then, though. As of April 16, this fitness growth stock is down 37% from that all-time high. Could that make Planet Fitness a once-in-a-generation investment opportunity?Looking at the fundamentalsPlanet Fitness had a strong 2023. It grew its revenue by 14.4% to $1.1 billion, a new record for the company. This was driven by an 8.7% growth in same-store sales, as well as the opening of 165 net new locations. Planet Fitness also added 1.7 million new members, bringing its total customer count to 18.7 million as of year's end.All of these key metrics point to a business that has bounced back nicely from the depths of the coronavirus pandemic. Consumer behavior has normalized, which has been a clear benefit. Its executives remain optimistic about the long term. They think the company can one day have 5,000 gyms open in the U.S. That would be a near doubling of its current footprint. And if Planet Fitness gets remotely close to that target, its sales and earnings should be significantly higher than they are today.Understanding competitive advantagesIt's extremely difficult to find lasting success in the fitness industry, which has a long history of short-lived fads. It doesn't help that these companies must bank on their customers sticking to their workout routines -- or at least paying the fees that would allow them to.Planet Fitness has figured out how to build a sustainable business model. Part of its success comes from operating a franchise system. Of the company's 2,575 locations, less than 10% are actually owned by Planet Fitness. The rest are owned by private investors who put up their own capital and pay recurring fees to the business.""The best business is a royalty on the growth of others,"" famous investor Warren Buffett once said. Planet Fitness fits that description. It expands on the backs of the capital investments that franchisees make. This helps drive the continued generation of free cash flow, of which Planet Fitness reported almost $200 million last year.The company's scale and brand are also important competitive strengths. Planet Fitness has a national reach that makes it easier to attract new members. It has the financial resources to acquire favorable locations to open new gyms. And it can spend more on marketing, all while keeping its lowest-priced membership tier at just $10 per month. That's hard to beat.Story continuesA worthy investment candidatePlanet Fitness possesses attributes that make it a quality business, particularly in the fitness industry. It's growing customers, revenue, and profit, and appears to have a long runway for growth ahead.To buy the stock, investors are being asked by the market to pay a forward P/E ratio of 24.4. That represents a premium to the 21.3 multiple of the S&P 500. But some investors might believe that the valuation is justified.To be clear, I do think that Planet Fitness makes for a worthy investment candidate today for long-term investors. But I don't believe we can call it a once-in-a-generation opportunity. If its forward P/E ratio dropped substantially to say, 15, then maybe it would fit into that rare category. At that point, it would look like a no-brainer stock to buy.Nonetheless, investors should still take a closer look at the stock for their own portfolios.Should you invest $1,000 in Planet Fitness right now?Before you buy stock in Planet Fitness, consider this:The Motley Fool Stock Advisor analyst team just identified what they believe are the 10 best stocks for investors to buy now… and Planet Fitness wasn’t one of them. The 10 stocks that made the cut could produce monster returns in the coming years.Consider when Nvidia made this list on April 15, 2005... if you invested $1,000 at the time of our recommendation, you’d have $466,882!*Stock Advisor provides investors with an easy-to-follow blueprint for success, including guidance on building a portfolio, regular updates from analysts, and two new stock picks each month. The Stock Advisor service has more than quadrupled the return of S&P 500 since 2002*.See the 10 stocks »*Stock Advisor returns as of April 15, 2024Neil Patel has no position in any of the stocks mentioned. The Motley Fool has positions in and recommends Planet Fitness. The Motley Fool has a disclosure policy.Down 37% From Its All-Time High, Is This Growth Stock a Once-in-a-Generation Investment Opportunity? was originally published by The Motley FoolView comments"
Motley Fool,"2 Warren Buffett Stocks You Can Buy With This Year's Average $3,011 Tax Refund",https://finance.yahoo.com/news/2-warren-buffett-stocks-buy-160000213.html,Investors can find Buffett-owned stocks without leaving the consumer sector.,"Another tax day has come and gone, and refunds are always a focus of this tax season. Through early April, the average amount refunded to taxpayers was $3,011.This involves both bad news and good news for investors. The bad news is that those taxpayers made an interest-free loan to the government. However, the sting of that realization may be helped by the good news that taxpayers finally have their money back, likely giving them some cash to invest.Those who want to find Warren Buffett investments (or at least stocks from his team at Berkshire Hathaway) might consider some of the consumer stocks he holds right now. Let's look at two below.AmazonAmazon (NASDAQ: AMZN) is a stock that Buffett recognized late. He and his team waited until the first quarter of 2019 to invest in the e-commerce giant even though it has been trading since 1997. The optionality of its many businesses and the stock's tremendous growth has been a boon to Berkshire's portfolio.Amazon began as an e-commerce company, and online sales remain its largest revenue source. But it also supports fast-growing businesses such as subscriptions (Amazon Prime), online seller services, and online advertising. Investors should pay particular attention to its cloud computing operation. That segment, Amazon Web Services (AWS), drives the majority of the company's operating income.Today, the company has a massive $1.9 trillion market value. In 2023, Amazon claimed a staggering $575 billion in net sales, a 12% yearly increase. Since operating expenses grew at a slower 7% rate over that time, profits rose significantly. Amazon was able to earn $30 billion in net income in 2023, a huge improvement over its $3 billion loss in the prior year.Amazon's shares are trading at $184 per share, so investors receiving the average tax refund can afford a few shares despite an 80% increase in the stock price.From a valuation perspective, Amazon's price-to-earnings ratio (P/E) of 63 may sound rich, but it's notably lower than the five-year average of 91. Additionally, its forward P/E ratio of 44 speaks to the 45% earnings growth expected for the retail giant, a pace that could keep it a market-beating holding for shareholders.Floor & DecorRegional to national growth stories propelled stocks like Home Depot in the previous century, and that trend appears set to bolster a smaller Home Depot competitor called Floor & Decor Holdings (NYSE: FND). Buffett's team began buying the company in the third quarter of 2021. It specializes in hard flooring and decor, offering more selection than a Home Depot and using its bulk purchasing power to offer low prices to consumers.Story continuesAs of the end of 2023, Floor & Decor had expanded to 36 states, and its store count of 221 grew by 31 during that fiscal year. Also, it plans to open between 30 and 35 new stores in fiscal 2024, bringing it closer to a long-term goal of operating 500 locations.Admittedly, the sluggish economy affected its near-term performance. During fiscal 2023, net sales of $4.4 billion rose 4%, well below the double-digit increases of past years. Moreover, rising selling and store operating expenses took a toll, and net income of $246 million dropped 18% from the previous fiscal year.That placed upward pressure on the P/E ratio, which currently stands at 49. While this is above the five-year average of 40, it's not at unusual levels for the stock. Also, its price-to-sales (P/S) ratio is 2.7, a bit below its 2.9 average, indicating that it's not as overpriced as the P/E ratio might imply.Indeed, the stock continues moving higher despite the company's struggles. A price of about $110 per share makes it affordable for most income-tax-refund recipients.Additionally, hard flooring has the type of ""forever"" demand that attracts Buffett and can boost the stock over time. As the company brings additional offerings to the hard-flooring industry, the stock should continue to move higher as it expands into additional markets.Should you invest $1,000 in Amazon right now?Before you buy stock in Amazon, consider this:The Motley Fool Stock Advisor analyst team just identified what they believe are the 10 best stocks for investors to buy now… and Amazon wasn’t one of them. The 10 stocks that made the cut could produce monster returns in the coming years.Consider when Nvidia made this list on April 15, 2005... if you invested $1,000 at the time of our recommendation, you’d have $466,882!*Stock Advisor provides investors with an easy-to-follow blueprint for success, including guidance on building a portfolio, regular updates from analysts, and two new stock picks each month. The Stock Advisor service has more than quadrupled the return of S&P 500 since 2002*.See the 10 stocks »*Stock Advisor returns as of April 15, 2024John Mackey, former CEO of Whole Foods Market, an Amazon subsidiary, is a member of The Motley Fool's board of directors. Will Healy has positions in Berkshire Hathaway. The Motley Fool has positions in and recommends Amazon, Berkshire Hathaway, and Home Depot. The Motley Fool has a disclosure policy.2 Warren Buffett Stocks You Can Buy With This Year's Average $3,011 Tax Refund was originally published by The Motley FoolView comments"
Motley Fool,"My Top 3 ""Magnificent Seven"" Stocks to Buy Right Now",https://finance.yahoo.com/news/top-3-magnificent-seven-stocks-160000347.html,The advertising market is set to boom in 2024.,"The ""Magnificent Seven"" group of stocks has been a powerhouse in the market since the start of 2023, with all of them beating the S&P 500. It includes:Microsoft AppleNvidiaAlphabet (NASDAQ: GOOG) (NASDAQ: GOOGL)Amazon (NASDAQ: AMZN)Meta Platforms (NASDAQ: META)TeslaThis collection has had a strong run, but not every one of them is a strong buy right now, in my opinion. Nearly every one of these companies has artificial intelligence (AI) aspirations, but my reason for buying three of the seven stocks is centered around a much older practice: Advertising.Advertising is a massive industryIf advertising is my reason to buy some of these stocks, then Alphabet, Amazon, and Meta Platforms are the ones I'm talking about. This trio generates a massive amount of revenue each quarter from advertising.CompanyQ4 Advertising RevenueAlphabet $65.5 BillionMeta Platforms $38.7 BillionAmazon$14.7 BillionData sources: Alphabet, Meta Platforms, and Amazon.While Alphabet and Meta are leaders in this category, some may be surprised that Amazon is also heavily involved in the ad marketplace. In fact, advertising services were Amazon's fastest-growing segment in the fourth quarter, increasing 27% year over year.Meta's ad division also put up solid growth figures in Q4, with its ad revenue rising 24% year over year. Alphabet was the laggard of the trio, but this also makes sense due to its sheer size. It delivered an 11% growth rate in Q4.So why are these growth rates a big deal? Well, if you rewind the clock to this time last year, these rates weren't nearly as impressive (besides Amazon). The ad market struggled in early 2023 due to fears of a recession. When businesses are concerned about a potential economic downfall, they save on whatever expenses they can. One of the easiest places to trim is ad budgets, which negatively affects businesses like Meta and Alphabet, which are highly concentrated in this industry.However, the fear of imminent recession has subsided, so businesses are happy to begin increasing their ad budgets. This is why ad-heavy companies like Meta and Alphabet have seen success recently.Amazon is a different story, as their ad revenue growth never dipped like Alphabet's or Meta's. This is likely due to the relatively young age of Amazon's ad business and that it's still working on building out its capabilities. When this segment matures, it will likely display the cyclical trends that the other two do, but it's in full growth mode right now.With the ad market improving each quarter, all three companies stand to benefit, making them excellent buys.Story continuesThe stocks are still attractive buysIn addition to a recovering ad market, these three are some of the most attractively priced Magnificent Seven stocks. My valuation metric of choice for Alphabet and Meta is the forward price-to-earnings (P/E) ratio, as the trailing 12 months used in the more common trailing P/E ratio still includes some quarters where the ad business was down. If you use this metric, it's clear these two are fairly priced.GOOGL PE Ratio (Forward) ChartWe can use Amazon's forward P/E (it's at 44), but that isn't fair to the business as portions of the company (like its international commerce division) aren't profitable and aren't expected to become fully profitable for some time. As a result, I'll use the price-to-sales (P/S) ratio to value Amazon.AMZN PS Ratio ChartFrom this perspective, Amazon still has a way to go before being valued at the same levels as 2018 through 2021. So, investors can confidently buy the stock, knowing that it still isn't back to historical valuation norms.Advertising is a great business to be in right now, which makes this trio a fantastic pick in 2024.Should you invest $1,000 in Alphabet right now?Before you buy stock in Alphabet, consider this:The Motley Fool Stock Advisor analyst team just identified what they believe are the 10 best stocks for investors to buy now… and Alphabet wasn’t one of them. The 10 stocks that made the cut could produce monster returns in the coming years.Consider when Nvidia made this list on April 15, 2005... if you invested $1,000 at the time of our recommendation, you’d have $466,882!*Stock Advisor provides investors with an easy-to-follow blueprint for success, including guidance on building a portfolio, regular updates from analysts, and two new stock picks each month. The Stock Advisor service has more than quadrupled the return of S&P 500 since 2002*.See the 10 stocks »*Stock Advisor returns as of April 15, 2024Suzanne Frey, an executive at Alphabet, is a member of The Motley Fool's board of directors. Randi Zuckerberg, a former director of market development and spokeswoman for Facebook and sister to Meta Platforms CEO Mark Zuckerberg, is a member of The Motley Fool's board of directors. John Mackey, former CEO of Whole Foods Market, an Amazon subsidiary, is a member of The Motley Fool's board of directors. Keithen Drury has positions in Alphabet, Amazon, and Meta Platforms. The Motley Fool has positions in and recommends Alphabet, Amazon, and Meta Platforms. The Motley Fool has a disclosure policy.My Top 3 ""Magnificent Seven"" Stocks to Buy Right Now was originally published by The Motley FoolView comments"
Motley Fool,"1 Unstoppable Stock That's Skyrocketed Nearly 1,400% Since the Start of 2023: Don't Buy and Hold Until You Know These 3 Risks",https://finance.yahoo.com/news/1-unstoppable-stock-thats-skyrocketed-155600509.html,Investors should still proceed with caution when it comes to this company.,"Since the start of 2023, shares of Carvana (NYSE: CVNA) have skyrocketed nearly 1,400% (as of April 16). During that same time, the Nasdaq Composite index is up 52%. It would probably take you some time to find a better-performing stock in recent times. Even Nvidia, the best ""Magnificent Seven"" stock since the start of last year, has climbed only 500%.This puts Carvana in a league of its own. But before you rush to buy this unstoppable stock, here are three risks you need to know about.Risky financial situationOne key reason why the market has fallen in love again with Carvana is that the business has shown progress toward cleaning up its financials. There were very real worries that the company was about to tip into bankruptcy, particularly after it spent $2.2 billion to acquire ADESA in May 2022. Management struck a deal with creditors to extend the maturities of its debt, lowering interest payments in the process.Carvana's total long-term debt balance of $5.6 billion (as of Dec. 31) was down from $6.8 billion just 12 months ago. That little bit of improvement likely resulted in renewed investor optimism.However, this company is still extremely risky from a financial perspective. Carvana's debt burden amounts to 39% of its market cap and more than half of its 2023 revenue. Perhaps even more alarming, 41% of the company's fourth-quarter gross profit went toward making interest payments. In a world where interest rates might be higher for longer, this creates a reason to worry.I'll also point to Carvana's lack of consistent profitability. With management investing aggressively behind national expansion and marketing, the bottom line hasn't been a priority. That adds more risk.Sensitive to macro factorsAnother important risk that investors can't ignore is that Carvana's business model relies on favorable macroeconomic conditions to prosper. When interest rates are low, cars are more affordable because monthly payments for consumers are lower. This is the environment Carvana rode for most of its existence. Carvana sold 24% fewer cars in 2023 than it did in 2022. Growth could be difficult to achieve if rates remain elevated, at least at a higher level than they've been for most of the past decade.Industry-specific factors, like used car prices and supply trends, also profoundly impact this company, and these are outside Carvana's control.Just because a business is overly exposed to macro and industry conditions doesn't always mean it's a risky situation. But based on Carvana's unfavorable financial condition, which I mentioned in the previous section, it's in a tough spot. Story continuesCompetitive forcesIn 2023, there were 35.9 million used car transactions in the U.S. Based on the number of units Carvana sold last year, it currently has less than 1% market share. This business is tiny in the grand scheme of things.There is clearly a massive opportunity present to push more used car sales online. It's a better experience for the customer. And for dealers, not having to operate brick-and-mortar locations can cut costs.Consequently, Carvana will continue to face stiff competition as it tries to gain market share. Carmax, AutoNation, and CarGurus are scaled rivals. There are also the unlimited number of dealerships scattered across the U.S. that are building out their own e-commerce presence. This will make things difficult for Carvana to achieve consistent growth and profitability.Carvana shares have been on a fantastic run. But I still think the business is extremely risky. While I'm still not a buyer of the stock, I can understand why some daring investors would consider adding the company to their portfolios as it sits way below its peak price.Should you invest $1,000 in Carvana right now?Before you buy stock in Carvana, consider this:The Motley Fool Stock Advisor analyst team just identified what they believe are the 10 best stocks for investors to buy now… and Carvana wasn’t one of them. The 10 stocks that made the cut could produce monster returns in the coming years.Consider when Nvidia made this list on April 15, 2005... if you invested $1,000 at the time of our recommendation, you’d have $466,882!*Stock Advisor provides investors with an easy-to-follow blueprint for success, including guidance on building a portfolio, regular updates from analysts, and two new stock picks each month. The Stock Advisor service has more than quadrupled the return of S&P 500 since 2002*.See the 10 stocks »*Stock Advisor returns as of April 15, 2024Neil Patel and his clients have no position in any of the stocks mentioned. The Motley Fool has positions in and recommends CarGurus, CarMax, and Nvidia. The Motley Fool has a disclosure policy.1 Unstoppable Stock That's Skyrocketed Nearly 1,400% Since the Start of 2023: Don't Buy and Hold Until You Know These 3 Risks was originally published by The Motley FoolView comments"
