source,title,url,content,article
Yahoo Finance,Stock market today: S&P 500 hits new record high as investors shrug off sticky inflation data,https://finance.yahoo.com/news/stock-market-today-sp-500-hits-new-record-high-as-investors-shrug-off-sticky-inflation-data-200200583.html,"Investors are bracing against a potential surprise in the crucial CPI inflation print, a key input into the Fed's policy deliberations.","US stocks notched gains across the board on Tuesday after key inflation data came in hotter than expected to help set expectations for the timing of a Federal Reserve interest-rate cut.The S&P 500 (^GSPC) rose about 1.2% to close at a new record high, while the tech-heavy Nasdaq Composite (^IXIC) climbed roughly 1.5% after two days of losses, led by chip giant Nvidia's 7% gain (NVDA). The Dow Jones Industrial Average (^DJI) ticked up about 0.6%.Treasury yields also gained with the 10-year yield (^TNX) rising 5 basis points to trade around 4.15%. Gold prices (GC=F) fell more than 1% to trade near $2,162.Investors are digesting the Consumer Price Index release, one of the most important data inputs for the Fed in deciding its next policy move. Headline inflation met expectations with a monthly gain of 0.4% in February, following a 0.3% rise the month before. But ""core"" CPI — which strips out food and energy prices — came in at a 0.4% rise on the month and 3.1% gain on the year, both higher than estimates.The CPI print is seen as influential, given Fed policymakers have said they want to be sure inflation is easing before beginning to bring rates down from their historically high level. Before the CPI release, S&P 500 traders were hedging moves of 0.9% in either direction for stocks.Meanwhile, bitcoin (BTC-USD) continued its record-setting rally with a rise above $72,000 earlier in the session. Surging inflows into crypto assets have helped the leading token to notch an almost 70% gain this year so far, prompting bulls to predict bitcoin could reach as high as $350,000 this year.On the corporate front, Oracle (ORCL) shares jumped about 12% on signs the database giant is making progress in cloud computing amid a tie-up with AI chip giant Nvidia.Live11 updatesTue, March 12, 2024 at 1:04 PM PDTAlexandra CanalS&P nabs new record US stocks ended Tuesday's trading session in a sea of green with the S&P 500 (^GSPC) notching a new record high as investors shrugged off hotter than expected inflation data.The S&P 500 (^GSPC) rose about 1.2% while the tech-heavy Nasdaq Composite (^IXIC) climbed roughly 1.5% after two days of losses. The Dow Jones Industrial Average (^DJI) ticked up about 0.6%.Treasury yields also gained with the 10-year yield (^TNX) rising 5 basis points to trade around 4.15%. Gold prices (GC=F) fell more than 1% to trade near $2,162.Tue, March 12, 2024 at 11:56 AM PDT Josh SchaferBank of America sees earnings growing further than consensus Bank of America, which recently boosted its year-end S&P 500 target to a Street-high 5,400, thinks the earnings rebound is far from over.The firm updated its earnings per share projections for the S&P 500 (^GSPC) on Tuesday, boosting its year-end target to $250 from $235. BofA noted this is a street high compared to the 21 strategists tracked by Bloomberg. In addition, BofA initiated a call for earnings per share of $275 for 2025.The equity strategy team led by Savita Subramanian wrote the ""economy remains resilient and manufacturing recovery is imminent.""Subramanian also added that artificial intelligence ""hyperscalers""— Microsoft (MSFT), Amazon (AMZN), Alphabet (GOOGL, GOOG) and Meta (META) — have been spending heavily on capital expenditures. Their combined $180 billion expected in capital expenditures for 2024 represents 27% year-over-year growth for the group and could have positive benefits for other areas of the market.""Semis and networking are the most obvious beneficiaries, but increased power usage and the physical build-out of data centers will lead to more demand for electrification, utilities, commodities, etc,"" BofA's team wrote.Tue, March 12, 2024 at 11:06 AM PDTAlexandra CanalTechnology sector leads market as Energy, Real Estate lagTech stocks pushed markets higher on Tuesday as investors shrugged off a sticky inflation print for the month of February.On a sector basis, Technology (XLK), Consumer Discretionary (XLY) and Consumer Staples (XLP) led the day while Utilities (XLU), Real Estate (XLRE), Materials (XLB), and Energy (XLE) were the biggest laggards.To note, those are some of the most interest-rate sensitive areas of the market.(Source: Yahoo Finance)Tue, March 12, 2024 at 10:17 AM PDTInes FerréBoeing stock sinks as safety woes persist, airlines expect delivery delaysBoeing (BA) shares are down for a third day in row, trading below $185 each amid a series of headlines related to production scrutiny and potential plane delivery delay impacts on US airlines.The stock was down 4% on Tuesday the New York Times reported a recent FAA audit of the company's 737 Max production found ""dozens' of problems.The examination stems from an accident involving a door “plug” on an Alaska Airlines (ALK) flight on January 5. The incident unleashed widened regulatory scrutiny and temporarily grounded Boeing's 737 Max 9 planes in the US. The Department of Justice has reportedly also recently launched an investigation into the incident.Airlines have anticipated plane delivery delays from Boeing as the industrial giant overhauls its production safety measures.On Tuesday United Airlines (UAL) CEO Scott Kirby said Boeing has agreed to build Max 9 aircrafts instead of working on the yet to be certified Max 10 jet.Southwest Airlines lowered its 2024 capacity on Tuesday as it expects 42% less Max deliveries this year from the plane manufacturer.Regarding delivery timelines, Boeing said in a statement, ""We are squarely focused on implementing changes to strengthen quality across our production system and taking the necessary time to deliver high quality airplanes that meet all regulatory requirements.""Boeing stock is down roughly 28% year-to-date. Tue, March 12, 2024 at 9:30 AM PDTAlexandra CanalOracle, Southwest, 3M: Stocks trending in afternoon tradingHere are some of the stocks leading the Yahoo Finance trending tickers page on Tuesday:Oracle (ORCL): Shares surged 11% on Tuesday after the cloud company reported a third-quarter earnings beat while revenue came in line with estimates. Analysts expect Oracle's investments and capabilities in artificial intelligence to drive future growth.Southwest (LUV): Shares of the airliner took a nosedive on Tuesday, falling about 14%, after the company said its reevaluating prior full-year guidance amid an expected decline of 737 Max aircraft deliveries this year. Southwest said Boeing, which produces the 737 Max aircrafts, told the company it expects to deliver just 46 aircrafts in 2024 compared to the 79 that was expected.3M (MMM): Shares rose 3% after the conglomerate announced William Brown as its next CEO. Brown, who previously served as the chairman and CEO of tech company L3Harris Technologies, will replace Michael Roman effective May 1. Roman will transition to an executive chairman role on 3M's board.On Holding (ONON): Shares of the running shoe and athletic apparel brand sank roughly 14% on Tuesday after it missed fourth-quarter earnings estimates on both the top and bottom lines. On expects full-year 2024 revenue to reach $2.56 billion, a year-over-year increase of 30%. Prior to Tuesday's drop, the stock had climbed about 25% since the start of the year.Tue, March 12, 2024 at 8:43 AM PDTAlexandra CanalMarkets push higher, led by NasdaqSticky inflation won't stop the stock market's recent rally.Despite February inflation data coming in hotter than expected on Tuesday, US stocks added to gains as investors digested the report.By late morning trading, the S&P 500 (^GSPC) rose nearly 1%, while the tech-heavy Nasdaq Composite (^IXIC) climbed roughly 1.4%. The Dow Jones Industrial Average (^DJI) ticked up about 0.6%.Treasury yields also gained with the 10-year yield (^TNX) rising 4 basis points to trade around 4.15%. Gold prices (GC=F) fell 1% to trade near $2,166.Tue, March 12, 2024 at 8:00 AM PDTAlexandra CanalInvestors still pricing in June rate cutFebruary's sticky inflation report represented the last inflation print before the Fed's next policy decision on March 20. Investors are hopeful the central bank will cut interest rates this year.After the data's release, markets were pricing in a nearly 100% chance the Federal Reserve keeps rates unchanged next week, according to data from the CME Group.The market still largely expects the central bank to begin cutting rates at its June meeting, pricing in roughly 60% chance of a cut. Those expectations remain unchanged despite the hotter-than-expected data.Fed Chair Jerome Powell. (Bonnie Cash/REUTERS) (Reuters / Reuters)Inflation has remained above the Federal Reserve's 2% target on an annual basis. But the Fed's preferred inflation gauge, the core PCE price index, has come in below that rate on a six-month annualized basis, boosting hopes the central bank could begin to cut interest rates.But more recent data has put a dent in that optimism, with the six-month annualized PCE price increase for January settling at 2.5%.To note, the Fed has consistently preached that the path down to 2% will be ""bumpy.""As Yahoo Finance's Jennifer Schonberger pointed out, markets began the year betting on six cuts starting in March, only to revert to three cuts starting in June following cautious commentary from Fed Chair Jerome Powell and a slew of other Fed officials along with higher-than-expected readings on inflation.Last week, Powell said that while he expects interest rate cuts ""at some point this year,"" the FOMC committee still wants to see ""a little bit more data"" before committing to cuts.""The February consumer price index will not instill more confidence among the Federal Reserve members that inflation is on a sustainable path toward their 2% objective,"" Ryan Sweet, chief US economist at Oxford Economics, wrote in reaction to the report.""A pessimistic scenario is one in which rates are higher for longer, where inflation reaccelerates and long-term inflation expectations increase, forcing the Fed to resume raising interest rates,"" he continued. ""This is possible but unlikely, particularly as there is disinflation in the pipeline from lower market rents and a deceleration in nominal wage growth.""Read more here. Tue, March 12, 2024 at 7:15 AM PDTAlexandra CanalSticky shelter, higher gas prices drive inflation higherA hotter-than-expected February inflation print was largely driven by two components: shelter and gas.The shelter index rose 5.7% on an unadjusted annual basis and 0.4% month over month, a deceleration from January's 6% annual increase and 0.6% monthly rise.Sticky shelter inflation is largely to blame for higher core inflation readings, according to economists.The index for rent and owners' equivalent rent (OER) rose 0.5% and 0.4% on a monthly basis, respectively. Owners' equivalent rent is the hypothetical rent a homeowner would pay for the same property. In January, the index for rent rose 0.4% while OER increased 0.6%.Seema Shah, chief global strategist at Principal Asset Management, highlighted that ""while core services inflation was again hot, the all-important core services ex housing weakened from last month while shelter inflation nudged lower.""Shah said that disinflationary trend is a positive but warned price pressures will subside ""very gradually.""""This print is just about enough to keep rate cut expectations for June stable — but another print like this next month would push the first cut into the second half of the year, putting the soft landing narrative in question,"" the economist said.Energy prices — largely to blame for the increase in headline inflation — rose following several months of declines, buoyed by gas prices. The index jumped 2.3% in February after falling 0.9% in January. Still, on a yearly basis, the index fell 1.9%.Gas prices climbed a significant 3.8% from January to February after falling 3.3% the previous month. This was largely due to seasonality and a pullback in US refinery utilization.Other indexes that rose in February included apparel, recreation, and used cars and trucks.The BLS noted the airline fares index rose 3.6% in February following a 1.4% increase in January. The index for motor vehicle insurance increased 0.9% over the month.The food index jumped 2.2% in February over the last year, with food prices holding steady from January to February. The index for food at home also held steady over the month after rising 0.4% in January.Food away from home, however, ticked up 0.1% month over month after rising 0.5% in January.Read more here. Tue, March 12, 2024 at 6:35 AM PDTAlexandra CanalStocks open higher despite hot inflation dataMarkets moved higher to kick off the trading day on Tuesday despite a hotter-than-expected inflation print for the month of February.The S&P 500 (^GSPC) rose 0.5%, while the tech-heavy Nasdaq Composite (^IXIC) climbed roughly 0.7% after two days of losses. The Dow Jones Industrial Average (^DJI) ticked up about 0.3%.Tue, March 12, 2024 at 5:33 AM PDTAlexandra CanalInflation remains elevatedInflation pressures remained persistent in February as prices for shelter and gas rose, according to the latest data from the Bureau of Labor Statistics released Tuesday morning.The Consumer Price Index (CPI) rose 0.4% over the previous monh and 3.2% over the prior year in February, slightly higher than January's 0.3% month-over-month increase and 3.1% annual gain.Both measures roughly matched economist forecasts of a 0.4% month-over-month increase and a 3.1% annual increase, according to data from Bloomberg.On a ""core"" basis, which strips out the more volatile costs of food and gas, prices in February climbed 0.4% over the prior month and 3.8% over last year. Both measures were higher than economist expectations of a 0.3% monthly increase and 3.7% annual gain.Read more here. Tue, March 12, 2024 at 4:30 AM PDTBrian Sozzi3 reasons why Apple's stock is sucking windApple's (AAPL) stock has been looking a little less sweet in the past month.Shares of the tech beast are off by 8.5%, lagging the S&P 500's 1.8% advance. The pundits have pointed to disappointment over Apple not yet revealing its AI plans as the main reason for the stock's weakness. Concern on the pace of China demand hasn't helped sentiment, either.But there may be more at play here, points out Evercore ISI tech analyst Amit Daryanani in a new note to clients this morning.Daryanani shares three reasons behind the Apple sell-off:""We have fielded a large number of investor questions around what could unlock the upside on the stock and help drive the momentum back up. Overarchingly, we think there are three things that’s driven the “underperformance’ for AAPL over the last few weeks – 1) Risk On + Skew to Nvidia/AI: Heard this a LOT from investors that want to go overweight “AI” names like Nvidia (NVDA) especially on the mega cap side, which makes them more comfortable taking dollars away from AAPL. 2) China Worries – There continues to be data sets that suggests that China demand is broadly soft and within smartphones Apple is perhaps ceding back some of the share and 3) Regulatory worries – That continue to impede comfort around Apple. Notably, we have heard worry around DOJ/Google implications and also EU anti trust issues."""
Reuters,Arm's shares rise as Wall Street eyes IPO lock-up expiration,https://finance.yahoo.com/news/arms-shares-rise-wall-street-194944130.html,"Shares of Arm Holdings, the British chip designer backed by Softbank Group, gained 1.6% to $128.77 on Tuesday as markets braced for increased trading activity following the expiration of the lockup period tied to its blockbuster initial public offering (IPO).  Most market debuts usually include a lockup period of up to six months, in which company insiders and pre-IPO investors are prohibited from selling their shares.  This typically limits the amount of shares available for public trading.","By Chibuike OguhNEW YORK (Reuters) - Shares of Arm Holdings, the British chip designer backed by Softbank Group, gained 1.6% to $128.77 on Tuesday as markets braced for increased trading activity following the expiration of the lockup period tied to its blockbuster initial public offering (IPO).Most market debuts usually include a lockup period of up to six months, in which company insiders and pre-IPO investors are prohibited from selling their shares. This typically limits the amount of shares available for public trading.With only 9.5% of Arm's outstanding shares available for trading since its September IPO, the expiration on Tuesday of its lockup period is expected to allow more investors to offload a portion of their holdings. Softbank owns a 90% stake or about 930 million shares in Arm.(Reporting by Chibuike Oguh in New York; Editing by Alden Bentley and Jonathan Oatis)"
Motley Fool,Here's Why Ranpak Stock Skyrocketed Today,https://finance.yahoo.com/news/heres-why-ranpak-stock-skyrocketed-194100898.html,The sleepy packaging stock finally got some attention from the market.,"Ranpak Holdings (NYSE: PACK), a small company that provides packaging systems and materials to e-commerce companies and more, is often overlooked. But investors were certainly looking its way today. As of 2:20 p.m. ET, Ranpak stock was up a whopping 51% following the release of its financial results.An exciting day for Ranpak shareholdersRanpak released financial results for the fourth quarter of 2023 yesterday afternoon. Q4 net revenue was up 14% year over year and up more than Wall Street expected. The company leases its packaging machines, and machine placements were up 1.5%. And higher volume led to higher revenue for its consumable-packaging materials.Profits also improved for Ranpak. The company had Q4 adjusted earnings before interest, taxes, depreciation, and amortization (EBITDA) of over $24 million, which was its best quarter in 2023. Moreover, its full-year net loss shrank to $27.1 million compared to a net loss of $41.4 million in 2022.The financial results were enough to motivate a couple of analysts to rethink their assumptions about Ranpak. Both Ghansham Panjabi of Baird and Greg Palm of Craig-Hallum raised their price targets for Ranpak stock today in light of Q4 results, according to The Fly.Expect more growth in 2024 for RanpakFor 2024, Ranpak's management expects to grow net revenues by 6% to 12%, which would result in $370 million to $390 million on the top line. And for adjusted EBITDA, management expects to grow by 5% to 16%, which would result in adjusted EBITDA of $80 million to $89 million.That's a broad range of outcomes for Ranpak in 2024, and it reflects uncertainty on management's part, which is something for investors to be mindful of. Moreover, while Q4 results were respectable, I'm a little surprised to see the stock up as much as it is.For Ranpak, this could be a case of a small stock popping more than usual because volume is typically low -- a sudden spike in interest can trigger big moves. Therefore, I wouldn't be surprised if shares pulled back in coming days and weeks. But for patient, long-term investors, Rankpak stock could still find upside if it can keep building on its successes in 2023.Story continuesShould you invest $1,000 in Ranpak right now?Before you buy stock in Ranpak, consider this:The Motley Fool Stock Advisor analyst team just identified what they believe are the 10 best stocks for investors to buy now… and Ranpak wasn’t one of them. The 10 stocks that made the cut could produce monster returns in the coming years.Stock Advisor provides investors with an easy-to-follow blueprint for success, including guidance on building a portfolio, regular updates from analysts, and two new stock picks each month. The Stock Advisor service has more than tripled the return of S&P 500 since 2002*.See the 10 stocks*Stock Advisor returns as of March 11, 2024Jon Quast has no position in any of the stocks mentioned. The Motley Fool has no position in any of the stocks mentioned. The Motley Fool has a disclosure policy.Here's Why Ranpak Stock Skyrocketed Today was originally published by The Motley Fool"
Bloomberg,Boeing’s Calamities Push Stock to Its Widest Gap With Airbus Ever,https://finance.yahoo.com/news/boeing-calamities-push-stock-widest-190946799.html,"(Bloomberg) -- As the troubles faced by Boeing Co. deepen and reverberate through the airline industry, the planemaker is falling even further behind its biggest competitor, Airbus SE.Most Read from BloombergOne of the Most Infamous Trades on Wall Street Is Roaring BackStock Traders Bracing for Worst Shrug Off Hot CPI: Markets WrapUS Core Inflation Tops Forecasts Again, Reinforcing Fed CautionChina Has Never Canceled This Many Shipments of US WheatNY Says Trump Should Post Full Bond During Fraud","(Bloomberg) -- As the troubles faced by Boeing Co. deepen and reverberate through the airline industry, the planemaker is falling even further behind its biggest competitor, Airbus SE.Most Read from BloombergOne of the Most Infamous Trades on Wall Street Is Roaring BackStock Traders Bracing for Worst Shrug Off Hot CPI: Markets WrapUS Core Inflation Tops Forecasts Again, Reinforcing Fed CautionChina Has Never Canceled This Many Shipments of US WheatNY Says Trump Should Post Full Bond During Fraud Case AppealAfter a 30% drop in its share price so far this year, Boeing’s market valuation is now lagging Airbus by the most ever. At $112 billion, the troubled US company is about $24 billion smaller than its French counterpart, as of midday Tuesday in New York.The gap is telling of how the fortunes have turned against Boeing in recent years, in the wake of several issues with its aircraft, including two fatal crashes and a long, painful grounding of its jets. A string of accidents and mishaps this year has been prompting airlines to rethink their own expansion plans.Boeing had been bigger than Airbus ever since the latter became a publicly traded company in July 2000. That changed in mid-2022, following a particularly disappointing outlook from the US jet-maker.Since then, the market value of the two companies have been close to each other — with Boeing largely staying ahead — before starting to plunge amid the constant barrage of recent negative news.The latest commentary from airlines on Tuesday doesn’t bode well for Boeing. United Airlines Holdings Inc.’s Chief Executive Officer Scott Kirby said he’d seek a deal with Airbus for their A321, and Delta Air Lines Inc. has already been taking that model.“Airbus could be poised to take additional share from Boeing, especially if they add pressure to Boeing’s customers,” said RBC Capital Markets analyst Kenneth Herbert.Boeing’s aircraft deliveries trailed that of Airbus last month. The former handed over 27 airplanes to customers in February, while Airbus delivered 49.Story continuesMost Read from Bloomberg BusinessweekGold-Medalist Coders Build an AI That Can Do Their Job for ThemAcademics Question ESG Studies That Helped Fuel Investing BoomLuxury Postnatal Retreats Draw Affluent Parents Around the USHow Apple Sank About $1 Billion a Year Into a Car It Never BuiltPrimaries Show Candidates Can Win on TikTok But Lose at the Polls©2024 Bloomberg L.P."
