source,title,url,content,article
Bloomberg,Traders Tread Cautiously in Wake of Iran Attacks: Markets Wrap,https://finance.yahoo.com/news/asian-stocks-set-fall-wake-220847015.html,(Bloomberg) -- Investors are treading cautiously in early Asian trading as markets grapple with ratcheting tensions after Iran’s unprecedented attack on Israel at the weekend.Most Read from BloombergIsrael Versus Iran — What All-Out War Could Look LikeTexas Warns of Possible Power Emergency Next WeekIran’s Missile Barrage Was an Error Israel Can Gain FromIsrael Grapples With New Phase in its Multi-Front War With IranA $150 Billion Fortune Bolsters Qatari Royals at Critical MomentThe dollar was s,"(Bloomberg) -- Asian stocks are set to decline on Monday as traders grapple with ratcheting tensions in the Middle East after Iran’s unprecedented attack on Israel at the weekend.Most Read from BloombergIsrael Versus Iran — What All-Out War Could Look LikeTexas Warns of Possible Power Emergency Next WeekIran’s Missile Barrage Was an Error Israel Can Gain FromIsrael Grapples With New Phase in its Multi-Front War With IranA $150 Billion Fortune Bolsters Qatari Royals at Critical MomentEquity futures in Australia, China and Japan point to early losses after US stocks suffered their worst session since January on Friday amid a flight to safety in anticipation of Iran’s strike. The Japanese yen and Swiss franc, traditionally seen as so-called safe haven currencies, edged higher in early trading Monday. Oil opened steady in Asia while gold rose 0.7%.With investors already rattled by sticky inflation and the prospect of higher-for-longer interest rates, the escalation of the Middle East crisis is injecting fresh volatility into markets. As the conflict widens, many say oil could surpass $100 a barrel and expect a flight to Treasuries, gold and the dollar, along with further stock-market losses.While Iran said “the matter can be deemed concluded,” traders are now awaiting Israel’s response and whether the conflict spirals into a widespread regional war. Still, nerves may be tempered following a report that President Joe Biden told Israeli Prime Minister Benjamin Netanyahu that the US won’t support an Israeli counterattack against Iran.“For markets this may eventually play out as a fade as Iran and Israel step back from the brink,” said Namik Immelbäck, chief strategist at Skandinaviska Enskilda Banken AB. “But near term this should lead to position reduction from especially trend following quant strategies” which should exacerbate the typical flight to safety, he said.Read More: Iran’s Attack on Israel Sparks Race to Avert a Full-Blown WarStory continuesBitcoin sank almost 9% in the wake of the attacks on Saturday, only to rebound and trade near the $64,000 mark. Stock markets in Saudi Arabia and Qatar posted modest losses under thin trading volumes on Sunday. Israel’s equity benchmark fluctuated between gains and losses at least nine times before closing with a small gain.Oil will be of close focus as investors look to it as a guide for how to respond given the risk of a strike and counter-strike cycle. Brent crude is already up almost 20% this year and last traded above $90 a barrel.In the bond market, investors will be weighing the risk that more expensive energy bills may add to swirling inflation fears. While Treasuries tend to benefit in times of uncertainty, the threat of interest rates staying high could limit moves.Some of the main moves in markets:CurrenciesThe Japanese yen rose 0.1% to 153.07 per dollar as of 6:52 a.m. Tokyo timeThe euro fell 0.1% to $1.0635The Australian dollar was unchanged at $0.6467The Swiss franc rose 0.1% to 0.9132CryptocurrenciesBitcoin fell 0.2% to $63,733.98Ether fell 0.1% to $3,064.89StocksHang Seng futures fell 1.7% on FridayS&P/ASX 200 futures fell 0.6%Nikkei 225 futures fell 1.8%BondsThe yield on 10-year Treasuries declined six basis points to 4.52%CommoditiesWest Texas Intermediate crude was little changed at $85.56 a barrelSpot gold rose 0.7% to $2,360.97 an ounceThis story was produced with the assistance of Bloomberg Automation.--With assistance from Michael G. Wilson.Most Read from Bloomberg BusinessweekHow a Pioneering Blackjack Master Beats the Odds of AgingRace for AI Supremacy in Middle East Is Measured in Data CentersCocoa’s Surge Is Drawing Africa’s Farmers Back to the BeanToyota Pins Its Hopes on Revamped 4Runner to Beat Ford and HyundaiEveryone Is Rich, No One Is Happy. The Pro Golf Drama Is Back©2024 Bloomberg L.P."
Bloomberg,Emerging Markets Battle Weak Currencies Amid Dollar Might,https://finance.yahoo.com/news/emerging-markets-battle-weak-currencies-211601290.html,"(Bloomberg) -- Currency intervention has become a key battleground in emerging markets, especially Asia, as the latest leg up in the dollar piles pressure on officials to act.Most Read from BloombergIsrael Versus Iran — What All-Out War Could Look LikeTexas Warns of Possible Power Emergency Next WeekIran’s Missile Barrage Was an Error Israel Can Gain FromIsrael Grapples With New Phase in its Multi-Front War With IranA $150 Billion Fortune Bolsters Qatari Royals at Critical MomentIn South Korea,","(Bloomberg) -- Currency intervention has become a key battleground in emerging markets, especially Asia, as the latest leg up in the dollar piles pressure on officials to act.Most Read from BloombergIsrael Versus Iran — What All-Out War Could Look LikeTexas Warns of Possible Power Emergency Next WeekIran’s Missile Barrage Was an Error Israel Can Gain FromIsrael Grapples With New Phase in its Multi-Front War With IranA $150 Billion Fortune Bolsters Qatari Royals at Critical MomentIn South Korea, Thailand and Poland, officials have said they are closely monitoring for currency volatility or spelled out they’ll step in if needed. Indonesia has gone a step further by selling dollars and China has repeatedly pushed back against depreciation, implying to traders that the yuan’s stability is key.Faster-than-expected US inflation data last week damped bets on Federal Reserve interest-rate cuts, suggesting the battle against dollar strength isn’t going to end anytime soon. Increasing tensions in the Middle East between Israel and Iran risk creating a fresh surge in demand for the greenback as a haven.“Right now, we do see lots of verbal intervention from different central banks,” said Marcella Chow, global market strategist at JPMorgan Asset Management in Hong Kong. Given the Fed seems unlikely to ease policy soon, “there might be more weakening with regards to Asian currencies and that may suggest that there might be more verbal intervention that’s needed,” she said in an interview on Bloomberg TV.The uptick in central bank activity is just another zone of conflict stemming from the Fed’s pivot to higher-for-longer rates. Traders have been winding back bets on expected US rate cuts in recent months due to sticky consumer-price data, which suggests emerging-market policymakers still have plenty of work ahead of them.Currency JawboningThai policymakers are faced with a stern test in trying to support the baht, which has tumbled about 6% this year. Their approach has been to use rhetoric to try and talk it higher.Story continues“The committee will continue to closely monitor the volatilities in the foreign exchange market,” policymakers said at their April 10 meeting. They kept interest rates on hold at the gathering to help the currency, defying the wishes of Prime Minister Srettha Thavisin who has stressed the need to ease policy.Poland’s central bank repeated at its April 4 meeting that it may intervene to bolster the zloty. A stronger local currency helps curb inflation, policymakers said after they held rates.And Bank of Korea officials have said they are watching the won closely, after it came under pressure last week. Governor Rhee Chang-yong’s remarks on the currency on Friday contained verbal intervention terminology, Director General Oh Kum-hwa told Bloomberg.Selling DollarsBank Indonesia has gone a step further by buying the rupiah to limit losses. Governor Perry Warjiyo has said intervention and the sale of high-yielding securities will be their main levers this year to underpin the currency.Their latest official foray was on April 2 when the local currency slid to a four-year low. In Indonesia’s case though it’s not just the dollar to blame: the rupiah has also been under pressure due to concerns about the spending plans of incoming president Prabowo Subianto.Peru’s central bank, which surprised economists with an interest rate cut last week, is said to have been a frequent seller of dollars in recent months as it seeks to prop up the sol. Officials have said in the past the goal of interventions is to reduce currency fluctuations.Read more: Peru Delivers Shock Rate Cut as Pension Withdrawal ApprovedAlthough not primarily in response to the dollar, Israel’s central bank deployed unprecedented sales of its US currency following the Hamas attack in October to protect the shekel.Many of the most interventionist central banks have been in Asia, which has seen some of the largest currency losses in the past month.“Asian central banks just can’t let down their guard,” said Paul Mackel, global head of foreign-exchange research at HSBC Holdings Plc in London. Given that weak currencies often stoke price pressures, “it could also mean that actually the last mile of inflation is not only difficult for the US, it could be for a number of different economies,” he said.China’s DilemmaA prime example of the challenge facing some officials in emerging markets is China’s dilemma over the yuan: prop it up and risk worsening the economic downturn, or let it weaken and encourage capital outflows.The central bank has chosen the former, and turned to its trusted yuan fixings as its key instrument. Policymakers have kept the daily reference rate in a tight range in recent months, even as the yuan has weakened, meaning the currency is getting ever closer to the 2% daily boundary around the fixing in which it’s allowed to trade.The dangers of relaxing their hold have already been demonstrated. The People’s Bank of China set a weaker-than-expected fixing on March 22 and the yuan slumped the most in two months.China is prioritizing exchange-rate stability but may have to use more tools to keep yuan depreciation at bay if the dollar continues to strengthen, said Khoon Goh, head of Asia research at ANZ Group Holdings Ltd. in Singapore.Time to Buy?Still, while there are few signs the dollar rally is about to let up, some analysts at least suggest this may be a decent time to start returning to some of the most beaten up currencies.The likelihood of the Fed delaying rate cuts after March US inflation data “adds to the continued headwinds for Asian currencies,” said David Chao, a strategist at Invesco Asset Management in Singapore. “This could be an opportunity to buy the dip” in regional risk assets, he said.What to Watch:The IMF and World Bank spring meetings take place in Washington. The main ministerial event will be held April 17-19India publishes data on trade and wholesale pricesIsrael, Poland, Saudi Arabia, and Nigeria report consumer price figuresIndia’s elections begin on April 19, with Prime Minister Narendra Modi seeking a third term. The results will be known only on June 4--With assistance from Tania Chen, Yvonne Man, David Ingles, Daedo Kim and Hooyeon Kim.(Adds more context on South Korea)Most Read from Bloomberg BusinessweekHow a Pioneering Blackjack Master Beats the Odds of AgingRace for AI Supremacy in Middle East Is Measured in Data CentersCocoa’s Surge Is Drawing Africa’s Farmers Back to the BeanToyota Pins Its Hopes on Revamped 4Runner to Beat Ford and HyundaiEveryone Is Rich, No One Is Happy. The Pro Golf Drama Is Back©2024 Bloomberg L.P."
Bloomberg,Five Key Charts to Watch in Global Commodity Markets This Week,https://finance.yahoo.com/news/five-key-charts-watch-global-210000931.html,"(Bloomberg) -- One of the world’s biggest annual gatherings for the copper industry kicks off in Santiago, with Cesco Week and CRU’s World Copper Conference unfolding while the industrial metal is having a moment. Meanwhile, the annual BNEF Summit will convene in New York, bringing together project developers, government officials and bankers to discuss global trends in the energy transition.Most Read from BloombergIsrael Versus Iran — What All-Out War Could Look LikeTexas Warns of Possible Powe","(Bloomberg) -- One of the world’s biggest annual gatherings for the copper industry kicks off in Santiago, with Cesco Week and CRU’s World Copper Conference unfolding while the industrial metal is having a moment. Meanwhile, the annual BNEF Summit will convene in New York, bringing together project developers, government officials and bankers to discuss global trends in the energy transition.Most Read from BloombergIsrael Versus Iran — What All-Out War Could Look LikeTexas Warns of Possible Power Emergency Next WeekIran’s Missile Barrage Was an Error Israel Can Gain FromIsrael Grapples With New Phase in its Multi-Front War With IranA $150 Billion Fortune Bolsters Qatari Royals at Critical MomentHere are five notable charts to consider in global commodity markets as the week gets underway.CopperCopper’s timing is good. Just ahead of the global industry’s meetup, the metal has surged. There are a number of factors that drove gains to a 22-month high last week: Factory activity is improving everywhere from the US to China, there are flares of supply stress, and there’s the much-vaunted demand potential from new-energy industries. Attendees at Cesco Week in top producer Chile will weigh whether this is another false dawn, or the start of copper’s march toward bigger gains above $10,000 a metric ton.Clean TechThe world’s dependence on China has increased for technologies needed to support a global transition away from fossil fuels, according to BloombergNEF. Breakneck spending has pushed China’s share of global production capacity above 80% in 11 clean-technology value chain segments. China’s capacity is set to far surpass global demand across solar, batteries and electric vehicles for years to come. Supply chains for clean energy will be among the topics discussed at BNEF’s summit on Tuesday and Wednesday.OilWith Mexico curbing its oil exports at the same time that OPEC+ curtails output, investors are watching for any changes to US production, which surprised to the upside last year. Shale production in the first three months of this year has already been predicted by the Energy Information Administration to be flat and the agency expects overall US output in 2024 to grow more slowly than in previous years. EIA’s Drilling Productivity Report that comes out Monday will offer a fresh forecast on where shale output is heading in May.Story continuesEggsBird flu is flaring up again: The top US eggs producer reported this month the worst American outbreak since December while the highly pathogenic avian influenza virus made the jump to dairy cattle. Egg prices so far have held relatively in check, but there are expectations they could rise again with more egg-laying chickens potentially catching the virus amid peak migration season for wild birds. The worst-ever outbreak has never fully abated since it was first detected in the US in February 2022.EnergyA strong oil-fueled rally in energy stocks is gathering momentum, helping them outperform technology indexes this year. The closely watched Energy Select Sector exchange-traded fund, or XLE, is up nearly 15% since the start of the year, while the Nasdaq 100 Index has gained just 7%. Rising oil has helped, after West Texas Intermediate crude broke above $80 a barrel in mid-March. Energy has led the S&P 500’s 11 market sectors since the start of March, rising more than 11% compared with the next closest group, communication services, at 5.8%, and the 0.3% decline in the broader index.--With assistance from Brian Eckhouse, Geoffrey Morgan and Doug Alexander.Most Read from Bloomberg BusinessweekHow a Pioneering Blackjack Master Beats the Odds of AgingRace for AI Supremacy in Middle East Is Measured in Data CentersCocoa’s Surge Is Drawing Africa’s Farmers Back to the BeanToyota Pins Its Hopes on Revamped 4Runner to Beat Ford and HyundaiEveryone Is Rich, No One Is Happy. The Pro Golf Drama Is Back©2024 Bloomberg L.P."
Business Insider,Investors are overlooking a key sector of the stock market. 3 reasons market pros see big upside in energy,https://finance.yahoo.com/news/investors-overlooking-key-sector-stock-202101888.html,"The energy sector is ripe for fresh gains due to attractive valuations, investor positioning, and structural tailwinds, David Rosenberg said.",
Bloomberg,Markets Weigh Up Risk of Retaliation-Cycle After Iran Hits Israel,https://finance.yahoo.com/news/markets-weigh-risk-retaliation-cycle-121654817.html,(Bloomberg) -- Financial markets will face the new week fretting about geopolitics with much riding on whether Iran’s unprecedented weekend strike on Israel triggers rounds of retaliation. Most Read from BloombergIsrael Versus Iran — What All-Out War Could Look LikeTexas Warns of Possible Power Emergency Next WeekIran’s Missile Barrage Was an Error Israel Can Gain FromIsrael Grapples With New Phase in its Multi-Front War With IranA $150 Billion Fortune Bolsters Qatari Royals at Critical MomentWi,"(Bloomberg) -- Financial markets will face the new week fretting about geopolitics with much riding on whether Iran’s unprecedented weekend strike on Israel triggers rounds of retaliation.Most Read from BloombergIsrael Versus Iran — What All-Out War Could Look LikeTexas Warns of Possible Power Emergency Next WeekBiden Returns to White House as Israel Braces for Iran ResponseIsrael Grapples With New Phase in its Multi-Front War With IranIsrael, Allies Mostly Block Unprecedented Attack From IranWith investors already rattled by sticky inflation and the prospect of higher-for-longer interest rates, the escalation of the Middle East crisis is set to inject fresh volatility when trading resumes.When Hamas attacked Israel in October, the biggest fear for many market participants was that Iran would ultimately be drawn into the fighting. Now as the conflict widens, many say oil could surpass $100 a barrel and expect a flight to Treasuries, gold and the dollar, along with further stock-market losses.A spike in nerves may still be tempered by the flight to safety in markets on Friday in anticipation of a strike, Iran’s statement that “the matter can be deemed concluded” and a report that President Joe Biden told Israeli Prime Minister Benjamin Netanyahu that the US won’t support an Israeli counterattack against Iran.“Investors’ natural reaction is to look for safe-haven assets in moments like this,” said Patrick Armstrong, chief investment officer at Plurimi Wealth LLP. “Reactions will be somewhat dependent on Israel’s response. If Israel does not escalate from here, it may provide an opportunity to buy risk assets at lower prices.”Risk-Addicted Wall Street Funds Are Shaken as Bad News Piles UpBitcoin gave an early insight into market sentiment. The token sank almost 9% in the wake of the attacks on Saturday, only to rebound on Sunday and trade near the $64,000 mark.Stocks markets in Saudi Arabia and Qatar posted modest losses under thin trading volumes. Israel’s equity benchmark fluctuated between gains and losses at least nine times before closing with a small gain.Story continues“Middle Eastern markets opened with relative calm following Iran’s attack, which was perceived as a measured retaliation, rather than an attempt at escalation,” said Emre Akcakmak, a senior consultant at East Capital in Dubai. “However, the market impact might extend beyond the Middle East due to secondary effects on oil and energy prices, potentially influencing the global inflation outlook.”Investors will now weigh the risk of a strike and counter-strike cycle, with many looking to oil as a guide for how to respond. Brent crude is already up almost 20% this year and trading north of $90 a barrel.While the conflict in the Middle East hasn’t yet had any impact on production, Red Sea attacks by Iran-backed Houthis in the Red Sea have disrupted shipping. Traders mostly fear a widening conflict could disrupt tanker shipments from the Persian Gulf through the Strait of Hormuz.Israel’s War Cabinet Discusses Response to Iran Strikes: TOPLiveWorries about turmoil in the region have also been filtering through global markets. The S&P 500 is coming off its biggest weekly decline since October on the back of higher-than-expected inflation and disappointing bank earnings.In the bond market, traders will be weighing the risk that more expensive energy bills may add to swirling inflation fears. While Treasuries tend to benefit in times of uncertainty, the threat of interest rates staying high could limit moves. US equity and bond futures will open at 6 p.m. New York time Sunday.Meanwhile, gold has been on a tear, gaining 13% this year to hit a record above $2,400 an ounce. Investors have also sought the stability of the US dollar. An index of the currency rose 1.3% last week, the best performance since late 2022.Here’s what investors and analysts are saying:Erik Meyersson, chief emerging markets strategist at SEB:“Our oil analysts do not see much sign of a geopolitical risk premium in oil prices so far. We expect this to reflect market perceptions of low risks of escalation up until now. This equilibrium is likely to be tested if Iran and Israel continue to attack each other.”Gonzalo Lardies, senior equities fund manager at Andbank:“A new environment of uncertainty is now opening up, but the market on Friday already partially priced in this situation, so if it does not get worse the impact should not be very high. The risk is if this situation escalates and there is contagion in the region.”Alfonso Benito, chief investment officer at Dunas Capital:“I wouldn’t expect sharp drops given how Israel has defended its air shield. We should see defense companies up, oil up and gas up, while airlines could decline. Bonds will rise, but I don’t think excessively. Investors could take advantage to partially correct the increases of recent months.”Joachim Klement, a strategist at Liberum:“The reaction will very much depend on the reaction of Israel today and whether the US can manage to restrain Benjamin Netanyahu.”“In the next couple of days, stock markets will focus on the geopolitical situation, rather than central bank action or the strong economy in the US. Hence, we expect the rally to stall until there is more clarity if the situation in Iran-Israel calms down. If we end up in a shooting war between Israel and Iran, then the rally will be stalled for longer.”Mark Matthews, strategist at Bank Julius Baer in Singapore:“The good thing is that Iran did warn about the attack well beforehand. Military analysts say it was done in a way that minimized casualties. I don’t see why it would cause Fed rate expectations to fall more or it would cause the oil price to go up a lot. Iran is trying to defuse this and so is the US. The key is what Israel’s answer will be, and then Iran’s answer to that. If Israel does a de-escalatory strike, and then the Iranians do an even more de-escalatory strike, then it will be over with.”Geoff Yu, senior strategist for EMEA Markets at BNY Mellon in London:“There is scope for further accumulation of dollars, even with recent buying after the CPI data. Our clients remain overweight the euro, Canadian dollar and some high-carry currencies such as the Mexican peso, so this is where we would watch for rotation in the greenback’s favor.”Neil Shearing, chief economist at Capital Economics in London:“Our sense is that events in the Middle East will add to the reasons for the Fed to adopt a more cautious approach to rate cuts, but they won’t prevent it from cutting altogether. We expect the first move in September. And assuming that the energy prices don’t spiral over the next month or so, we think that both the ECB and BOE will cut in June.”--With assistance from Macarena Muñoz, Allegra Catelli, Alice Gledhill and Anthony Di Paola.(Updates prices throughout, adds quote.)Most Read from Bloomberg BusinessweekHow a Pioneering Blackjack Master Beats the Odds of AgingRace for AI Supremacy in Middle East Is Measured in Data CentersCocoa’s Surge Is Drawing Africa’s Farmers Back to the BeanToyota Pins Its Hopes on Revamped 4Runner to Beat Ford and HyundaiEveryone Is Rich, No One Is Happy. The Pro Golf Drama Is Back©2024 Bloomberg L.P."
