source,title,url,content,article
Bloomberg,Stock Traders Bracing for Worst Shrug Off Hot CPI: Markets Wrap,https://finance.yahoo.com/news/asia-stocks-look-mixed-us-225117935.html,"(Bloomberg) -- The stock market managed to rebound after the latest inflation figures did little to alter bets the Federal Reserve will cut rates this year — even if it keeps a more cautious stance for now.Most Read from BloombergOne of the Most Infamous Trades on Wall Street Is Roaring BackStock Traders Bracing for Worst Shrug Off Hot CPI: Markets WrapUS Core Inflation Tops Forecasts Again, Reinforcing Fed CautionChina Has Never Canceled This Many Shipments of US WheatNY Says Trump Should Post","(Bloomberg) -- The stock market managed to rebound after the latest inflation figures did little to alter bets the Federal Reserve will cut rates this year — even if it keeps a more cautious stance for now.Most Read from BloombergOne of the Most Infamous Trades on Wall Street Is Roaring BackStock Traders Bracing for Worst Shrug Off Hot CPI: Markets WrapChina Has Never Canceled This Many Shipments of US WheatUS Core Inflation Tops Forecasts Again, Reinforcing Fed CautionNY Says Trump Should Post Full Bond During Fraud Case AppealFollowing a series of twists and turns, equities pushed decidedly higher. Notwithstanding the fact that the consumer price index continued to show some discouraging signs of “stickiness,” the overall report came only slightly above estimates. While that’s not ideal for a central bank trying to get close to its 2% target, the February CPI was not a shocker to traders dreading another post-inflation rout.“Fears have been circulating prior to the release for an extra-hot print, which appears to have boosted markets as they failed to materialize,” said Josh Jamner at ClearBridge Investments. “Overall, there should be relatively little market impact from today’s release given it is largely consistent with the prior understanding of the disinflationary process.”The S&P 500 rose nearly 1% — and was on track for another all-time high. Tech led gains on Tuesday, with Oracle Corp. soaring 12% amid a spike in bookings in cloud computing. Nvidia Corp. rallied 5%. Boeing Co. extended its 2024 losses to 30%. Treasuries remained lower after a $39 billion sale of 10-year notes and a growing slate of new corporate bonds.For a glimpse of how traders were on guard before Tuesday’s CPI print, consider the Cboe One-Day Volatility Index — a measure of cost in S&P 500 options with maturities of no more than 24 hours. The gauge closed Monday at the highest level since October, a sign of heightened anxiety.It has since pulled back, along with its more famous 30-day volatility index known as the VIX.Story continuesOn Monday, the options market was more concerned about a potentially big S&P 500 move post-CPI than it was about the Fed’s rate decision next week, Citigroup analysts said. That was based on a strategy known as an at-the-money straddle — when a trader buys an equal number of calls and puts with the same strike price and expiration.Following a few swings in the immediate aftermath of the CPI results, a relative sense of calm in equities prevailed — for the most part — on Tuesday.“Today’s report suggests that while the last mile towards 2% has become a bit longer, the underlying report offers a modicum of hope that by June or certainly July the Fed should feel more comfortable that they’re increasingly closer to their destination,” said Quincy Krosby at LPL Financial.While the CPI reading may breathe new life into the sticky inflation narrative, whether it actually delays rate cuts is a different story, according to Chris Larkin at E*Trade from Morgan Stanley.“Sticky doesn’t necessarily mean overheating,” Larkin noted.To Bret Kenwell at eToro, regardless of whether the inflation print is ideal, investors mostly want to know whether they can count on what’s expected — and right now, that’s for a June rate cut.Indeed, the inflation reading did little to alter traders’ conviction that the Fed will shift to cutting interest rates this year. Futures are pricing in nearly 70% odds that the central bank will start easing in June and enact at least three quarter-point cuts over the course of 2024“The Fed usually cuts interest rates to get ahead of an impending economic slowdown, and with the economy running so strong currently, it’s difficult to justify any rate cuts,” said Skyler Weinand at Regan Capital. “Still, the Fed is likely to cut interest rates one or two times this year, as an acknowledgement that inflation has meaningfully decelerated, even if it’s not quite fully back to its 2% target.”The Fed is widely expected to hold interest rates steady for a fifth straight meeting when policymakers gather March 19-20. Much of the focus by investors will be on the Federal Open Market Committee’s quarterly forecasts for rates, including whether fresh employment and inflation figures have prompted any changes.While the stock market is rallying, the yield curve remains inverted, which suggests that there are plenty of investors who are still concerned about economic conditions this year, said Weinand at Regan Capital.“While a recession would naturally steepen out the yield curve to positive territory, we think the yield curve can steepen this year without a recession, as investors will eventually realize that we can achieve a soft landing and that sentiment shift can push 10-year Treasury bond yields back above 2-year Treasury bond yields,” he noted.Corporate Highlights:3M Co. named aerospace veteran William Brown as its new chief executive officer, a move aimed at providing fresh direction for a company mired in mounting legal liabilities and a much-diminished stock price.Boeing Co.’s aircraft deliveries trailed rival Airbus SE’s last month as the US planemaker dealt with the growing fallout from an early-January accident that has since plunged the company into crisis.United Airlines Holdings Inc. has told Boeing to stop building 737 Max 10 jets for the carrier, opting to switch to a smaller variant and the rival Airbus SE A321 until the US planemaker can pull the stretched single-aisle through its long-delayed certification.Southwest Airlines Co. plans to cut capacity this year, halt most hiring and review its spending plans in response to reduced aircraft deliveries from Boeing Co., the planemaker facing regulatory and criminal investigations in the wake of a near-catastrophic accident in January.Kohl’s Corp. reported same-store sales in the fourth quarter that missed the average analyst estimate, suggesting the department store chain struggled to attract shoppers during the crucial holiday shopping season.Key events this week:Eurozone industrial production, WednesdayECB Governing Council member Yannis Stournaras speaks, WednesdayVolkswagen, Adidas earnings, WednesdayUS PPI, retail sales, initial jobless claims, business inventories, ThursdayChina property prices, FridayJapan’s largest union federation announces results of annual wage negotiations, just ahead of Bank of Japan policy meeting, FridayBank of England issues inflation survey, FridayUS industrial production, University of Michigan consumer sentiment, Empire Manufacturing, FridaySome of the main moves in markets:StocksThe S&P 500 rose 0.8% as of 1:38 p.m. New York timeThe Nasdaq 100 rose 1%The Dow Jones Industrial Average rose 0.4%The MSCI World index rose 0.7%CurrenciesThe Bloomberg Dollar Spot Index rose 0.2%The euro was little changed at $1.0918The British pound fell 0.3% to $1.2780The Japanese yen fell 0.5% to 147.75 per dollarCryptocurrenciesBitcoin fell 2.9% to $70,051.73Ether fell 2.8% to $3,920.71BondsThe yield on 10-year Treasuries advanced six basis points to 4.16%Germany’s 10-year yield advanced three basis points to 2.33%Britain’s 10-year yield declined three basis points to 3.95%CommoditiesWest Texas Intermediate crude was little changedSpot gold fell 1% to $2,159.93 an ounceThis story was produced with the assistance of Bloomberg Automation.--With assistance from Lu Wang, Felice Maranz, Michael Mackenzie, Ye Xie and David Marino.Most Read from Bloomberg BusinessweekGold-Medalist Coders Build an AI That Can Do Their Job for ThemAcademics Question ESG Studies That Helped Fuel Investing BoomLuxury Postnatal Retreats Draw Affluent Parents Around the USHow Apple Sank About $1 Billion a Year Into a Car It Never BuiltPrimaries Show Candidates Can Win on TikTok But Lose at the Polls©2024 Bloomberg L.P."
etf.com,Active Stock Funds Largely Lose to Index Funds: SPIVA,https://finance.yahoo.com/news/active-stock-funds-largely-lose-184803927.html,"Large cap, active equity funds have beaten less expensive index funds over a 15-year period, new report finds.","outperform - investment - comparison - graphWhile active management has surged in popularity, funds focused on large cap stocks fail to beat their cheap, broad index counterparts despite costly, complex management techniques aimed at outperformance, a new report has found.Sixty percent of large cap active exchange-traded and mutual funds failed to beat the S&P 500, according to the 2023 S&P 500 Indexes Versus Active scorecard (SPIVA), published March 6. That was a slight improvement from the 64% rate in 2022, yet far behind 2021, when 51% of large cap active funs underperformed the index.""At the 15-year horizon in both asset classes, there were no categories in which the majority of active managers outperformed,“ the report stated. Still, the situation might have been worse, according to S&P DJI’s Head of U.S. Index Investment Strategy Anu Ganti who wrote in a statement that ""this figure was better than might have been expected given the dominance of the U.S. equity market’s largest stocks.""The biggest actively managed ETF, JPMorgan Equity Premium Income ETF (JEPI), which invests in large cap stocks and equity-linked notes, has lagged broad index funds like the SPDR S&P 500 ETF Trust (SPY). JEPI, with a management fee of 0.35%, has gained 19% over the past year compared with a 35% gain in SPY, which charges a far lower 0.09%.Active ETF Assets Low But GrowingActive ETFs have become favorites of financial advisors and retail investors alike, largely because they are cheaper than active mutual funds and can deliver complex strategies as easy-to-trade ETFs. Asset ETFs grew 37% in 2023, compared to only an 8% growth rate in their passive counterparts, according to Morningstar. Yet overall money in active ETFs pales in comparison to active. Active funds have total assets of $549 billion in 1,349 different products, making up only 6% of the total $8.3 trillion U.S. ETF market.Market volatility may contribute to better performance of active strategies, as was the case in 2022, when large-cap equity active funds had their best performance year since 2009, according to S&P 500 Global. Yet in 2023’s bull market, which saw the S&P 500 gain 24% over the year, the index edged out other funds.Story continuesIn international equities, the overall underperformance rate was higher—74%. Yet in both U.S. and international equities, small cap funds fared better. Only 54% of international small cap funds underperformed, while 48% U.S. equity small caps underperformed the S&P SmallCap 600.In the fixed income category, performance of active funds varied largely across categories. Overall, fixed income funds had an underperformance rate of 59%, according to SPIVA.Contact Lucy Brewster at lucy.brewster@etf.com.Permalink | © Copyright 2024 etf.com. All rights reserved"
WWD,Paris Trade Shows Look to Sweet Spots During a Challenging Market,https://finance.yahoo.comhttps://www.yahoo.com/lifestyle/paris-trade-shows-look-sweet-183916254.html,"Buyers at Première Classe, Tranoï and Woman were looking for a balance between commercial and statement pieces.",
Bloomberg,Ex-Wall Street Banker Takes On AOC in New York Democratic Primary,https://finance.yahoo.com/news/ex-wall-street-banker-takes-141906243.html,"(Bloomberg) -- A Wall Street veteran is mounting a long-shot challenge to US Representative Alexandria Ocasio-Cortez in New York’s June 25 Democratic primary, marking the first intra-party battle she’s faced in four years. Most Read from BloombergOne of the Most Infamous Trades on Wall Street Is Roaring BackStock Traders Bracing for Worst Shrug Off Hot CPI: Markets WrapUS Core Inflation Tops Forecasts Again, Reinforcing Fed CautionChina Has Never Canceled This Many Shipments of US WheatNY Says T","(Bloomberg) -- A Wall Street veteran is mounting a long-shot challenge to US Representative Alexandria Ocasio-Cortez in New York’s June 25 Democratic primary, marking the first intra-party battle she’s faced in four years.Most Read from BloombergOne of the Most Infamous Trades on Wall Street Is Roaring BackChina Has Never Canceled This Many Shipments of US WheatStock Traders Bracing for Worst Shrug Off Hot CPI: Markets WrapBoeing Whistleblower Who Raised Safety Concerns Found DeadMartin W. Dolan, 66, who spent 30 years working for Jefferies Financial Group Inc., Morgan Stanley and other financial firms, formally registered a campaign committee this week to run against Ocasio-Cortez. He now begins a month-long sprint to gather the necessary signatures to land a spot on the ballot for the 14th congressional district, which includes parts of northern Queens and the Bronx.Dolan said he’s running because the congresswoman, the 34-year-old standard-bearer for the left wing of the Democratic Party, is too progressive, even for New York City. He said she’s sacrificed economic pragmatism at the altar of political ideology.“I call it a referendum on common sense,” said Dolan, who’s harbored an interest in running for office since volunteering as a driver for former New York Representative Peter Peyser in the 1970s.Dolan oversaw the financial institutions group at Bank of Nova Scotia until 2020, and spent much of his previous career as an insurance banker. Most recently, he’s worked as an adviser through his own firm, Dolan & Co.Challenging Ocasio-Cortez wasn’t his first choice. In October, Dolan registered to run against Democratic Representative Jamaal Bowman in the 16th congressional district, which covers parts of the Bronx and Westchester County. Like Ocasio-Cortez, Bowman is a member of the so-called Squad, the unofficial group of eight, nonwhite progressive Democratic representatives who have won elections since 2018.Story continuesDolan changed his plans after Westchester County Executive George Latimer entered the race against Bowman in December, immediately drawing significant endorsements and campaign cash.His rationale for running against Ocasio-Cortez is the same as the reason for challenging Bowman. But the odds against Dolan are steep.There’s little sign that Ocasio-Cortez, one of the most well-known, admired — and polarizing — members of Congress, faces real vulnerability in her ethnically diverse and progressive district, where Democrats outnumber Republicans by 8 to 1. The winner of the primary is almost certainly assured of victory in November’s general election.Her campaign had $5.7 million in cash on hand as of Jan. 1, while Dolan’s campaign has raised just $58,000 so far, $55,000 of which is from loans Dolan made to his own campaign.Making HistoryOcasio-Cortez became the youngest woman ever elected to Congress at age 29 after winning an upset primary victory over former longtime Representative Joe Crowley in 2018, and has handily won reelection in subsequent contests. She amassed 74.6% of the vote against Michelle Caruso-Cabrera in 2020, the last time she faced a primary challenge.And Dolan, who resides in Dobbs Ferry in Westchester County, doesn’t actually live in NY-14, a potential liability even though candidates aren’t required to live in a district to run in a redistricting year. Dolan said he will move there if he wins the primary.Ocasio-Cortez has her own vulnerabilities, Dolan said.He specifically called out her vocal opposition to Amazon.com Inc.’s 2018 plans to locate a new headquarters in Long Island City, Queens, a deal that fell apart after the company voluntarily abandoned the plan amid widespread local criticism.Dolan blasted Ocasio-Cortez’s support for diversity, equity and inclusion initiatives. DEI has recently morphed into a political flashpoint, as corporations pull back initiatives implemented in the wake of protests following George Floyd’s 2020 murder, though criticism has more often come from Republicans.Migrant IssueHe also accused the lawmaker of “importing immigrants and exporting decent contributing taxpayers,” he said, referring to residents who have fled to Florida and other states. The immigration issue has become ubiquitous in New York over the past year as city and state leaders grapple with how to house, feed and care for the nearly 180,000 migrants who’ve arrived in the city since 2022.“There’s been nobody who’s more in favor of immigration than AOC, and there’s been no worse thing that’s happened in New York in the last year,” Dolan said.Ocasio-Cortez’s campaign declined to comment.Dolan’s platform includes plans to advocate for a new federal value-added tax and an additional luxury goods sales tax. The money would be used to reduce the national debt, state pension liabilities and would allow states like New York to lower income taxes. The plan would help New York stave off decades of population loss that have diluted its power and representation in Congress, he argued.Dolan said that while Ocasio-Cortez may be a political star in the Democratic Party, he has a shot at winning because her track record in the district is thin.“There’s a lot of people who, even in Queens and the Bronx, think, ‘What has she done for us?’” Dolan said.Most Read from Bloomberg BusinessweekAcademics Question ESG Studies That Helped Fuel Investing BoomLuxury Postnatal Retreats Draw Affluent Parents Around the USGold-Medalist Coders Build an AI That Can Do Their Job for ThemHow Apple Sank About $1 Billion a Year Into a Car It Never BuiltPrimaries Show Candidates Can Win on TikTok But Lose at the Polls©2024 Bloomberg L.P."
Motley Fool,"Why SoundHound AI, Nvidia, and Other Artificial Intelligence (AI) Stocks Rallied Today",https://finance.yahoo.com/news/why-soundhound-ai-nvidia-other-182435912.html,Better-than-expected results from an unlikely quarter helped boost other stocks in the space.,"There's little question that the catalyst that sparked the current bull market rally is artificial intelligence (AI). The AI gold rush that kicked off last year is gathering steam, but market watchers continue to question the resilience of this upward momentum. However, robust results from one company provided a lift for a number of AI stocks.With that as a backdrop, audio AI specialist SoundHound AI (NASDAQ: SOUN) surged 13.6%, chipmaker Nvidia (NASDAQ: NVDA) climbed 4.9%, and social media maven Meta Platforms (NASDAQ: META) climbed 2.4%, as of 1:47 p.m. ET.A check of all the usual suspects -- financial reports, regulatory filings, and changes to analysts' price targets -- turned up nothing in the way of catalysts to explain the move higher. This seems to suggest that it was the results of another company that drove AI stocks upward.Image source: Getty Images.Evidence the adoption of AI is spreadingThe catalyst that seems to have sparked a rally among AI stocks was a surprisingly strong earnings report from database specialist Oracle (NYSE: ORCL). The results provided evidence that demand for AI is spreading.For its fiscal 2024 third quarter (ended Feb. 29), Oracle reported revenue of $13.3 billion, which grew 7% year over year, resulting in adjusted earnings per share (EPS) of $1.41, up 16%. While that might not seem like much to write home about, the devil is in the details, with two items of particular interest.Oracle's cloud revenue was the headliner, growing 25% year over year to $5.1 billion. Even more impressive was the company's cloud infrastructure results, which climbed 52% year over year. This outpaced the growth of Amazon Web Services, Alphabet's Google Cloud, and Microsoft Azure -- also known as the ""Big Three"" cloud providers -- which grew 13%, 26%, and 30%, respectively. This suggests that either Oracle took market share from its closest cloud competitors, or that demand for cloud services is growing -- though both could be true.Story continuesFurthermore, the company's remaining performance obligation (RPO), or contractually obligated sales not yet booked as revenue, surged 29% to $80 billion. Since RPO gives insight in future revenue trends, this suggests Oracle's sales growth seems destined to continue.Oracle CEO Safra Catz also noted that AI cloud capacity ""substantially exceeds supply."" As a result, Oracle is ""opening new and expanding existing cloud data centers very, very rapidly.""The chief executive also noted the company recently signed a ""big Generation 2 cloud infrastructure contract with Nvidia"" in the third quarter, but also hinted there's more on the docket. ""We expect to have some very nice joint announcements with Nvidia next week"" during Nvidia's GPU Technology Conference (GTC).This all but confirms that it was the accelerating demand for AI that boosted Oracle's results, which has broader implications for other companies in the AI space.Profiting from AIWe're only just beginning to comprehend just how prevalent generative AI will be, but these highlighted companies have each carved out a niche for themselves in the AI gold rush:SoundHound AI creates AI-powered voice and audio solutions serving the restaurant and automotive industries. The company's tools can be used for restaurant drive-thrus, phone banks, and self-serve kiosks, among others.Nvidia provides the graphics processing units (GPUs) with the computational horsepower required by AI systems. The company has generated triple-digit year-over-year sales growth in each of the preceding three quarters thanks to growing demand for AI.Meta Platforms has long used AI to advance its business, surfacing relevant content to its social media users, as well as directing its targeted advertising efforts. Meta also developed LLaMA AI, one of the most in-demand large language models available on the major cloud infrastructure sites.Each of these stocks is relatively inexpensive, depending on your favored valuation metric. Meta and Nvidia currently sell for 25 times and 36 times forward earnings, respectively, making them the standout choices -- particularly given their history of strong growth. SoundHound AI isn't yet profitable and sells for 20 times sales, making it more expensive and certainly riskier.The trend toward AI adoption is unmistakable, offering investors plenty of ways to profit from the AI revolution.Should you invest $1,000 in SoundHound AI right now?Before you buy stock in SoundHound AI, consider this:The Motley Fool Stock Advisor analyst team just identified what they believe are the 10 best stocks for investors to buy now… and SoundHound AI wasn’t one of them. The 10 stocks that made the cut could produce monster returns in the coming years.Stock Advisor provides investors with an easy-to-follow blueprint for success, including guidance on building a portfolio, regular updates from analysts, and two new stock picks each month. The Stock Advisor service has more than tripled the return of S&P 500 since 2002*.See the 10 stocks*Stock Advisor returns as of March 11, 2024Suzanne Frey, an executive at Alphabet, is a member of The Motley Fool’s board of directors. Randi Zuckerberg, a former director of market development and spokeswoman for Facebook and sister to Meta Platforms CEO Mark Zuckerberg, is a member of The Motley Fool's board of directors. John Mackey, former CEO of Whole Foods Market, an Amazon subsidiary, is a member of The Motley Fool’s board of directors. Danny Vena has positions in Alphabet, Amazon, Meta Platforms, Microsoft, and Nvidia. The Motley Fool has positions in and recommends Alphabet, Amazon, Meta Platforms, Microsoft, Nvidia, and Oracle. The Motley Fool recommends the following options: long January 2026 $395 calls on Microsoft and short January 2026 $405 calls on Microsoft. The Motley Fool has a disclosure policy.Why SoundHound AI, Nvidia, and Other Artificial Intelligence (AI) Stocks Rallied Today was originally published by The Motley Fool"
