source,title,url,content,article
Motley Fool,1 Fintech Stock to Buy Hand Over Fist and 1 to Avoid,https://finance.yahoo.com/news/1-fintech-stock-buy-hand-180000433.html,"PayPal stock is a reasonable fit for growth investors, but there's another stock that should top your buy list.","PayPal (NASDAQ: PYPL) and Block (NYSE: SQ) are two of the most popular fintech stocks today. Both have market caps of about $50 billion to $60 billion. Both have strong histories of growth. And both have plenty of growth potential.One stock, however, is a much better buy today.PayPal bets $5 billion on itselfPayPal the company does not need much introduction. Spun off from parent company eBay in 2015, the company has amassed more than 400 million global users. From e-commerce transactions to paying back friends, almost everyone has either used PayPal personally or knows someone who has.PayPal the stock has a more volatile history.After its split from eBay, PayPal stock zoomed in value, from $40 per share to $300 per share in just three years. Since those all-time highs, however, the share price has cratered. PayPal shares now trade at 2017 prices.PYPL ChartPayPal stock now trades at just 2.2 times sales -- a popular valuation metric for growth stocks. That's the cheapest shares have ever been.Management has noticed the decline in valuation, opting to invest $5 billion in share repurchases. By buying back its own stock at discounted prices, the company hopes to double down on a turnaround.There's only one problem: PayPal has been here before. The company has already spent $15 billion in share repurchases since going public in 2015. These buybacks were executed at prices much higher than today, meaning they destroyed shareholder value.PayPal isn't going anywhere as a company, but don't be fooled into thinking the cheap valuation multiple is a clear buy signal. The reason the shares are cheap is that the company's best days of growth probably are behind it. In fact, its user base has been shrinking the past two years.The shares might be a worthwhile value at today's depressed prices, but there's a better choice for growth investors -- a stock with a turnaround story already in action.This is the fintech stock worth betting onBlock has faced its own struggles. The company -- traditionally a payment processor, but more recently an investor in other areas like the peer-to-peer payment service Cash App, music platform Tidal, and a host of blockchain-related ventures -- has similarly seen its stock price crater after a slowdown in growth and a drop in profitability.Story continuesOn a price-to-sales basis, Block stock is actually cheaper than PayPal, trading at 2.1 times sales. But as we'll see, the underlying business is much stronger.SQ ChartThe first advantage that Block has over PayPal is higher growth rates.Whereas PayPal's business is shrinking according to some metrics, most of Block's segments are experiencing strong growth. Block, for example, has 56 million monthly users on its Cash App. While growth has slowed significantly in recent quarters, the company continues to increase this user base.Continued user growth has allowed Block to maintain revenue gains that are much bigger than what PayPal has achieved, even during its days as a hot stock after becoming an independent company.SQ Revenue (Quarterly YoY Growth) ChartBlock is also better positioned for future growth.As the company's name suggests, Block has made big bets on emerging blockchain technologies like Bitcoin. Users of its Cash App can already buy, sell, and transact in Bitcoin. Its Square payment processing platform, meanwhile, is poised to bring cryptocurrency transactions to the masses. Whereas PayPal is defending a plateauing business model, Block is positioned to capitalize on growth trends like the adoption of cryptocurrencies.Why then is Block stock cheaper than PayPal?For most of PayPal's public history, the company has been profitable, racking up billions in free cash flow -- the reason it has been able to fund its historical share buyback programs.Block, meanwhile, has been unprofitable in recent years. When the shares spiked in 2020, however, the company had posted several quarters of profitability. This is what the market came to expect, until a string of quarterly losses sent the stock price tumbling.SQ EPS Diluted (Quarterly) ChartAs a whole, Block is less profitable than PayPal, but that's palatable as long as growth rates remain high. The market, after all, is willing to fund a rapidly growing company. When growth rates slow, however, the market suddenly becomes less willing to cover losses.Last September, Block co-founder Jack Dorsey rejoined Block as the chief executive officer with one mission: return the company to profitability. It didn't take long for this vision to be realized. In February, the company posted its first net profit in two years, albeit a small one.With a return to profitability, expect Block's valuation multiples to pick up, especially if this feat is repeated in subsequent quarters. A high-growth stock that's profitable, no matter how small, deserves a higher multiple than 2.1 times sales in this market.Between PayPal and Block, Block stock is the clear winner for investors right now.Should you invest $1,000 in Block right now?Before you buy stock in Block, consider this:The Motley Fool Stock Advisor analyst team just identified what they believe are the 10 best stocks for investors to buy now… and Block wasn’t one of them. The 10 stocks that made the cut could produce monster returns in the coming years.Stock Advisor provides investors with an easy-to-follow blueprint for success, including guidance on building a portfolio, regular updates from analysts, and two new stock picks each month. The Stock Advisor service has more than tripled the return of S&P 500 since 2002*.See the 10 stocks*Stock Advisor returns as of March 8, 2024Ryan Vanzo has positions in Bitcoin. The Motley Fool has positions in and recommends Bitcoin, Block, and PayPal. The Motley Fool recommends eBay and recommends the following options: short April 2024 $45 calls on eBay and short March 2024 $67.50 calls on PayPal. The Motley Fool has a disclosure policy.1 Fintech Stock to Buy Hand Over Fist and 1 to Avoid was originally published by The Motley Fool"
Motley Fool,"Walmart Stock: Buy, Sell, or Hold?",https://finance.yahoo.com/news/walmart-stock-buy-sell-hold-164200464.html,Is it to late to invest in the 800-pound gorilla of the retail sector?,"Walmart (NYSE: WMT) is one of the bellwethers of the global retail sector. It operates over 10,500 stores and numerous e-commerce sites across 19 countries, and that scale helped it survive the retail apocalypse that wiped out many other big-box retailers.From its fiscal 2019 to its fiscal 2024 (which ended in January), Walmart's annual revenue rose at a compound annual growth rate (CAGR) of 5% as its EPS grew at a CAGR of 21%. It achieved that steady growth even as the pandemic, supply chain disruptions, and inflationary headwinds rattled the broader retail sector.Image source: Walmart.Walmart's stock rallied by 85% over the past five years and delivered a total return of 101% after including reinvested dividends -- but does it still have room to run? Let's review the top arguments for buying, selling, or holding its stock.The reasons to buy or hold WalmartThe bulls still love Walmart because it's one of the few brick-and-mortar retailers that kept pace with Amazon (NASDAQ: AMZN) and other e-commerce leaders. It achieved that by upgrading its e-commerce and delivery capabilities, using its brick-and-mortar stores to fulfill online orders, and closely matching Amazon's prices.In its efforts to loosen Amazon Prime's grip on customers, Walmart also expanded its own Walmart+ subscription plan, which offers free deliveries, discounts, and a subscription to streaming service Paramount+. Its planned acquisition of the smart TV maker Vizio could complement that expansion and help it mount an offensive against Amazon's Fire TV set-top boxes and smart TVs.Furthermore, Walmart kept up with Costco in the warehouse club market with its Sam's Club stores, and it beefed up its overseas e-commerce presence by acquiring India's Flipkart and a stake in China's JD.com. Those bold moves set it apart from its rival Target (NYSE: TGT), which only operates in the U.S. and doesn't own a warehouse club chain.The bulls expect Walmart to continue growing. In fiscal 2024, its revenue rose 6%, driven by its 5.6% comparable-store sales growth (excluding fuel) in the U.S. and a 13.5% jump in its international sales. By comparison, Target's comps fell 3.7% in its fiscal 2023 (which ended in February), marking its first annual decline in seven years as it grappled with sluggish discretionary spending, theft and safety issues, and a boycott related to some of its Pride Month products.Story continuesFrom fiscal 2024 to fiscal 2026, analysts expect Walmart's revenue to rise at a CAGR of 4% as its EPS grows at a CAGR of 35%. Its stock still looks reasonably valued at 26 times forward earnings, its dividend offers a decent forward yield of 1.4%, and management has raised the payout annually for 51 consecutive years. It has also bought back nearly 40% of its shares over the past two decades.The reasons to sell WalmartThe bears believe Walmart's stock is historically expensive now -- it traded at less than 20 times earnings throughout most of the 2010s, and it's pricier than most of its industry peers. Target, for example, trades at just 18 times forward earnings.The bears will also point out that Walmart's insiders actually sold 86 times as many shares as they bought over the past 12 months. They also sold 64 times as many shares as they bought over the past three months. That chilly insider sentiment strongly suggests its valuations are getting ahead of its growth rates.Another issue is Walmart's dependence on China. It operates nearly 400 brick-and-mortar stores and multiple e-commerce platforms in China, and its stores in the U.S. and other markets rely heavily on Chinese suppliers for cheap products. Therefore, new trade restrictions and tariffs against China could disrupt its overseas business and squeeze its gross margins.Lastly, Walmart's expansion of its e-commerce, delivery, and digital media ecosystems to counter Amazon could further squeeze its operating margins. Amazon can rely on its high-margin cloud platform, Amazon Web Services, to subsidize its low-margin retail and digital media businesses. Walmart doesn't have a comparable profit engine.Its strengths still outweigh its weaknessesWalmart might face some unpredictable challenges over the next few years, but its scale, diversification, and forward-thinking strategies should help it weather the macro and competitive headwinds. Those strengths -- along with its reputation as a safe-haven investment -- make it a great stock for long-term investors to buy, hold, and forget.Should you invest $1,000 in Walmart right now?Before you buy stock in Walmart, consider this:The Motley Fool Stock Advisor analyst team just identified what they believe are the 10 best stocks for investors to buy now… and Walmart wasn’t one of them. The 10 stocks that made the cut could produce monster returns in the coming years.Stock Advisor provides investors with an easy-to-follow blueprint for success, including guidance on building a portfolio, regular updates from analysts, and two new stock picks each month. The Stock Advisor service has more than tripled the return of S&P 500 since 2002*.See the 10 stocks*Stock Advisor returns as of March 8, 2024John Mackey, former CEO of Whole Foods Market, an Amazon subsidiary, is a member of The Motley Fool's board of directors. Leo Sun has positions in Amazon. The Motley Fool has positions in and recommends Amazon, Costco Wholesale, JD.com, Target, and Walmart. The Motley Fool has a disclosure policy.Walmart Stock: Buy, Sell, or Hold? was originally published by The Motley Fool"
Motley Fool,Consumer Sales in China Are Still a Trouble Spot for This Dividend King. Here's What to Watch Out for Before You Buy the Stock,https://finance.yahoo.com/news/consumer-sales-china-still-trouble-161300737.html,"Hormel's business turned for the better in the fiscal first quarter of 2024, but China is still not performing as well as hoped.","Shares of Hormel Foods (NYSE: HRL) rose dramatically after it reported fiscal first-quarter 2024 earnings. There were very good reasons for this, but investors still need to dig into the details before they get too upbeat about the future of this iconic food maker. China is an important and lingering trouble spot.Hormel had a strong quarterWhen Hormel reported fiscal Q1 earnings, management proudly highlighted that volume grew 4% year over year. Since volume fell 4.2% in 2023, the Q1 results suggest that the food maker is at an important inflection point. Notably, volume rose in all three of the company's divisions, which include retail, food service, and international.Image source: Getty Images.The weakest performance was in the company's retail business, basically all of its U.S. business that isn't food service. Volume in this segment rose 2%. Foodservice, which has been performing relatively well, continued its strong performance, with volume up 8%. Outdistancing even that showing was Hormel's foreign business, with volume rising 11%.This is where things start to get a bit more interesting. Per the earnings release, foreign ""Segment profit increased due to the inclusion of our investment in Indonesia and significantly higher results from our partnership in the Philippines."" So, in some ways, that 11% improvement in volume wasn't exactly an apples-to-apples comparison.And more to the point here: ""...in China, foodservice results improved as we lapped COVID-related disruption last year. This benefit was more than offset by continued weakness in the retail channel."" This consumer staples maker's best-performing business on the volume front may not be quite as big a positive as it seems.Reading between the linesIf you had to summarize the foreign business' results, it would probably go something like this: Volumes grew thanks to the addition of a new business, but China is only just beginning to show signs of recovery. That's not terrible, but it certainly isn't good, either.Story continuesChina is a large and important global market, and Hormel has been investing heavily in the country. To put some numbers on that, it is the single-largest foreign market for Hormel, with 842 production facilities, 33 warehouses, and 26 corporate offices.While Hormel doesn't actually break out China as a percentage of its overall business, its presence in the country accounts for roughly two-thirds of its foreign properties. It is reasonable to assume that China is very important to Hormel's future. If you own Hormel, you need to keep an eye on the still-struggling China operations.The good news is that the Chinese market has reopened after a long closure related to the coronavirus pandemic. That's clearly resulted in a material improvement in the country's foodservice segment now that people are able to go out and about again. But they still aren't buying Hormel's products for their homes like they used to. Two things should be monitored here.First, investors need to remember that foodservice demand in China is likely coming off a very low base. So, the improvement is nice to see as an early sign of a turnaround, but the real questions are what happens through the rest of the year and what happens when these results are eventually lapped. Listen carefully to ensure China's food service business continues to grow.Second, and probably more important, Hormel needs to get people in China to buy its products again. That hasn't happened yet, and it is a worrying sign. It seems highly likely that Hormel will eventually figure out how to get this business back on track, but the longer it takes to do that, the worse it is for the company and investors. Watch what management says about Chinese customers over the next few quarters, too.Not huge, but important to the futureForeign sales make up only around 6% of Hormel's top line. China is a big part of that. While 6% isn't a massive figure, foreign expansion is expected to be an important long-term growth driver for the food maker. As such, long-term investors will want to closely monitor China's still-weak performance. If the company can't get back on track in China, it will be much harder to grow the business.Should you invest $1,000 in Hormel Foods right now?Before you buy stock in Hormel Foods, consider this:The Motley Fool Stock Advisor analyst team just identified what they believe are the 10 best stocks for investors to buy now… and Hormel Foods wasn’t one of them. The 10 stocks that made the cut could produce monster returns in the coming years.Stock Advisor provides investors with an easy-to-follow blueprint for success, including guidance on building a portfolio, regular updates from analysts, and two new stock picks each month. The Stock Advisor service has more than tripled the return of S&P 500 since 2002*.See the 10 stocks*Stock Advisor returns as of March 8, 2024Reuben Gregg Brewer has positions in Hormel Foods. The Motley Fool has no position in any of the stocks mentioned. The Motley Fool has a disclosure policy.Consumer Sales in China Are Still a Trouble Spot for This Dividend King. Here's What to Watch Out for Before You Buy the Stock was originally published by The Motley Fool"
Motley Fool,2 Telehealth Stocks to Buy Hand Over Fist in March,https://finance.yahoo.com/news/2-telehealth-stocks-buy-hand-153000015.html,"At combined market caps of less than $6 billion, these are a couple of dirt-cheap stocks to buy right now.",
Motley Fool,Better EV Stock: Rivian Automotive vs. Lucid Group,https://finance.yahoo.com/news/better-ev-stock-rivian-automotive-153000763.html,Which of these burned-out EV stocks has a brighter future?,"Rivian (NASDAQ: RIVN) and Lucid (NASDAQ: LCID) were two of the hottest EV stocks of 2021. Rivian, a maker of electric pickups, SUVs, and vans, went public at $78 in November of 2021, and its stock more than doubled to an all-time high of $172.01 a week after that. Lucid, a maker of luxury sedans, went public by merging with a special purpose acquisition company (SPAC) in July 2021; its stock opened at $25.24 and also more than doubled to its record high of $55.52 in November.But today, Rivian's stock trades at about $11 and Lucid is only worth $3 a share. The bulls retreated as both companies failed to meet their lofty production targets. Rising interest rates also compressed their valuations and cast a harsh light on their ugly balance sheets. So should investors buy either of these burned-out EV stocks as a turnaround play?Image source: Rivian.Rivian expects its production to flatten out this yearRivian produces three types of vehicles: the R1T pickup, the R1S full-size SUV, and a custom electric delivery van (EDV) for its leading investor, Amazon (NASDAQ: AMZN). Its next vehicle, the R2 midsize SUV, should hit the market in 2026.When Rivian went public, it claimed it could produce 50,000 vehicles in 2022. But it manufactured only 24,337 vehicles that year as it dealt with supply chain constraints, and it pushed back its target of 50,000 vehicles annually to 2023.It easily surpassed that goal by producing 57,232 vehicles -- but it expects to produce only 57,000 vehicles in 2024.Rivian predicts its production will remain stagnant this year as it deals with higher interest rates, a slower EV market, and the planned shutdown of its main plant in Normal, Illinois, for ""several weeks"" in the second quarter.The shutdown is to allow an upgrade its production rates by 30%, roll out new in-vehicle technologies for its R1 platform, and reduce its raw material costs. Analysts expect its revenue to only rise 10% to $4.9 billion in 2024 as it implements those changes.Story continuesAs sales growth slows down, it plans to boost its margins by building more vehicles with its in-house Enduro drive unit and laying off 10% of its workforce. But it only slightly narrowed its operating loss from $6.9 billion in 2022 to $5.7 billion in 2023, and analysts anticipate an operating loss of $4.8 billion in 2024.Rivian ended 2023 with $10.5 billion in liquidity, but it could quickly burn through that cash if it doesn't ramp up its production again over the next few years. On the bright side, the stock looks cheap at two times this year's sales -- and Amazon still hasn't sold its sinking shares of the EV maker.Lucid is struggling to scale up its businessLucid currently sells several versions of its Air luxury sedan, and it plans to launch its second vehicle, the Gravity SUV, in late 2024. During its pre-SPAC presentation, it claimed it could produce 20,000 vehicles in 2022 and 49,000 vehicles in 2023.In reality, it produced only 7,180 vehicles in 2022 and 8,428 in 2023. Like Rivian, Lucid struggled with supply chain constraints, high interest rates, and a weak EV market. The EV pricing war forced Lucid to slash its prices. It expects to produce only 9,000 vehicles in 2024.Yet Lucid continues to make bold claims regarding its future. In May 2022, CEO Peter Rawlinson set a goal of producing over 500,000 vehicles annually by 2025. He believes it can achieve that goal with the support of the Saudi Arabian government, which owns more than 60% of its shares through its Public Investment Fund (PIF).Unfortunately, the math doesn't add up. The planned expansion of its Arizona plant will only boost its annual production capacity to 90,000 vehicles by 2024, while its new Saudi Arabian plant -- which can only produce 5,000 vehicles this year -- might reach an annual capacity of 155,000 by the ""middle of the decade,"" management says. So even if everything goes right, the company would produce a maximum of only 245,000 vehicles annually by 2025.That fuzzy math is worrisome for a company that generated only $595 million in revenue with an operating loss of $3.1 billion in 2023. For 2024, analysts expect its revenue to rise 33% to $794 million as it slightly narrows its operating loss to $2.6 billion.That's not a bright outlook for a company with $4.6 billion in total liquidity, and its stock still doesn't seem like a screaming bargain at five times this year's sales.The better buy: RivianRivian and Lucid will probably remain out of favor this year as they both struggle to ramp up their production in a challenging market. But over the long term, Rivian still looks like a better investment than Lucid.It's producing more vehicles and losing less money on each vehicle. It isn't setting up its investors for disappointment with overly ambitious growth targets or depending heavily on overseas investors. And Rivian's stock looks a lot cheaper relative to its growth.Should you invest $1,000 in Rivian Automotive right now?Before you buy stock in Rivian Automotive, consider this:The Motley Fool Stock Advisor analyst team just identified what they believe are the 10 best stocks for investors to buy now… and Rivian Automotive wasn’t one of them. The 10 stocks that made the cut could produce monster returns in the coming years.Stock Advisor provides investors with an easy-to-follow blueprint for success, including guidance on building a portfolio, regular updates from analysts, and two new stock picks each month. The Stock Advisor service has more than tripled the return of S&P 500 since 2002*.See the 10 stocks*Stock Advisor returns as of March 8, 2024John Mackey, former CEO of Whole Foods Market, an Amazon subsidiary, is a member of The Motley Fool's board of directors. Leo Sun has positions in Amazon. The Motley Fool has positions in and recommends Amazon. The Motley Fool has a disclosure policy.Better EV Stock: Rivian Automotive vs. Lucid Group was originally published by The Motley Fool"
