source,title,url,content,article
Motley Fool,"Billionaire Dan Loeb Sold Amazon and Microsoft but Bought This ""Magnificent Seven"" Stock",https://finance.yahoo.com/news/billionaire-dan-loeb-sold-amazon-185000001.html,"The hedge fund manager's decision to increase his stake in one ""Magnificent Seven"" stock is already paying off handsomely.","Dan Loeb is known as a mover and a shaker in the investing world. He founded the New York-based hedge fund Third Point in 1995. It now has roughly $11.5 billion in assets under management. Loeb's net worth stands at $3.3 billion, according to Forbes.The activist investor did some moving and shaking in his hedge fund's portfolio in the fourth quarter of 2023. Loeb reduced his stakes in Amazon (NASDAQ: AMZN) and Microsoft (NASDAQ: MSFT). However, the billionaire investor bought another ""Magnificent Seven"" stock.Taking profitsLoeb sold 210,000 shares of Microsoft in Q4. While this reduced Third Point's stake in the tech giant by over 9.4%, Microsoft remains the second-largest holding in the hedge fund's portfolio.The billionaire investor has owned Microsoft off and on since 2006. He most recently initiated a new position in the fourth quarter of 2022, just in time to ride the generative AI wave started by OpenAI's launch of ChatGPT. Microsoft was a major beneficiary of this wave thanks to its partnership with OpenAI.Third Point first owned Amazon in late 2019 and held the stock through the second quarter of 2022. Loeb didn't stay on the sidelines long with the e-commerce and cloud services leader. He initiated a new position in Amazon in the second quarter of 2023. Although he reduced Third Point's stake in the stock by nearly 10.3% in Q4 2023, Amazon still ranks as the hedge fund's third-largest holding.Why did Loeb trim his positions in Amazon and Microsoft? The most likely reason is he wanted to take some profits. Both stocks delivered impressive gains last year.A bigger bet on MetaAlthough Loeb cooled somewhat on two Magnificent Seven stocks, he placed a bigger bet on Meta Platforms (NASDAQ: META). The hedge fund manager increased Third Point's stake in Meta by nearly 5.5% in Q4 2023. The $410.6 million value of the position made Meta the sixth-largest holding for Third Point at the end of 2023.Story continuesLoeb's history with Meta goes back to the second quarter of 2016 when he first bought the stock. He owned shares of the social media company for a little over two years before exiting the position. The activist investor again bought Meta stock in the second quarter of 2020 and maintained a position through 2021 Q4. Loeb went back to the well in the third quarter of 2023 with another new stake in Meta.Like Amazon and Microsoft, Meta enjoyed a generative AI tailwind last year. However, I suspect that wasn't Loeb's primary reason for adding to his position in the stock. Instead, my hunch is that Loeb liked Meta's moves to increase its profitability.Those efforts are paying off. Meta's earnings more than tripled year over year in 2023 Q4. Full-year profits jumped 69%.Did Loeb make the right moves?In one sense, Loeb went one for three with these Magnificent Seven transactions. Loeb's decision to increase Third Point's stake in Meta is already paying off. Meta stock has skyrocketed over 45% since the end of 2023. However, Amazon and Microsoft are also up by double-digit percentages year to date. Loeb could have made more money by holding his shares in both companies.However, trimming the positions in Amazon and Microsoft could still have been the right call for Loeb. Both stocks make up significant percentages of Third Point's portfolio. You can't blame any investor for wanting to ensure their holdings aren't overly concentrated in a handful of stocks.Over the long term, I think that Loeb -- and other investors -- will be well served by owning all three of these stocks. Amazon's and Microsoft's cloud businesses should continue to grow robustly thanks largely to AI. I like Meta's focus on business messaging and smart glasses with embedded AI assistants. I predict Amazon, Microsoft, and Meta will remain magnificent for a long time to come.Should you invest $1,000 in Meta Platforms right now?Before you buy stock in Meta Platforms, consider this:The Motley Fool Stock Advisor analyst team just identified what they believe are the 10 best stocks for investors to buy now… and Meta Platforms wasn’t one of them. The 10 stocks that made the cut could produce monster returns in the coming years.Stock Advisor provides investors with an easy-to-follow blueprint for success, including guidance on building a portfolio, regular updates from analysts, and two new stock picks each month. The Stock Advisor service has more than tripled the return of S&P 500 since 2002*.See the 10 stocks*Stock Advisor returns as of April 8, 2024John Mackey, former CEO of Whole Foods Market, an Amazon subsidiary, is a member of The Motley Fool's board of directors. Randi Zuckerberg, a former director of market development and spokeswoman for Facebook and sister to Meta Platforms CEO Mark Zuckerberg, is a member of The Motley Fool's board of directors. Keith Speights has positions in Amazon, Meta Platforms, and Microsoft. The Motley Fool has positions in and recommends Amazon, Meta Platforms, and Microsoft. The Motley Fool recommends the following options: long January 2026 $395 calls on Microsoft and short January 2026 $405 calls on Microsoft. The Motley Fool has a disclosure policy.Billionaire Dan Loeb Sold Amazon and Microsoft but Bought This ""Magnificent Seven"" Stock was originally published by The Motley Fool"
Motley Fool,Nvidia Is Not in a Bubble: You Should Be Buying This Artificial Intelligence (AI) Stock Hand Over Fist Before It Soars,https://finance.yahoo.com/news/nvidia-not-bubble-buying-artificial-181700375.html,"Nvidia investors should look at the bigger picture, which indicates that the stock could continue rallying in the long run.","Nvidia's (NASDAQ: NVDA) stunning artificial intelligence (AI) surge has left investors and analysts in awe. Shares of the chipmaker, which originally made its name as a manufacturer of graphics cards for personal computers (PCs), have jumped nearly sixfold since the beginning of 2023.However, this big jump has created doubts in certain corners of Wall Street that Nvidia stock may be in a bubble. From comparisons with the dot-com bubble of 1999 to a potential decline in AI-related demand for its chips, to its expensive valuation, there are multiple reasons why some believe that Nvidia is a bubble waiting to burst.But a closer look at the AI market in general and Nvidia in particular will illustrate why the company is far from being in a bubble.Why it isn't right to call Nvidia, and AI, a bubbleA stock market bubble is a ""significant run-up in stock prices without a corresponding increase in the value of the businesses they represent."" In a bubble, the valuation of a company is based on speculation instead of the actual fundamentals.However, if you take a closer look at how AI is driving productivity gains across multiple industries, it will become easier to understand that the adoption of this technology should ideally continue gaining momentum. For instance, Meta Platforms says that the integration of AI tools has led to an impressive jump of 32% in returns delivered by ad campaigns. Meanwhile, customer service associates are reportedly witnessing a 14% increase in productivity thanks to AI.Factories, on the other hand, are expected to witness a 30% to 50% jump in productivity in the future by integrating AI, according to Bain & Company. Investment bank UBS believes that AI could drive productivity growth of 2.5% this year, ahead of the Federal Reserve's estimate of 1.5%. Over the next three years, UBS is expecting AI to deliver 17% of productivity gains.Nvidia's chips are going to play a central role in driving these productivity gains across different industries. That's because AI models need to be trained using millions and billions of parameters before they can be deployed in the real world. These models are known as large language models (LLMs), and they are being deployed across multiple verticals from manufacturing to automotive to cloud computing.Story continuesTraining these LLMs requires massive computing power, which Nvidia's GPUs provide. This explains why companies have been queuing up to get their hands on Nvidia's flagship H100 processor, giving the chipmaker a monopoly-like position in the AI chip market with an estimated share of over 90%. The H100 sells for $25,000 to $30,000, and Nvidia reportedly makes a 1,000% profit on these cards as per Raymond James. This explains the outstanding growth in Nvidia's revenue and earnings.NVDA Revenue (Quarterly) ChartSo, the sharp jump in Nvidia's stock price is not based on speculation or euphoria, but it is backed by the eye-popping growth in the company's revenue and earnings. The good part is that Nvidia seems capable of sustaining its outstanding growth over the long run, and the U.S. government is likely to play a key role in helping it remain the dominant force in the AI chip market.A new grant by the U.S. government could help Nvidia maintain its AI supremacyNvidia's H100 processor, based on the Hopper architecture, commands solid pricing power, and that's not surprising given that it has been the go-to chip for customers looking to train AI models. As it turns out, the demand for this chip was so strong at one point that customers had to wait for as long as a year to get their hands on it.Nvidia is now set to bring a new chip architecture to the market, known as Blackwell. The B200 Blackwell graphics card, which will be the successor to the H100 once it is launched later this year, is reportedly going to deliver performance gains of 7x to 30x over the H100. Nvidia also claims that it will reduce energy consumption by up to 25x.This performance gain isn't surprising as Blackwell is reportedly going to be manufactured using a custom 4-nanometer (nm) node from Taiwan Semiconductor Manufacturing, popularly known as TSMC. For comparison, the Hopper-based H100 was manufactured using a custom 5nm process from TSMC. By shrinking the size of the process node, TSMC has allowed Nvidia to pack 208 billion transistors as compared to 80 billion transistors in the H100.These transistors are now packed more closely together on the chip, and as a result they deliver more computing power and generate less heat, thereby reducing electricity consumption. And now, TSMC has received a $6.6 billion grant from the U.S. government, along with a $5 billion low-cost loan facility, to build a third chip plant in Arizona.TSMC is expected to use these funds to build a 2nm chip plant. Given that Nvidia is expected to be one of the customers for TSMC's 2nm chips, which are expected to go into mass production in 2025, it won't be surprising to see the graphics specialist coming out with even more powerful AI graphics cards. This explains why analysts are expecting Nvidia's data center revenue to multiply nicely in the coming years.What's more, Nvidia's earnings are expected to increase at an annual rate of 35% for the next five years, as per consensus estimates. Based on the company's fiscal 2024 earnings of $12.96 per share, its bottom line could jump to $58.11 per share after five years.Nvidia has a five-year average forward earnings multiple of 39, which is slightly higher than its forward earnings multiple of 36. But even if Nvidia trades at a discounted 27 times forward earnings after five years (in line with the Nasdaq-100's forward earnings multiple, as a proxy for tech stocks), its stock price could jump to $1,569. That would be an 85% increase from current levels.However, don't be surprised to see this AI stock delivering stronger gains. Nvidia can outpace Wall Street's earnings growth expectations and the market could continue rewarding it with a premium valuation as its product development moves should ideally help it remain the top player in the lucrative AI chip market.Should you invest $1,000 in Nvidia right now?Before you buy stock in Nvidia, consider this:The Motley Fool Stock Advisor analyst team just identified what they believe are the 10 best stocks for investors to buy now… and Nvidia wasn’t one of them. The 10 stocks that made the cut could produce monster returns in the coming years.Consider when Nvidia made this list on April 15, 2005... if you invested $1,000 at the time of our recommendation, you’d have $540,321!*Stock Advisor provides investors with an easy-to-follow blueprint for success, including guidance on building a portfolio, regular updates from analysts, and two new stock picks each month. The Stock Advisor service has more than quadrupled the return of S&P 500 since 2002*.See the 10 stocks »*Stock Advisor returns as of April 8, 2024Randi Zuckerberg, a former director of market development and spokeswoman for Facebook and sister to Meta Platforms CEO Mark Zuckerberg, is a member of The Motley Fool's board of directors. Harsh Chauhan has no position in any of the stocks mentioned. The Motley Fool has positions in and recommends Meta Platforms, Nvidia, and Taiwan Semiconductor Manufacturing. The Motley Fool has a disclosure policy.Nvidia Is Not in a Bubble: You Should Be Buying This Artificial Intelligence (AI) Stock Hand Over Fist Before It Soars was originally published by The Motley Fool"
Motley Fool,"A Once-in-a-Generation Investment Opportunity: 1 Top Artificial Intelligence (AI) Stock to Buy Hand Over Fist in April Before It Surges 55%, According to 1 Wall Street Analyst",https://finance.yahoo.com/news/once-generation-investment-opportunity-1-180500565.html,Palantir came onto the scene in 2023 following a successful launch into the world of artificial intelligence (AI).,"The excitement around artificial intelligence (AI) is fueling the markets to new heights. Both the S&P 500 and Nasdaq Composite have eclipsed new records in just the first few months of the year.Much of these gains are thanks to the ""Magnificent Seven"" -- a catchy moniker used to describe the world's largest companies including Microsoft, Apple, Nvidia, Alphabet, Amazon, Tesla, and Meta Platforms. But savvy investors understand that there are plenty of other opportunities in the AI realm besides megacap tech.One company that's emerging as a leader is big data analytics software company Palantir Technologies (NYSE: PLTR). 2023 was a breakout year for the company as it released its fourth major product: the Palantir Artificial Intelligence Platform (AIP).AIP's smashing success helped accelerate Palantir's revenue and profits -- and investors took notice. But with shares up nearly 180% in the last year, is it too late to buy the company's stock?Wedbush Securities analyst Dan Ives thinks the stock has much more room to grow. His price target of $35 per share implies roughly 59% upside from the company's current trading levels, as of market close on April 10.Read on to discover why scooping up shares in Palantir could be a lucrative opportunity right now.The rise of the Palantir Artificial Intelligence PlatformFor many years, Palantir sold three core software products: Apollo, Gotham, and Foundry. But last April, it quietly announced its foray into artificial intelligence (AI) following the release of AIP. But AIP's launch was largely overshadowed by the moves big tech was making -- including investments in ChatGPT developer OpenAI and its competitors.In order to spread the word about AIP, Palantir resorted to a creative lead generation strategy. Namely, the company began hosting immersive seminars called ""boot camps."" During these sessions, prospective customers were able to demo Palantir's various software platforms. The idea behind this was to show off Palantir's tech chops in a tangible way while simultaneously helping business leaders identify and form a use case surrounding artificial intelligence (AI).Story continuesSince the beginning of this campaign, Palantir has hosted over 850 boot camps. Moreover, AIP customers have publicly demonstrated how the product is being used to uncover new insights across myriad applications.While AIP has only been commercially available for about a year, its initial success is encouraging. Palantir increased its customer count by 35% year over year in 2023 and is making progress in the private sector. During the fourth quarter alone, the company grew its U.S. commercial revenue operation by a sizzling 70%.Image source: Getty ImagesThe journey is just getting startedSure, accelerating revenue is always nice to see. For Palantir, it's particularly meaningful because the company has gotten some pushback from Wall Street skeptics over the years -- many of whom see the company as too reliant on lumpy government deals with the U.S. Military and its Western allies.However, AIP is proving that Palantir has legitimate tech capabilities that are attracting customers from a whole host of industries outside of the public sector. Considering big tech's pulse within the overall AI landscape, Palantir is proving that it can compete with the biggest companies.I see 2023 as the first chapter in a long story in the AI narrative for the company. It's moving fast, and other behemoths in tech are eager to work with Palantir AIP. It's well-positioned to continue generating robust revenue growth while maintaining a healthy profitability profile and strong balance sheet.A premium valuation that's well worth the priceThe chart below illustrates Palantir benchmarked against a cohort of other leading AI software-as-a-service (SaaS) businesses on a price-to-sales (P/S) basis. At a P/S of 23.1, Palantir is the most expensive stock among this peer set, based on that metric.PLTR P/S Ratio data by YCharts.Palantir's valuation multiples expanded dramatically following its jaw-dropping fourth-quarter earnings report in February. Since then, the stock has experienced some momentum and is only now starting to take a breather.Further, it's not just revenue growth that's impressive for Palantir. The company's entire financial picture is strong. The success of the boot camps has allowed Palantir to keep expenses in sales and marketing relatively low. As such, the company is consistently profitable -- unlike many of its competitors.In 2023, Palantir expanded its operating margin by 6%. This dropped right to the bottom line, as the company generated $730 million of free cash flow in 2023 -- up more than threefold year over year.With shares trading at such a premium compared to the competition, investors may be tempted to sell and book some profits. But I'd encourage investors to zoom out and look at the bigger picture.While AIP has served as a catalyst for Palantir's business and played an influential role in the excitement pushing the stock higher, the company's shares are still down 40% from their all-time highs. Now is a terrific time to scoop up shares, as Palantir continues taking advantage of the long-term secular themes in AI.Using dollar-cost averaging is a prudent strategy to initiate a position or add to an existing one. With so much potential upside, it's hard to glance over Palantir.Should you invest $1,000 in Palantir Technologies right now?Before you buy stock in Palantir Technologies, consider this:The Motley Fool Stock Advisor analyst team just identified what they believe are the 10 best stocks for investors to buy now… and Palantir Technologies wasn’t one of them. The 10 stocks that made the cut could produce monster returns in the coming years.Consider when Nvidia made this list on April 15, 2005... if you invested $1,000 at the time of our recommendation, you’d have $540,321!*Stock Advisor provides investors with an easy-to-follow blueprint for success, including guidance on building a portfolio, regular updates from analysts, and two new stock picks each month. The Stock Advisor service has more than quadrupled the return of S&P 500 since 2002*.See the 10 stocks »*Stock Advisor returns as of April 8, 2024Suzanne Frey, an executive at Alphabet, is a member of The Motley Fool’s board of directors. John Mackey, former CEO of Whole Foods Market, an Amazon subsidiary, is a member of The Motley Fool’s board of directors. Randi Zuckerberg, a former director of market development and spokeswoman for Facebook and sister to Meta Platforms CEO Mark Zuckerberg, is a member of The Motley Fool's board of directors. Adam Spatacco has positions in Alphabet, Amazon, Apple, Meta Platforms, Microsoft, Nvidia, Palantir Technologies, and Tesla. The Motley Fool has positions in and recommends Alphabet, Amazon, Apple, Datadog, Meta Platforms, Microsoft, MongoDB, Nvidia, Oracle, Palantir Technologies, Salesforce, ServiceNow, Snowflake, and Tesla. The Motley Fool recommends the following options: long January 2026 $395 calls on Microsoft and short January 2026 $405 calls on Microsoft. The Motley Fool has a disclosure policy.A Once-in-a-Generation Investment Opportunity: 1 Top Artificial Intelligence (AI) Stock to Buy Hand Over Fist in April Before It Surges 55%, According to 1 Wall Street Analyst was originally published by The Motley Fool"
