source,title,url,content,article
Motley Fool,"A Bull Market Is Here: 3 Stocks to Buy With $1,000",https://finance.yahoo.com/news/bull-market-3-stocks-buy-151700725.html,"From e-commerce to travel, these leading brands will prosper in a growing economy.","It's safe to say a new bull market is underway. The S&P 500 index is up 25% over the last 12 months and hit new highs to start the year. Because bull markets usually last a lot longer than bear markets, investing in the right growth stocks could pay off over the next five years.The most important thing is to invest in solid companies that are almost certain to keep growing for many years due to a competitive advantage or industry tailwind.If you have $1,000 sitting around and don't need it for more important things like paying off high-interest debt, here's why Amazon (NASDAQ: AMZN), Lululemon Athletica (NASDAQ: LULU), and Hyatt Hotels (NYSE: H) are great stocks to buy.1. AmazonAmazon's business is gaining momentum. Revenue growth from its online stores improved in each quarter last year. Since bottoming out, the stock has rallied 84% over the past year, but there is much more upside in store for shareholders as management focuses on reducing costs and boosting the company's profits.Amazon spent tens of billions of dollars over the last 20 years building a massive footprint of fulfillment infrastructure for its online retail business. Management says it built a transportation network the size of UPS in just 18 months to handle the surge of orders during the pandemic. While this cost a lot of money and sent the company's profits down, it is now starting to reap the benefits of that investment.As the old saying goes, stocks follow earnings over the long term. Amazon's operating income (earnings before interest and taxes) skyrocketed 383% year over year in the fourth quarter to more than $13 billion. Head count reductions and slow hiring over the last 12 months have contributed to increased profitability, but management seems eager to trim costs in even more ways.On the latest earnings call this month, CEO Andy Jassy said executives see ""meaningful upside"" to lowering the costs to serve customers. This involves getting more efficient in how it locates inventory to speed up delivery, in addition to seeing some of the inflationary costs that hurt many companies in 2022 start to come down.Story continuesStreet consensus estimates show Amazon growing earnings per share at an annualized rate of 24%. This means if the stock is still trading at a forward price-to-earnings (P/E) ratio of 41 by 2030, investors could see their investment triple in value. Even if the stock's valuation comes down closer to the market average of around 25, that would still leave enough upside to potentially double the value of the shares.2. Lululemon AthleticaLululemon's growth over the last decade has been stellar, primarily reflecting the resilience of the athletic apparel market.The company's annual revenue has more than doubled from pre-pandemic levels, and it continues to grow in line with that trend. Revenue jumped 19% year over year in the quarter ending in October. Increasing demand for athletic wear, which has been on an upward trajectory for decades, and international expansion are the biggest tailwinds supporting Lululemon's rising stock price.The athletic wear industry is valued at over $200 billion, according to Statista, and it continues to expand. Lululemon is benefiting from its premium brand positioning and sophisticated online shopping experience.Lululemon is constantly refreshing its assortment to keep demand up, but it also continues to benefit from core styles that have become perennial best-sellers, such as the men's ABC pant and the women's Align. The brand is still in the early innings of growth, as international revenue soared an impressive 49% year over year last quarter.Analysts project long-term earnings growth of 16% on an annualized basis. Assuming the company meets those expectations, which are consistent with management's goals, and the stock continues to trade at a forward P/E of 31 -- within its past trading range -- investors can expect to double their money by 2030.3. Hyatt HotelsHyatt is the leading brand in the luxury resort market that could deliver excellent returns for shareholders as travel demand continues to increase. In fact, the travel industry is expected to grow to over $1 trillion by 2027, according to Statista.The key to appreciating Hyatt as a wonderful investment lies in how it generates revenue. While the hotel-chain gets some sales from owned hotels and room rentals, it primarily makes money from fee-based revenue, licensing, and other services. Hyatt sells third-party owners and franchisees the right to use Hyatt's intellectual property. This strategy lends itself to a profitable business that, when combined with a growing industry tailwind, drives shareholder returns.Hyatt's free cash flow has more than doubled since 2017, and management continues to redirect those resources into expanding the number of rooms available in order to increase revenue. It has led the industry in net room growth over the last six years, and management sees more opportunities to enter new markets to expand further.One opportunity is the Asia-Pacific region. Revenue-generating fees in this region soared 51% year over year in the fourth quarter. Hyatt also announced an agreement with the Hangzhou Trade and Tourism Group to develop over 60 hotels in China.Analysts expect Hyatt to increase earnings by 10% on an annualized basis. Management is making moves to boost the percentage of profits coming from high-margin fees, including selling owned hotels to reinvest in more profitable areas of the company. These decisions should continue to drive attractive returns for investors.Should you invest $1,000 in Amazon right now?Before you buy stock in Amazon, consider this:The Motley Fool Stock Advisor analyst team just identified what they believe are the 10 best stocks for investors to buy now… and Amazon wasn’t one of them. The 10 stocks that made the cut could produce monster returns in the coming years.Stock Advisor provides investors with an easy-to-follow blueprint for success, including guidance on building a portfolio, regular updates from analysts, and two new stock picks each month. The Stock Advisor service has more than tripled the return of S&P 500 since 2002*.See the 10 stocks*Stock Advisor returns as of March 8, 2024John Mackey, former CEO of Whole Foods Market, an Amazon subsidiary, is a member of The Motley Fool’s board of directors. John Ballard has no position in any of the stocks mentioned. The Motley Fool has positions in and recommends Amazon and Lululemon Athletica. The Motley Fool recommends Hyatt Hotels and United Parcel Service. The Motley Fool has a disclosure policy.A Bull Market Is Here: 3 Stocks to Buy With $1,000 was originally published by The Motley Fool"
Motley Fool,1 Growth Stock Down 27% to Buy Right Now,https://finance.yahoo.com/news/1-growth-stock-down-27-151700115.html,"Network effects, a powerful brand, and a compelling valuation are all the reasons you need to add shares to your portfolio.",
Motley Fool,Will Apple Be a $3 Trillion Stock by 2025?,https://finance.yahoo.com/news/apple-3-trillion-stock-2025-151500285.html,The world's second-most valuable company faces some daunting challenges.,"Apple (NASDAQ: AAPL) became the world's first $3 trillion company last June. By Dec. 14, 2023, its stock had hit its record high of $197.86, lifting its market cap to $3.08 trillion and seemingly securing its spot as the world's most valuable company.But today Apple's stock trades at about $170 per share with a market cap of $2.63 trillion. Microsoft, which surpassed that market cap this January, is now worth $2.99 trillion. Let's see why Apple lost its luster over the past three months, if it can regain its footing this year, and if it can become a $3 trillion stock again by 2025.Image source: Apple.Why did Apple lose its luster?The bulls abandoned Apple this year for four simple reasons. First, its sales of iPhones -- which accounted for 58% of its top line in its latest quarter -- are slowing down. Its iPhone sales dipped 2% in fiscal 2023 (which ended last September) and only grew 6% year over year in the first quarter of fiscal 2024 as the 5G upgrade cycle ended.Competitive and macro headwinds in China exacerbated that slowdown. According to Counterpoint Research, Apple's iPhone sales in China plunged 24% year over year in the first six weeks of 2024 amid stiff competition from Huawei.Second, Apple couldn't offset that slowdown by selling its other products. Its Mac sales fell 27% in fiscal 2023 amid the broader PC market's slowdown, then rose less than 1% in the first quarter of fiscal 2024. Its sales of iPads slumped during both periods, its Apple Watch sales were temporarily halted last December amid a patent dispute, and the Vision Pro remains a pricey niche gadget for tech enthusiasts. It also recently abandoned its decade-long plans to build an electric car. As a result, analysts expect Apple's revenue and earnings to only rise 1% and 7%, respectively, this year.Third, Apple's valuations were inflated by a flight toward safe-haven stocks as rising interest rates and other macro headwinds rattled the market. Even after its year-to-date decline, Apple's stock still doesn't look like a bargain at 26 times forward earnings -- and its paltry forward dividend yield of 0.6% probably won't limit its downside potential.Story continuesLastly, the European Commission recently hit Apple with a 1.8 billion euro ($1.95 billion) fine for banning streaming music rivals like Spotify Technology from informing its users of cheaper payment options outside of its App Store. Apple can easily pay that fine, but it could pave the way toward a broader crackdown on its entire services segment -- which serves more than 1 billion paid subscribers and is often cited as a catalyst for its long-term growth.Will Apple lose its premium valuation?Apple's near-term future is murky. During its shareholder meeting in late February, CEO Tim Cook claimed Apple would ""break new ground"" in generative artificial intelligence (AI) this year -- but that statement sounded like an eleventh-hour attempt to hop aboard the AI bandwagon that had previously driven Microsoft's stock to its record highs. Apple reportedly plans to add new generative AI features to Spotlight, its integrated search tool for Siri and iOS, but it's unclear if those upgrades will meaningfully widen its moat against Microsoft's Copilot and Alphabet's Google Assistant.If Apple's AI plans fail to meaningfully boost its sales over the next few quarters, its stock could lose its premium valuation and be revalued relative to its near-term growth potential. From fiscal 2023 to fiscal 2026, analysts expect its revenue to only grow at a compound annual growth rate (CAGR) of 4% as its earnings per share (EPS) increases at a CAGR of 8%.For reference, IBM -- which is growing again as it expands its hybrid cloud and AI businesses -- is expected to grow its revenue and EPS at CAGRs of 4% and 6%, respectively, from 2023 to 2026. Based on those expectations, IBM trades at just 22 times this year's earnings. It also pays a much higher forward yield of 3.4%.If Apple is also revalued at 22 times forward earnings, its stock would drop another 15% to the mid-$140s, reducing its market cap to $2.2 trillion. So unless Apple can pull a few rabbits out of its hat, it probably won't impress the bulls and regain its $3 trillion valuation by the beginning of 2025. But over the long term Apple could still get its act together as it rolls out new products and services -- so it's still too early to write it off as a mature tech giant that has run out of room to grow.Should you invest $1,000 in Apple right now?Before you buy stock in Apple, consider this:The Motley Fool Stock Advisor analyst team just identified what they believe are the 10 best stocks for investors to buy now… and Apple wasn’t one of them. The 10 stocks that made the cut could produce monster returns in the coming years.Stock Advisor provides investors with an easy-to-follow blueprint for success, including guidance on building a portfolio, regular updates from analysts, and two new stock picks each month. The Stock Advisor service has more than tripled the return of S&P 500 since 2002*.See the 10 stocks*Stock Advisor returns as of March 8, 2024Suzanne Frey, an executive at Alphabet, is a member of The Motley Fool's board of directors. Leo Sun has positions in Apple. The Motley Fool has positions in and recommends Alphabet, Apple, Microsoft, and Spotify Technology. The Motley Fool recommends International Business Machines and recommends the following options: long January 2026 $395 calls on Microsoft and short January 2026 $405 calls on Microsoft. The Motley Fool has a disclosure policy.Will Apple Be a $3 Trillion Stock by 2025? was originally published by The Motley Fool"
Motley Fool,Where Will Chewy Stock Be in 5 Years?,https://finance.yahoo.com/news/where-chewy-stock-5-years-151200230.html,The pet supply specialist has been shedding customers lately.,"It has been a volatile period for Chewy (NYSE: CHWY) stock, but most of the past five years have been negative for its shareholders. The pet supply giant was briefly a Wall Street favorite when the use of e-commerce soared during the early phases of the pandemic. Shares quickly reversed course once the growth hangover struck, though.Chewy stock is now down by more than 80% over the past five years after having jumped by 70% through early 2021.Yet, investing is all about the future, and the future seems brighter for this e-commerce specialist. Chewy has a good chance of boosting its sales footprint even as it makes its business more efficient.Mixed resultsThere's no doubt that Chewy's business is experiencing challenges right now. Sales growth has slowed to a relative crawl, with revenue rising just 8% in the most recent quarter. It wasn't long ago that it was expanding at an over 20% rate. Chewy's active user pool shrank over the past year, too, and it's hard to see it as a growth business while that key metric is falling.Yet, this has been an unusual time for the pet food industry. The pandemic clearly pulled forward some of Chewy's growth as it gave pet owners an unusual incentive to switch to its delivery model.However, there's been no fundamental shift in the wider pet supply segment's outlook. The industry is on track to grow at between 5% and 7% annually over the next several years, compared to 10% during the pandemic and 6% in the pre-pandemic days. Chewy's main challenge will be to keep winning market share through the slowdown over the next few years.Reasons for optimismGrowth over the next few years will need to come mostly from Chewy's established U.S. retail market but also from its newer pet healthcare business and its expansion into international markets, starting with Canada. The chances for better investment returns will rise if the business pairs rising average spending per customer with a steadily increasing shopper base. It's missing one-half of that formula these days, but average annual spending is at least strong at over $500 per active customer.Story continuesChewy's is also on a rock-solid financial footing, which gives management the flexibility to invest aggressively in growth initiatives. Gross profit margin is excellent and rising, cash flow is solidly positive, and the company generated a tiny net profit over the past nine months. Yet, Wall Street is unlikely to reward Chewy if it can't push its profit margins toward double-digit percentages.What to watch in late MarchInvestors will have a better idea about Chewy's short-term growth opportunities after it announces fiscal fourth-quarter results in late March. Analysts generally are expecting to hear that sales rose at a 10% pace for fiscal 2023, and they anticipate a slowdown to about 5% gains in the fiscal year that just started. The earnings outlook is just a bit brighter.The prospects don't look great, then, for shareholder returns over the next five years. That's true even though Chewy's stock is valued so cheaply, having declined 60% in the last year. Modest steps toward higher profits and faster growth might be enough to give the stock a lift.Yet, Chewy's business will have to make some fundamental shifts in its engagement trends to win its way back into Wall Street's good graces. Investors are hoping that the first step toward making that bullish scenario a reality will arrive with the company's March 20 earnings update.Should you invest $1,000 in Chewy right now?Before you buy stock in Chewy, consider this:The Motley Fool Stock Advisor analyst team just identified what they believe are the 10 best stocks for investors to buy now… and Chewy wasn’t one of them. The 10 stocks that made the cut could produce monster returns in the coming years.Stock Advisor provides investors with an easy-to-follow blueprint for success, including guidance on building a portfolio, regular updates from analysts, and two new stock picks each month. The Stock Advisor service has more than tripled the return of S&P 500 since 2002*.See the 10 stocks*Stock Advisor returns as of March 8, 2024Demitri Kalogeropoulos has no position in any of the stocks mentioned. The Motley Fool has positions in and recommends Chewy. The Motley Fool has a disclosure policy.Where Will Chewy Stock Be in 5 Years? was originally published by The Motley Fool"
Motley Fool,Better High-Yield Dividend Stock to Buy: Altria vs. Philip Morris,https://finance.yahoo.com/news/better-high-yield-dividend-stock-150900340.html,"These two tobacco stocks are close cousins, but which is the better buy?",
