source,title,url,content,article
Motley Fool,Is It Too Late to Buy Palantir Stock?,https://finance.yahoo.com/news/too-buy-palantir-stock-200500069.html,Shares have soared over the last year following the smashing success of its latest artificial intelligence (AI) software.,"One of the rising stars in the artificial intelligence (AI) arena is Palantir Technologies (NYSE: PLTR). For many years, Palantir sold three data-analytics software suites: Foundry, Gotham, and Apollo.Last April, Palantir released its fourth flagship product: the Artificial Intelligence Platform (AIP). Its launch has been nothing short of a home run, helping the company quickly expand beyond its previous focus on government contracts.This newfound growth, coupled with euphoria surrounding AI, caused shares to rise 167% last year. With the stock up another 24% so far in 2024, investors might be thinking they've missed out on Palantir.I see things differently. Let's break down why Palantir is still a lucrative opportunity for long-term investors.Don't call it a comebackFor much of its history, Palantir relied on large, lumpy government deals from the U.S. military and its Western allies before it went public in late 2020. This caused some skeptics to label Palantir more of a consulting operation or government contractor as opposed to a true software-as-a-service (SaaS) business. Moreover, as growth in the government business began to decelerate in 2022, the stock cratered nearly 65%.With shares reaching an all-time low of just $6 at the end of 2022, things were looking murky for the enterprise software developer. But Palantir demonstrated an impressive level of resiliency last year, essentially reinventing itself amid the AI revolution.Following the release of AIP last year, the company began hosting immersive seminars called ""boot camps"" as part of its marketing campaign. The idea was for clients to demo Palantir's products in real time. By showing prospective customers AIP's capabilities, management created a large new pipeline of business.Over the last year, the company has hosted over 850 boot camps, leading to a surge in new customers as AI use cases explode.In 2023, Palantir's total customer count increased 35% year over year to 497. But more importantly, customer growth from the private sector rose 44% to 375. In the fourth quarter alone, revenue from U.S. non-government customers increased 70%.These results silenced the bears and skeptics. Palantir proved it has legitimate AI chops, and customers across a variety of sectors are lining up to try out AIP.Image source: Getty Images.The journey is just getting startedWhile the customer demand is an encouraging sign, Palantir is growing more than just revenue. Unlike many other high-growth SaaS businesses, it's consistently profitable. The company has generated positive net income for five consecutive quarters, and adjusted free cash flow rose more than threefold last year.Story continuesAnother interesting development is its relationship with Oracle, which competes heavily in cloud computing against the likes of Microsoft, Alphabet, and Amazon. Palantir is working to migrate data workloads from its software platforms onto Oracle's cloud.I see this as a win-win for both companies. For Palantir in particular, the partnership should serve as a unique source of lead generation for both public- and private-sector business.A premium valuation well worth itOne word of caution for investors is that Palantir stock has gotten a bit pricey. At a price-to-sales (P/S) ratio of 22.5, it's the most expensive stock among other enterprise SaaS peers such as Snowflake, Datadog, ServiceNow, and MongoDB.PLTR PS Ratio ChartAs the chart above illustrates, Palantir's valuation ballooned in February following the company's fourth-quarter earnings report.Zooming out and looking at the bigger picture will help investors as they consider adding Palantir to their portfolio. Despite the surge in share price, the stock is still down more than 40% from its all-time high.Wedbush Securities analyst Dan Ives recently placed a $35 price target on Palantir stock, implying over 60% upside from current levels.The more important idea is that investors should remain patient as the AI narrative plays out. They should prepare to hold for the long term and keep an eye out for new developments from Palantir.The unprecedented demand for AIP coupled with the company's strong financial position and its strategic relationships makes me think it's in a good position to emerge as a leader in AI in the long run. The company has proved so far it can fend off big tech, and I don't see that dynamic changing. Given the recent dip in Palantir stock, now could be the right opportunity to scoop up some shares.Should you invest $1,000 in Palantir Technologies right now?Before you buy stock in Palantir Technologies, consider this:The Motley Fool Stock Advisor analyst team just identified what they believe are the 10 best stocks for investors to buy now… and Palantir Technologies wasn’t one of them. The 10 stocks that made the cut could produce monster returns in the coming years.Consider when Nvidia made this list on April 15, 2005... if you invested $1,000 at the time of our recommendation, you’d have $466,882!*Stock Advisor provides investors with an easy-to-follow blueprint for success, including guidance on building a portfolio, regular updates from analysts, and two new stock picks each month. The Stock Advisor service has more than quadrupled the return of S&P 500 since 2002*.See the 10 stocks »*Stock Advisor returns as of April 15, 2024Suzanne Frey, an executive at Alphabet, is a member of The Motley Fool's board of directors. John Mackey, former CEO of Whole Foods Market, an Amazon subsidiary, is a member of The Motley Fool's board of directors. Adam Spatacco has positions in Alphabet, Amazon, Microsoft, and Palantir Technologies. The Motley Fool has positions in and recommends Alphabet, Amazon, Datadog, Microsoft, MongoDB, Oracle, Palantir Technologies, ServiceNow, and Snowflake. The Motley Fool recommends the following options: long January 2026 $395 calls on Microsoft and short January 2026 $405 calls on Microsoft. The Motley Fool has a disclosure policy.Is It Too Late to Buy Palantir Stock? was originally published by The Motley FoolView comments"
Motley Fool,Where Will Super Micro Computer's Soaring Stock Be in 2026?,https://finance.yahoo.com/news/where-super-micro-computers-soaring-200200927.html,"The stock just received a big price target bump, suggesting it could surge impressively over the next few years.","Shares of Super Micro Computer (NASDAQ: SMCI) have set the market on fire in the past year with outstanding gains of 795%, and one analyst believes this red-hot rally is set to continue.Supermicro's business is booming thanks to the rapidly growing demand for its artificial intelligence (AI) server solutions, and Loop Capital analyst Ananda Baruah predicts Supermicro's red-hot growth is here to stay. He's upgraded his price target on the stock from $600 to $1,500. The updated price target is 54% higher than where the stock trades as of this writing.Let's look at the reasons why the analyst bumped his price target 2.5 times higher, and consider whether Supermicro could indeed hit that mark by 2026 per Loop Capital's prediction.Tremendous growth lies ahead for SupermicroSupermicro's fiscal 2024 (ending June 30, 2024) revenue is expected to land at $14.5 billion based on the midpoint of management's guidance. That would be slightly more than double the company's fiscal 2023 revenue of $7.1 billion. Consensus estimates are calling for Supermicro's earnings to nearly double from $11.81 to $22.10 per share over the same period.However, as the following chart indicates, analysts are projecting Supermicro's pace of growth to slow down over the next two fiscal years (through fiscal 2026).SMCI Revenue Estimates for Next Fiscal Year ChartBaruah, however, believes Supermicro could generate between $30 billion and $40 billion of revenue in 2026. Its earnings, on the other hand, could jump to a range of $50 to $60 per share. In other words, the Loop Capital analyst expects both revenue and earnings to at least double over the next two or so years.Those numbers are far higher than what the consensus estimates indicate. However, a closer look at the AI server market that Supermicro serves and the moves it's making in this space indicates it could indeed hit Baruah's numbers.And comments from management on Supermicro's January earnings call support Baruah's target. According to CEO Charles Liang:Today, our production utilization rate is about 65% across our U.S.A, Netherlands, and Taiwan facilities, and they are quickly filling. To address this immediate capacity challenge, we are adding two new production facilities and warehouses near our Silicon Valley headquarter, which will be operating in a few months. The new Malaysia facility will focus on expanding our building blocks with lower costs and increased volume, while [the] other new facility will support our annual revenue capacity above $25 billion.So, management already has plans for its top line to exceed $25 billion. Additionally, the company's focus on further enhancing its manufacturing capacity by investing in more infrastructure could set the stage for additional growth.Story continuesInvestors can expect tremendous upsideLoop Capital's $1,500 price target is based on the firm's baseline earnings per share forecast of $50 in fiscal 2026 and a forward earnings multiple of 30. This forward earnings multiple is in line with the Nasdaq 100 (using the index as a proxy for tech stocks).However, AI stocks tend to command a premium valuation thanks to their rapid growth, so there's a chance Supermicro could deliver even stronger upside than what the firm is forecasting. For instance, if Supermicro's top line increases to $30 billion in fiscal 2026, but the stock maintains its current price-to-sales multiple of 6, its market cap would jump to $180 billion, more than triple its current level.It's also worth noting Supermicro's price-to-sales ratio is lower than the tech sector's average of 7. Investors, therefore, could still be getting a good deal on this AI stock.Should you invest $1,000 in Super Micro Computer right now?Before you buy stock in Super Micro Computer, consider this:The Motley Fool Stock Advisor analyst team just identified what they believe are the 10 best stocks for investors to buy now… and Super Micro Computer wasn’t one of them. The 10 stocks that made the cut could produce monster returns in the coming years.Consider when Nvidia made this list on April 15, 2005... if you invested $1,000 at the time of our recommendation, you’d have $466,882!*Stock Advisor provides investors with an easy-to-follow blueprint for success, including guidance on building a portfolio, regular updates from analysts, and two new stock picks each month. The Stock Advisor service has more than quadrupled the return of S&P 500 since 2002*.See the 10 stocks »*Stock Advisor returns as of April 15, 2024Harsh Chauhan has no position in any of the stocks mentioned. The Motley Fool has no position in any of the stocks mentioned. The Motley Fool has a disclosure policy.Where Will Super Micro Computer's Soaring Stock Be in 2026? was originally published by The Motley FoolView comments"
Motley Fool,Is Snowflake Stock a Buy Now?,https://finance.yahoo.com/news/snowflake-stock-buy-now-200000921.html,The company might have the right person in place to lead the company into a new era of growth.,"In 2020, data company Snowflake (NYSE: SNOW) went public in one of the hottest initial public offerings (IPO) of all time. The IPO priced at $120 per share, but the stock finished its first day of trading above $250 per share.Now, approaching four years later, Snowflake stock is down about 40% from where it closed on day one. In short, it's been a complete dud for early investors.I wouldn't blame Snowflake entirely for the poor performance of its stock because the business has excelled. Here's how its financials have looked in each of its four complete fiscal years since its IPO.MetricFiscal 2021Fiscal 2022Fiscal 2023Fiscal 2024Product revenue growth120%106%70%38%Free cash flow margin(14%)7%24%28%Source: Snowflake's press releases. Table by author.Snowflake's revenue is nearly five times higher now than when it went public, and it generates strong free cash flow. The stock fell during this time, nonetheless, because it was priced irrationally high at its peak.Indeed, at one point, Snowflake stock traded at over 100 times trailing sales. That sometimes happens with small companies, but Snowflake was already a large business at the time. In short, it's hard to find upside when shares are that expensive. That said, the chart below shows it's fallen to an all-time low valuation.SNOW PS Ratio ChartWith the stock still underperforming and valuation at a new low, it's time to consider whether Snowflake stock is finally a buy.Two reasons I'm still not sold on SnowflakeTo be clear, a price-to-sales ratio of 17 doesn't put Snowflake stock in value territory -- it's still trading at a premium price. The high price tag isn't a deal-breaker in isolation, but it highlights the need for robust growth for an investment in this company to pay off.That growth isn't on tap in Snowflake's fiscal 2025 (which started in February). The company only guided for 22% product revenue growth in the current year. And there are two reasons this gives me pause.Snowflake is being celebrated as a top stock for the artificial-intelligence (AI) trend. After all, the company's products and services deal with immense amounts of enterprise data, and AI makes use of large amounts of data. Therefore, Snowflake would appear to be a natural beneficiary of growth in this space.However, the AI trend is already rolling, so there should be some noticeable benefit to Snowflake already. But the company just guided for its slowest year of growth ever. That's the first reason I'm still not sold on Snowflake right now.Story continuesThe other reason I'm not sold on Snowflake stock is related to management's long-term outlook. Since it went public, the company has been targeting $10 billion in product revenue for fiscal 2029. However, its guidance for fiscal 2025 puts it below the pace it needs to reach this goal on time.Management appears to have hinted at the possibility of falling short of its fiscal 2029 target too. Snowflake's investor presentations have always included a reference to the fiscal 2029 outlook, but its most recent quarterly presentation quietly left this detail out.Not all doom and gloomSnowflake is a huge business, yet it's still growing at a double-digit rate. That's worth noting. The company isn't falling apart -- it's just not growing as fast as I believe it needs to in order to justify its price.Moreover, Snowflake's slowing growth rate could improve. I noted my concern that the company doesn't seem to be benefiting from AI yet, but perhaps that's the real reason leadership has seen changes. Frank Slootman took Snowflake public, but he announced his retirement in February and handed the reins to Sridhar Ramaswamy, who was notably in charge of the company's AI efforts.In other words, this CEO transition could be tacit recognition that Snowflake has a golden opportunity with AI, and Ramaswamy is taking over to ensure the company can capitalize on it.For his part, Ramaswamy seems convinced of Snowflake's potential as he just bought $5 million of the stock.Ramaswamy's appointment and stock purchase don't make Snowflake stock a buy on their own. But it's enough reason to keep an eye on this business because future results could improve and put my concerns to rest.Should you invest $1,000 in Snowflake right now?Before you buy stock in Snowflake, consider this:The Motley Fool Stock Advisor analyst team just identified what they believe are the 10 best stocks for investors to buy now… and Snowflake wasn’t one of them. The 10 stocks that made the cut could produce monster returns in the coming years.Consider when Nvidia made this list on April 15, 2005... if you invested $1,000 at the time of our recommendation, you’d have $466,882!*Stock Advisor provides investors with an easy-to-follow blueprint for success, including guidance on building a portfolio, regular updates from analysts, and two new stock picks each month. The Stock Advisor service has more than quadrupled the return of S&P 500 since 2002*.See the 10 stocks »*Stock Advisor returns as of April 15, 2024Jon Quast has no position in any of the stocks mentioned. The Motley Fool has positions in and recommends Snowflake. The Motley Fool has a disclosure policy.Is Snowflake Stock a Buy Now? was originally published by The Motley FoolView comments"
Business Insider,"Don't ignore threats like inflation, recession, and war, warn Wall Street's biggest bosses",https://finance.yahoo.com/news/dont-ignore-threats-inflation-recession-190402063.html,"JPMorgan's Jamie Dimon, Goldman's David Solomon, and Citi's Jane Fraser caution that the economy still faces plenty of headwinds.",
Bloomberg,‘Priced to Perfection’ Starts to Unravel as Debt Markets Get Jitters,https://finance.yahoo.com/news/priced-perfection-starts-unravel-debt-190000350.html,(Bloomberg) -- Credit investors got a dose of economic and geopolitical reality this week as hawkish comments from central bank officials about borrowing costs and tensions in the Middle East sent jitters through debt markets.Most Read from BloombergTraders Are Cashing Out of Markets En MasseMagnificent Seven Earnings Arrive With Stocks at Critical MomentNew York’s Rich Get Creative to Flee State Taxes. Auditors Are On to ThemElon Wants His Money BackTikTok Divest-or-Ban Bill Expected to Become,"(Bloomberg) -- Credit investors got a dose of economic and geopolitical reality this week as hawkish comments from central bank officials about borrowing costs and tensions in the Middle East sent jitters through debt markets.Most Read from BloombergTraders Are Cashing Out of Markets En MasseNew York’s Rich Get Creative to Flee State Taxes. Auditors Are On to ThemMagnificent Seven Earnings Arrive With Stocks at Critical MomentElon Wants His Money BackXi Orders China’s Biggest Military Reorganization Since 2015The pullback was triggered in part by comments from Federal Reserve Bank of New York President John Williams, who said there’s no rush to cut interest rates and it’s possible that economic data could even warrant an increase if inflation persists.The realization that the interest rate pivot had yet to arrive comes as the US economy continues its strong performance, causing financial conditions to loosen in recent months. As a result, the market isn’t yet showing signals that the central bank has restricted policy enough to begin easing, said Bill Zox, a portfolio manager at Brandywine Global Investment Management.The return of the higher-for-longer mantra is a headache for insurance companies and pension plans which, flush with cash, sent demand for bonds soaring this year as they tried to lock in yields ahead of the anticipated cuts. Corporates responded by issuing more than $1 trillion of notes globally so far this year, the second-highest level since at least 2013. Now, however, investors are yanking money from high-yield funds and flows into shorter duration high-grade products have slowed dramatically.Click here to listen to a podcast about how Morgan Stanley thinks credit could be in trouble if the Fed hikes.For US investment-grade debt, spreads are only edging wider, and demand for many new issues is still strong. But signs of growing caution are clear in credit markets: Spreads on US junk debt have pushed wider after the rise in negative sentiment, and high-yield is poised for the biggest monthly loss on a total return basis since September 2022. It’s a marked reversal of the sense of complacency that earlier this month saw the global perception of risks from credit reach the lowest levels since February of last year, according to a Bank of America Corp. survey of fund managers.Adding to the problems for policymakers, retaliatory strikes between Israel and Iran have sent oil prices higher, which could fuel inflation. The tensions in the Middle East also risk dampening demand for credit as investors seek havens like Treasuries instead.Story continuesInvestor PushbackOne area where investors are pushing back is the leveraged loan market. While it continues to see demand, money managers have successfully pushed back on terms sought by issuers in recent days.Rocket Software Inc. was forced to drop plans for a portable debt structure in recent days after feedback from money managers, according to people with knowledge of the matter. If the trend continues, it’s a potential positive for private credit providers, who have faced renewed competition in recent months from banks.In Europe, it’s a different story. Traders are pricing around 80 basis points of cuts from the European Central Bank this year and officials have stressed they still plan to cut first in June and don’t need to wait for the Fed.Still, the volatility this week means more than 70% of bond deals issued in Europe were in the red as of Friday morning in London, hurting retail investors, data compiled by Bloomberg News show.Back in the US, some junk firms risk being hurt by the tightening in monetary policy.“If those cuts get pushed out after the election, it could be a challenge for some of the lower-quality floating-rate issuers” who need to refinance, Meghan Robson, head of US credit strategy at BNP Paribas, said in an April 10 interview with the Credit Edge podcast. “That risk is not priced in yet but is something that could come into the debate as we get closer to the June and July timeline.”Week in ReviewBanks including JPMorgan Chase & Co., Wells Fargo & Co. and Goldman Sachs sold bonds this week in the US high-grade bond market, following their release of first-quarter results.Wells Fargo & Co. sold $4.25 billion on Monday, and C$1.25 billion ($900 million) of debt in the Canadian bond market on Tuesday, while Morgan Stanley sold $8 billion of bonds Wednesday, after it posted higher-than-expected quarterly revenue.Banks are fighting back after private lenders have grabbed ever larger pieces of the lucrative business of financing leveraged buyouts: They’re serving as matchmakers on transactions between smaller companies looking for loans and private lenders eager to provide financing.Wall Street’s securitization engine is revving up with issuance touching record levels as borrowers rush to secure funding before any credit market disruptions caused by the US general election.The US leveraged loan market, as yet unruffled by the shift to a higher-for-longer view on interest rates, may soon join in the pain being felt in other asset classes.Fading hopes that the Federal Reserve will soon cut rates are prompting US banks to re-evaluate the cost of their preferred stocks, potentially sparking a rush of deals for the crucial source of capital.Banks are increasingly gathering orders for riskier high-yield bond and leveraged loan sales in private before formally announcing them to the broader market, in an effort to ensure deals find enough demand in difficult markets.Blackstone Inc. led a roughly $2 billion financing package to Park Place Technologies to refinance the company’s debt and fund a payout to its private equity owners.As climate change exacerbates droughts and wildfires, and utilities often take the blame for starting them, their assets are increasingly at risk.Riverside Co. is exploring strategic options including a sale of its direct lending arm, Riverside Credit Solutions.Asset manager Columbia Threadneedle Investments thinks that now is a good time to grab a bigger piece of the collateralized loan obligation market, recently saying it plans to expand its CLO business and become a regular issuer.Alternative asset manager Sculptor Capital Management has launched a platform to invest in the riskiest tranches of CLOs, which will count its new owner Rithm Capital Corp. as a key investor.Library services companies Baker & Taylor and Media Source Inc. have held talks to combine and have approached direct lenders about financing for the potential deal.Bayview Asset Management, a money manager, is in the process of marketing a complex bond that was created to help SoFi Technologies Inc., an online bank and lender, hedge part of its student loan book.Vietnamese companies are cutting back on issuing new bonds as yields rise and the government heightens scrutiny on capital markets, a development that’s stirring refinancing risk concerns.On the MoveToronto-Dominion Bank’s head of private debt has left the firm amid a restructuring at the Canadian lender that includes cutting 3% of jobs globally.Siemens AG has hired Milan Senicic as executive director to lead its corporate and leverage finance business in Australia.ING appointed Gautam Saxena as head of corporate finance for the Asia Pacific region.--With assistance from Michael Msika, Jill R. Shah, Paul Cohen and Dan Wilchins.Most Read from Bloomberg BusinessweekWhat Really Happens When You Trade In an iPhone at the Apple StoreRents Are the Fed’s ‘Biggest Stumbling Block’ in Taming US InflationThe Pentagon Wants to Give Defense Startups a Chance Aging Copper Mines Are Turning Into Money Pits Despite DemandAn Irish Liquidator Plays Cat and Mouse With Russian Jets©2024 Bloomberg L.P.View comments"
