title,datetime,impact_score,sentiment,summary,article
Gold Royalty Announces Board Change,2024-04-21T00:00:00.000Z,Low,Neutral,"Gold Royalty Corp. announces Glenn Mullan stepping down as a director of the company. The news was released on April 20, 2024.","Gold Royalty Announces Board Change Rhea-AI Impact (Low) Rhea-AI Sentiment (Neutral) Tags Rhea-AI Summary English French German Italian Korean Spanish Gold Royalty Corp. announces Glenn Mullan stepping down as a director of the company. The news was released on April 20, 2024. Gold Royalty Corp. annuncia le dimissioni di Glenn Mullan dalla carica di direttore della società. La notizia è stata pubblicata il 20 aprile 2024. Gold Royalty Corp. anuncia que Glenn Mullan se retira como director de la empresa. La noticia se publicó el 20 de abril de 2024. 골드 로열티 코퍼레이션에서 글렌 멀란이 회사 이사직에서 사임한다고 발표했습니다. 이 소식은 2024년 4월 20일에 발표되었습니다. Gold Royalty Corp. annonce la démission de Glenn Mullan en tant que directeur de la société. L'annonce a été faite le 20 avril 2024. Gold Royalty Corp. gibt bekannt, dass Glenn Mullan als Direktor des Unternehmens zurücktritt. Die Nachricht wurde am 20. April 2024 veröffentlicht. Positive None. Negative None. 04/20/2024 - 08:00 PM VANCOUVER, BC, April 20, 2024 /PRNewswire/ - Gold Royalty Corp. (""Gold Royalty"" or the ""Company"") (NYSE American: GROY) announced today that Glenn Mullan has stepped down as a director of the Company. About Gold Royalty Corp. Gold Royalty Corp. is a gold-focused royalty company offering creative financing solutions to the metals and mining industry. Its mission is to invest in high-quality, sustainable, and responsible mining operations to build a diversified portfolio of precious metals royalty and streaming interests that generate superior long-term returns for our shareholders. Gold Royalty's diversified portfolio currently consists primarily of net smelter return royalties on gold properties located in the Americas. View original content:https://www.prnewswire.com/news-releases/gold-royalty-announces-board-change-302122745.html SOURCE Gold Royalty Corp. Why did Glenn Mullan step down as a director of Gold Royalty Corp.? Glenn Mullan stepped down as a director of Gold Royalty Corp. for reasons undisclosed in the press release. When was Glenn Mullan's resignation announced by Gold Royalty Corp.? Glenn Mullan's resignation from Gold Royalty Corp. was announced on April 20, 2024. What is the ticker symbol for Gold Royalty Corp.? The ticker symbol for Gold Royalty Corp. is GROY. Who is Glenn Mullan in relation to Gold Royalty Corp.? Glenn Mullan was a director of Gold Royalty Corp. who has now stepped down from his position. What type of change did Gold Royalty Corp. announce recently? Gold Royalty Corp. announced a board change with Glenn Mullan stepping down as a director of the company."
BioArctic and Eisai sign research evaluation agreement regarding BAN2802,2024-04-20T11:28:00.000Z,Neutral,Neutral,"BioArctic and Eisai have signed a research evaluation agreement for BAN2802, a potential Alzheimer's treatment combining BrainTransporter™ technology with an undisclosed drug candidate. The collaboration aims to develop the next generation disease-modifying treatment for Alzheimer's disease. Eisai will evaluate the data to potentially license BAN2802, building on their successful partnership that led to the approval of Leqembi® for early Alzheimer's disease.","BioArctic and Eisai sign research evaluation agreement regarding BAN2802 Rhea-AI Impact (Neutral) Rhea-AI Sentiment (Neutral) Tags Rhea-AI Summary English French German Italian Korean Spanish BioArctic and Eisai have signed a research evaluation agreement for BAN2802, a potential Alzheimer's treatment combining BrainTransporter™ technology with an undisclosed drug candidate. The collaboration aims to develop the next generation disease-modifying treatment for Alzheimer's disease. Eisai will evaluate the data to potentially license BAN2802, building on their successful partnership that led to the approval of Leqembi® for early Alzheimer's disease. BioArctic ed Eisai hanno firmato un accordo di valutazione della ricerca per BAN2802, un potenziale trattamento per l'Alzheimer che combina la tecnologia BrainTransporter™ con un candidato farmaco non divulgato. La collaborazione mira a sviluppare il prossimo trattamento modificante la malattia per la malattia di Alzheimer. Eisai valuterà i dati per potenzialmente licenziare BAN2802, costruendo sulla loro partnership di successo che ha portato all'approvazione di Leqembi® per la malattia di Alzheimer precoce. BioArctic y Eisai han firmado un acuerdo de evaluación de investigación para BAN2802, un posible tratamiento para el Alzheimer que combina la tecnología BrainTransporter™ con un candidato a medicamento no revelado. La colaboración tiene como objetivo desarrollar el próximo tratamiento modificante de la enfermedad para la enfermedad de Alzheimer. Eisai evaluará los datos para potencialmente licenciar BAN2802, basándose en su asociación exitosa que llevó a la aprobación de Leqembi® para la enfermedad de Alzheimer en sus etapas iniciales. BioArctic과 Eisai는 미공개 약물 후보와 BrainTransporter™ 기술을 결합한 잠재적 알츠하이머 치료제 BAN2802에 대한 연구 평가 계약을 체결하였습니다. 이 협력은 알츠하이머병을 위한 차세대 질병 수정 치료제 개발을 목표로 합니다. Eisai는 BAN2802의 라이센스를 잠재적으로 평가하기 위해 데이터를 검토할 것이며, 이는 초기 알츠하이머병에 대한 Leqembi®의 승인으로 이어진 성공적인 파트너십을 바탕으로 합니다. BioArctic et Eisai ont signé un accord d'évaluation de recherche pour BAN2802, un traitement potentiel de la maladie d'Alzheimer associant la technologie BrainTransporter™ à un candidat médicamenteux non divulgué. La collaboration vise à développer le traitement modificateur de maladie de nouvelle génération pour la maladie d'Alzheimer. Eisai évaluera les données pour potentiellement licencier BAN2802, s'appuyant sur leur partenariat réussi qui a conduit à l'approbation de Leqembi® pour la maladie d'Alzheimer précoce. BioArctic und Eisai haben eine Forschungsüberprüfungsvereinbarung für BAN2802 unterzeichnet, eine potenzielle Alzheimer-Behandlung, die BrainTransporter™-Technologie mit einem nicht offengelegten Arzneimittelkandidaten kombiniert. Die Zusammenarbeit zielt darauf ab, die nächste Generation der krankheitsmodifizierenden Behandlung für Alzheimer zu entwickeln. Eisai wird die Daten bewerten, um möglicherweise BAN2802 zu lizenzieren, aufbauend auf ihrer erfolgreichen Partnerschaft, die zur Zulassung von Leqembi® für frühe Alzheimer-Krankheit geführt hat. Positive None. Negative None. 04/20/2024 - 07:28 AM STOCKHOLM, April 20, 2024 /PRNewswire/ -- BioArctic AB (publ) (Nasdaq Stockholm: BIOA B) today announced that BioArctic AB and Eisai Co., Ltd., have entered into a research evaluation agreement regarding BAN2802, a potential new treatment combining BioArctic's proprietary BrainTransporter™ technology with an undisclosed Alzheimer drug candidate. At the end of the collaboration, Eisai will evaluate the data generated and decide if they chose to exercise an option to license BAN2802 for the treatment of Alzheimer's disease. BioArctic and Eisai have a long-standing collaboration dating back to 2005 regarding the development and commercialization of drugs for the treatment of Alzheimer's disease. This collaboration has led to Leqembi® (lecanemab) – the world's first approved drug[1] shown to slow the progression of early Alzheimer's disease. The new collaboration will build on the companies' joint knowledge in the field of Alzheimer's disease. Costs for the research evaluation program will be shared and the program will evaluate what could be the next generation disease modifying treatment for Alzheimer's disease. ""I am very happy that our Brain Transporter technology has continued to progress so well and that we have now entered into this first agreement utilizing this platform. I believe that this technology has huge potential to improve many different projects, and support companies in their pursuit of helping people with brain disorders,"" said Gunilla Osswald, CEO at BioArctic. ""Eisai has been a valuable partner to BioArctic during the past two decades, and we are very pleased to extend and deepen our relationship with this new research evaluation agreement on BAN2802. Together, we have been able to deliver lecanemab, the first fully approved disease modifying treatment in Alzheimer's disease in the US, Japan and China, and we look forward to continuing our fruitful collaboration and lead the development of the next generation of drugs to help patients with this devastating disease."" BioArctic's proprietary BrainTransporter technology is a technology that can actively transport biologics across the blood brain barrier into the brain. The technology has the potential to create faster and stronger efficacy of treatments targeted to the brain, while reducing the burden of treatment for both patients and society. The BrainTransporter technology manifests BioArctic's commitment to sustainability by aiming for continuous improvement of clinical and commercial benefit. This release discusses investigational uses of an agent in development and is not intended to convey conclusions about efficacy or safety. There is no guarantee that such investigational agents will successfully complete clinical development or gain health authority approval. This information is information that BioArctic AB (publ) is obliged to disclose pursuant to the EU Market Abuse Regulation. The information was released for public disclosure, through the agency of the contact persons below, on April 20, 2024, at 09.40 a.m. CET. For further information, please contact: Oskar Bosson, VP Communications and IRE-mail: oskar.bosson@bioarctic.sePhone: +46 70 410 71 80 About the collaboration between BioArctic and EisaiSince 2005, BioArctic has a long-term collaboration with Eisai regarding the development and commercialization of drugs for the treatment of Alzheimer's disease. The most important agreements are the Development and Commercialization Agreement for the lecanemab antibody, which was signed 2007, and the Development and Commercialization agreement for the antibody LEQEMBI back-up for Alzheimer's disease, which was signed 2015. In 2014, Eisai and Biogen entered into a joint development and commercialization agreement for lecanemab. Eisai is responsible for the clinical development, application for market approval and commercialization of the products for Alzheimer's disease. BioArctic has the right to commercialize lecanemab in the Nordic region under certain conditions and is currently preparing for commercialization in the Nordics together with Eisai. BioArctic has no development costs for lecanemab in Alzheimer's disease and is entitled to payments in connection with regulatory approvals, and sales milestones as well as royalties on global sales. About BioArctic ABBioArctic AB (publ) is a Swedish research-based biopharma company focusing on innovative treatments that can delay or stop the progression of neurodegenerative diseases. The company invented Leqembi® (lecanemab) – the world's first drug proven to slow the progression of the disease and reduce cognitive impairment in early Alzheimer's disease. Leqembi has been developed together with BioArctic's partner Eisai, who are responsible for regulatory interactions and commercialization globally. In addition to Leqembi, BioArctic has a broad research portfolio with antibodies against Parkinson's disease and ALS as well as additional projects against Alzheimer's disease. Several of the projects utilize the company's proprietary BrainTransporter™ technology, which has the potential to actively transport antibodies across the blood-brain barrier to enhance the efficacy of the treatment. BioArctic's B share (BIOA B) is listed on Nasdaq Stockholm Large Cap. For further information, please visit www.bioarctic.se. [1] Approved in the US, Japan and China. This information was brought to you by Cision http://news.cision.com https://news.cision.com/bioarctic/r/bioarctic-and-eisai-sign-research-evaluation-agreement-regarding-ban2802,c3964796 The following files are available for download: https://mb.cision.com/Main/9978/3964796/2746802.pdf BioArctic and Eisai sign research evaluation agreement regarding BAN2802 View original content:https://www.prnewswire.com/news-releases/bioarctic-and-eisai-sign-research-evaluation-agreement-regarding-ban2802-302122670.html SOURCE BioArctic What is the research evaluation agreement between BioArctic and Eisai regarding? The research evaluation agreement is for BAN2802, a potential new treatment combining BioArctic's BrainTransporter™ technology with an undisclosed Alzheimer drug candidate. What is the goal of the collaboration between BioArctic and Eisai? The collaboration aims to develop the next generation disease-modifying treatment for Alzheimer's disease by leveraging their joint knowledge and expertise in the field. What previous successful collaboration is mentioned in the press release? The collaboration between BioArctic and Eisai led to the approval of Leqembi® (lecanemab), the world's first approved drug shown to slow the progression of early Alzheimer's disease. What technology does BioArctic utilize in their research? BioArctic utilizes the BrainTransporter™ technology, which actively transports biologics across the blood brain barrier into the brain, potentially enhancing treatment efficacy. How does BioArctic demonstrate its commitment to sustainability? BioArctic demonstrates its commitment to sustainability by aiming for continuous improvement of clinical and commercial benefit through technologies like BrainTransporter™."
