title,datetime,impact_score,sentiment,summary,article
"Calliditas Q1 report, January - March 2024",2024-05-23T05:52:00.000Z,Low,Positive,"Calliditas Therapeutics reported significant growth in Q1 2024 compared to Q1 2023. Net sales increased to SEK 295.5 million, with TARPEYO® contributing SEK 278.3 million. The company faced an operating loss of SEK 203.8 million and a loss per share of SEK 4.59. Cash reserves decreased to SEK 810.3 million from SEK 1,013.6 million. Key achievements include a 27% increase in enrollments, a new TARPEYO patent valid until 2043, and FDA's orphan drug exclusivity until 2030. Despite a USD 4.7 million revenue impact due to a cyberattack, future revenue is expected to remain stable. Upcoming events include European Commission decisions and Phase 2 trial results.",
Flex LNG - Key information relating to the cash distribution for the first quarter 2024,2024-05-23T05:24:00.000Z,Low,Neutral,"Flex LNG has announced a cash distribution of $0.75 per share for the first quarter of 2024. This distribution will be made from the company's Contributed Surplus Account. NYSE shareholders will receive their payment on or about June 21, 2024, while OSE shareholders will receive theirs on or about June 26, 2024. Important dates include the ex-date of June 10, 2024, for NYSE and June 7, 2024, for OSE. The shortened settlement cycle from T+2 to T+1 on the NYSE starting May 28, 2024, may restrict share movements between NYSE and OSE during interim days.",
Nona Biosciences Announces Global License and Option Agreement with AstraZeneca for Monoclonal Antibody to be Developed into Novel Tumor Targeted Therapies,2024-05-22T23:23:00.000Z,Moderate,Very Positive,"Nona Biosciences announced a global license and option agreement with AstraZeneca for the development of monoclonal antibodies into targeted cancer therapies. Under this deal, Nona will receive $19 million initially, with potential milestone payments totaling up to $575 million, and tiered royalties on net sales. Nona may also receive additional payments if AstraZeneca exercises further options. This partnership leverages Nona's antibody discovery platform alongside AstraZeneca's expertise in oncology.",
GATES ANNOUNCES PRICING OF $500 MILLION OF 6.875% SENIOR NOTES DUE 2029,2024-05-22T23:01:00.000Z,Low,Neutral,"Gates Industrial  (NYSE: GTES) announced the pricing of $500 million in 6.875% Senior Notes due 2029.The notes will be guaranteed by Gates Industrial Holdco  and other subsidiaries. The offering is expected to be completed on June 4, 2024, subject to customary closing conditions.The proceeds will be used to refinance existing debts.",
Royal Gold Announces Third Quarter Dividend,2024-05-22T22:52:00.000Z,Low,Neutral,"Royal Gold (NASDAQ: RGLD) has declared a third quarter dividend of $0.40 per share of common stock. The dividend will be distributed on July 19, 2024, to shareholders recorded by July 5, 2024. Royal Gold specializes in acquiring and managing precious metal streams and royalties, holding interests in 177 properties globally as of March 31, 2024. This portfolio includes 37 producing mines and 24 development-stage projects. The company is publicly traded on the Nasdaq Global Select Market under the symbol 'RGLD'.",
Grupo Supervielle Reports 1Q24 Results,2024-05-22T22:13:00.000Z,Moderate,Neutral,"Grupo Supervielle (NYSE: SUPV; BYMA: SUPV), an Argentinian financial services group, reported significant profitability in Q1 2024 with a net income of AR$46.5 billion, up significantly from AR$2.2 billion in the same quarter last year. The company's Return on Average Equity (ROAE) reached a record 33.8%, driven by a high Net Interest Margin (NIM) of 62% and improved efficiencies.Loan demand showed signs of recovery, with a 2.6% sequential increase in the loan book and a 40 bps gain in market share. Corporate and car loans also gained market share. The Non-Performing Loan (NPL) ratio hit a historic low of 1.1%, and the coverage ratio improved to 264%. Supervielle expanded its digital client base, now accounting for 64% of total clients, and improved its efficiency ratio to 34%. The company launched new 30-year mortgage loans and grew its online brokerage and crypto offerings. Total assets decreased by 17.8% QoQ, but loans expanded by 55.5% QoQ in nominal terms. Common Equity Tier 1 Ratio improved to 24.7%.",
APA Corporation Declares Cash Dividend on Common Shares,2024-05-22T22:43:00.000Z,Low,Neutral,"The board of directors of APA  (Nasdaq: APA) has announced a regular cash dividend on its common shares.The dividend is set at 25 cents per share and will be paid on August 22, 2024, to shareholders who are on record by July 22, 2024.This declaration reflects APA's ongoing commitment to returning value to its shareholders.",
Cencora Announces Common Share Repurchase From Walgreens Boots Alliance and Raises Fiscal 2024 Guidance,2024-05-22T21:44:00.000Z,Neutral,Neutral,"Cencora (NYSE: COR) has announced a significant share repurchase agreement with Walgreens Boots Alliance Holdings, totaling approximately $400 million. This transaction is part of a broader strategy, with Cencora completing around $550 million in share repurchases in May 2024 alone. Additionally, Cencora has raised its fiscal year 2024 adjusted diluted earnings per share (EPS) guidance to a range of $13.35 to $13.55, up from the previous $13.30 to $13.50. The improved EPS forecast is attributed to a reduced share count, although it is partially offset by increased net interest expenses due to lower investment balances following the repurchases. Cencora, a global pharmaceutical solutions leader, is recognized on the Fortune 500 and Global Fortune 500 lists, with annual revenues exceeding $250 billion.",
Vizsla Silver Mails Management Information Circular in Connection with Special Meeting to Approve Spinout of Vizsla Royalties,2024-05-22T22:30:00.000Z,Low,Neutral,"Vizsla Silver Corp. (NYSE: VZLA, TSX-V: VZLA) has announced a special shareholder meeting on June 17, 2024, to approve the spinout of Vizsla Royalties Corp. (Spinco). Shareholders will receive one-third of a Spinco share and one-third of a Spinco warrant per Vizsla Silver share, with the warrant exercisable at $0.05 until December 31, 2025. Approval requires two-thirds of the shareholder votes. If approved, the spinout is expected to close by June 24, 2024. Post-Arrangement, Vizsla shareholders will hold 45% of Spinco, while Vizsla retains 55%. Spinco has applied for TSXV listing, subject to fulfilling listing requirements. Post-closing steps include loan settlements, an additional $3.5M loan from Vizsla, Spinco’s buyback rights, a $3M private placement, and a 1-for-10 share consolidation.",
NOVONIX CFO Nick Liveris to Transition to Non-Executive Director,2024-05-22T22:31:00.000Z,Neutral,Very Positive,"NOVONIX  (NASDAQ: NVX, ASX: NVX) announced that CFO Nick Liveris will transition to a non-executive role on the Board of Directors. The search for a new CFO has commenced, and the appointee will work with Mr. Liveris to ensure a smooth transition. Mr. Liveris will retire from his current position to focus on the Liveris Family Office but will continue supporting NOVONIX. His move to a non-executive role allows NOVONIX to retain his expertise. CEO Dr. Chris Burns acknowledged Mr. Liveris' contributions in strengthening the company's position in the battery materials market.",
"Enact Holdings, Inc. Prices $750 Million of Senior Notes",2024-05-22T22:35:00.000Z,Low,Neutral,"Enact Holdings (Nasdaq: ACT) has announced the pricing of a $750 million public offering of 6.25% Senior Notes due 2029. The settlement is expected on May 28, 2024, subject to customary closing conditions. The notes will pay interest semi-annually at a rate of 6.25% per year, maturing on May 28, 2029. Proceeds from this offering, along with other funds, will be used to redeem Enact's 6.50% Senior Notes due August 2025. J.P. Morgan Securities, Citigroup Global Markets, and Goldman Sachs are acting as joint book-running managers for the offering. The notes are offered under an automatic shelf registration statement filed with the SEC.",
Banco Macro Announces Results for the First Quarter of 2024,2024-05-22T22:32:00.000Z,Neutral,Neutral,"Banco Macro (NYSE: BMA; BYMA: BMA) reported its 1Q24 results, with net income at Ps.275.2 billion, a 61% drop from 4Q23 but a 626% increase from 1Q23. Operating income before G&A and personnel expenses was Ps.1.62 trillion, 19% lower QoQ, but 149% higher YoY.After G&A and personnel expenses, operating income totaled Ps.1.25 trillion, a 20% decrease QoQ, but 211% higher YoY. Total financing decreased 10% QoQ and 8% YoY to Ps.2.5 trillion. Total deposits fell 1% QoQ and 11% YoY to Ps.5 trillion. Peso deposits increased 10% while USD deposits dropped 32%.Banco Macro maintained strong solvency with Ps.2.6 trillion excess capital, a 46.5% Capital Adequacy Ratio, and a 44.5% Tier 1 Ratio. Non-performing to total financing ratio was 1.14%, with a coverage ratio of 222.7%.",
NetJets launches assault on elected pilot union official,2024-05-22T22:04:00.000Z,Low,Negative,"NetJets, a Berkshire Hathaway company (NYSE: BRK), faces deteriorating labor relations as reported by the NetJets Association of Shared Aircraft Pilots (NJASAP). The Union accuses NetJets of intimidating tactics against an elected official over lawful union activities following a recent five-year collective bargaining agreement. NJASAP claims the company is retaliating rather than cooperating to capitalize on high demand. Notably, Vice President Capt. Paulette Gilbert was subjected to intense interrogation regarding union activities, which NJASAP views as a direct attack on its members and leaders. Despite these conflicts, NJASAP secured a $1.6 billion contract increase.",
Greenwave Eliminates All Convertible Debt,2024-05-22T22:00:00.000Z,High,Neutral,"Greenwave Technology Solutions announced the elimination of all its convertible debt and preferred shares, totaling $35.2 million, including $17.2 million held by the Chairman and CEO. The company now holds $21.8 million in cash on its balance sheet. This financial move strengthens Greenwave's position and allows for expansion plans. The company anticipates generating approximately $40 million in revenue for 2024 through increased processing volumes of steel and copper.",
"Star Bulk Carriers Corp. Reports Net Profit of $74.9 Million for the First Quarter of 2024, and Declares Quarterly Dividend of $0.75 Per Share",2024-05-22T21:16:00.000Z,Low,Neutral,"Star Bulk Carriers reported a net profit of $74.9 million for Q1 2024, a significant increase from $45.9 million in Q1 2023. The company declared a quarterly dividend of $0.75 per share. Voyage revenues rose to $259.4 million from $224.0 million, and the Time Charter Equivalent (TCE) rate increased to $19,627 from $14,199. Star Bulk completed a merger with Eagle Bulk Shipping on April 9, 2024, resulting in a combined fleet of 161 vessels. The company sold seven older vessels for gross proceeds of $129.6 million and took delivery of three new vessels. Operating expenses decreased due to a smaller fleet size. Star Bulk entered into new loan facilities totaling $388.1 million to refinance Eagle's debt, adding $12.6 million in liquidity. The company remains optimistic about the dry bulk market's medium-term prospects, driven by favorable order books and upcoming environmental regulations.",
Jiuzi Holdings Received Nasdaq Notification Letters,2024-05-22T21:30:00.000Z,Neutral,Neutral,"Jiuzi Holdings (NASDAQ: JZXN), a new energy vehicle dealership group in China, announced it received a notification from Nasdaq on May 16, 2024, regarding non-compliance with the minimum bid price rule. The Company's stock price has been below $1 for 30 consecutive business days. JZXN has until November 12, 2024, to regain compliance by maintaining a closing bid price of at least $1 for 10 consecutive business days. If unsuccessful, JZXN may be granted an additional 180 days to comply, potentially requiring a reverse stock split. Previously, on March 29, 2024, JZXN received a Nasdaq notification for failing to timely file its 2023 Annual Report. This issue was resolved on May 20, 2024, when JZXN filed the report.",
Tiendas 3B 1Q24 Earnings Release,2024-05-22T21:27:00.000Z,Low,Neutral,"Tiendas 3B (NYSE: TBBB), a leading grocery hard discounter in Mexico, reported its 1Q24 financial results. Revenue grew by 30.9% to Ps. 12,684 million, driven by a 14.8% increase in Same Store Sales and the opening of 94 new stores. EBITDA surged by 57.9% to Ps. 626 million, despite IPO-related expenses. Gross profit reached Ps. 2,062 million, a 37.0% increase, with a gross margin improvement of 73 basis points to 16.3%. The company repaid Ps. 4,925 million in debt using IPO proceeds and ended the quarter with Ps. 4,293 million in cash. However, administrative expenses slightly increased, and a Ps. 231 million net loss was reported, mainly due to higher income tax expenses and a foreign exchange loss.",
Zebra Technologies Announces Pricing of $500 Million Senior Unsecured Note Private Offering,2024-05-22T21:38:00.000Z,Neutral,Neutral,"Zebra Technologies announced a $500 million private offering of 6.500% senior unsecured notes due June 1, 2032. The offering is expected to close on May 28, 2024, subject to customary conditions. Zebra plans to use the proceeds to repay its $172 million revolving credit facility and for general corporate purposes, including replenishing cash after repaying its receivables financing facility that matured on May 13, 2024. The notes will be guaranteed by certain domestic subsidiaries and are offered under Rule 144A and Regulation S, targeting qualified institutional buyers and non-U.S. persons. The notes are not registered under the Securities Act of 1933.",
PEOPLES FINANCIAL CORPORATION ANNOUNCES A CASH DIVIDEND,2024-05-22T21:05:00.000Z,Low,Neutral,"Peoples Financial , the parent company of The Peoples Bank, announced a semi-annual cash dividend of $0.18 per common share, payable on June 10, 2024, to shareholders recorded by June 5, 2024. Chairman and CEO Chevis C. Swetman highlighted the company's financial improvement and commitment to returning earnings to shareholders. Founded in 1896, the bank operates 17 branches along the Mississippi Gulf Coast and offers various banking and financial services. The company recently celebrated its third-best year of earnings and was ranked among the 2024 OTCQX Best 50.",
Deluxe to Participate in Upcoming Investor Conference,2024-05-22T22:00:00.000Z,Low,Neutral,"Deluxe (NYSE: DLX), a modern Payments and Data company, announced its participation in TD Cowen's 52nd Annual Technology, Media, and Telecom Conference. The event will feature a presentation by Barry McCarthy, President and CEO, and Chip Zint, SVP and CFO, on May 30 at 1:50 pm ET. The presentation will be accessible through a live webcast available on the company's investor relations website, with a replay option post-event.",
Primis Financial Corp. Announces Notification of Delinquency with Nasdaq,2024-05-22T21:00:00.000Z,Neutral,Neutral,"On May 16, 2024, Primis Financial Corp. (NASDAQ: FRST) received a delinquency notification from Nasdaq for failing to timely file its Quarterly Report for Q1 2024 and its Annual Report for 2023. The notification follows a series of delayed filings, including notices on March 18, April 1, and May 13, 2024, due to the company's need for additional time for restatement and pre-clearance with the SEC. Although the letter has no immediate effect on Primis's Nasdaq listing, the company must submit a compliance plan by June 3, 2024. If accepted, Primis has until September 30, 2024, to regain compliance. As of March 31, 2024, Primis reported $3.9 billion in assets, $3.2 billion in loans, and $3.3 billion in deposits. Primis aims to file the delayed reports promptly to meet Nasdaq’s requirements.",
Stoneridge Appoints Natalia Noblet as President of Electronics Division,2024-05-22T21:10:00.000Z,Low,Positive,"Stoneridge (NYSE: SRI) has appointed Natalia Noblet as president of its Electronics Division, effective September 1, 2024. Noblet succeeds Peter Österberg and will lead financial performance, product development, business strategy, and technical vision for the company's largest and fastest-growing segment. This division focuses on advanced driver assistance products, vision systems, and connectivity and compliance solutions for commercial trucks, buses, and off-highway markets. Noblet previously served as SVP EMEA at ZF's Commercial Vehicle Solutions division and held leadership roles at WABCO. She holds a master's and doctorate degree in economics and management science from Wroclaw University of Economics and Business in Poland.",
"Align Technology Appoints Emory Wright, EVP Direct Fabrication Manufacturing Platform to Build the Company’s Next Generation Manufacturing Operations -- Wright Plans to Retire in 2026",2024-05-22T21:00:00.000Z,Low,Very Positive,"Align Technology (Nasdaq: ALGN) has announced the appointment of Emory Wright as Executive Vice President, Direct Fabrication Manufacturing Platform. Wright will transition from his global operations role and focus on scaling the company’s next-generation manufacturing operations until his retirement in 2026. Srini Kaza has been promoted to EVP, Research and Development, while Dr. Mitra Derakhshan will take on global treatment planning as EVP, Chief Clinical Officer. Jitse Marree will lead global clear aligner manufacturing operations. This restructuring aims to enhance Align’s leadership in 3D printing and digital orthodontics.",
Middlesex Water Holds Annual Shareholders Meeting,2024-05-22T21:51:00.000Z,Low,Neutral,"Middlesex Water held its Annual Shareholders Meeting online on May 21, 2024. Shareholders re-elected Kim C. Hanemann and Ann L. Noble and elected Nadine Leslie as Class I Directors for three-year terms, and re-elected Dennis W. Doll as a Class II Director for a one-year term. They also approved executive compensation and ratified Baker Tilly US, LLP as the external auditor for 2024. Key discussions included financial results, capital investments in New Jersey and Delaware, major treatment plant upgrades, and governance and sustainability initiatives. An audio webcast of the meeting is available for one year on the company’s website.",
Altius Renewable Royalties Reports Voting Results from May 22 2024 Annual and Special Meeting,2024-05-22T21:05:00.000Z,Low,Neutral,"Altius Renewable Royalties Corp. (TSX: ARR) (OTCQX: ATRWF) announced that all resolutions presented at its May 22, 2024 Annual and Special Meeting of Shareholders were approved. A record high of 89.7% of total common shares, equating to 27,606,034 shares, were voted.Key resolutions included the appointment of Deloitte LLP as auditors with 99.997% approval and the election of directors Earl Ludlow, Karen Clarke-Whistler, David Bronicheski, Anna El-Erian, and André Gaumond, all receiving over 99% approval. Other resolutions such as Say on Pay and unallocated entitlements under LTIP were also passed with over 99% approval.",
Central Securities Corporation Declares Dividend,2024-05-22T20:50:00.000Z,Low,Neutral,"The Board of Directors of Central Securities  (NYSE American: CET) has announced a dividend for common stockholders. The declared dividend is $0.20 per share, with a record date of June 14, 2024, and a payment date of June 26, 2024.Of this dividend, $0.08 per share will be taxable as ordinary income, while $0.12 per share will be taxable as a long-term capital gain. The final tax breakdown for all amounts paid in 2024 will be available after the year-end. For more details, visit businesswire.com.",
Foghorn Therapeutics Raises Approximately $110 Million Through Registered Direct Offering to Advance Pipeline,2024-05-22T22:21:00.000Z,Moderate,Neutral,"Foghorn Therapeutics has successfully closed a registered direct offering, raising approximately $110 million. This funding will bolster the company’s platform and advance its diverse pipeline of treatments for diseases, especially in oncology. The offering, which includes new and existing investors like BVF Partners and Flagship Pioneering, strengthens Foghorn's balance sheet, extending its cash runway into 2027. With $310 million in cash, cash equivalents, and short-term investments, the company is well-positioned for upcoming data readouts and clinical milestones. The offering priced 12,743,039 common shares at $5.51 each, and pre-funded warrants to buy 7,220,794 shares at $5.5099 each.",
"Xenetic Biosciences, Inc. Announces Executive Leadership Transition",2024-05-22T21:00:00.000Z,Low,Neutral,"Xenetic Biosciences has announced the appointment of James F. Parslow as the interim Chief Executive Officer, effective May 16, 2024. Parslow, currently the Chief Financial Officer, will lead the company as it focuses on advancing its immune-oncology technologies. The company aims to drive its pipeline toward a first human clinical study and extend its cash runway. Xenetic is moving forward with its DNase-based oncology program, targeting pancreatic carcinoma and other advanced solid tumors, with preclinical data expected by year-end.",
PesoRama Reports 2024 Financial Results,2024-05-22T21:38:00.000Z,Neutral,Neutral,"PesoRama (TSXV: PESO) reported its FY 2024 financial results, showcasing strong performance with total sales increasing by 41% to $20.5M and gross profits up by 44% to $7M. The company saw an increase in same-store sales by 14%, and store traffic grew by 15.6%. Store profits surged by 59% to $1.7M, driven by strategic merchandising and product assortment. The product gross margin improved to 42.4%, a 2.3% increase. Key achievements include securing a $20M credit facility and opening two new JOi Dollar Plus stores in Mexico.",
MSA Safety Investor Day Recap: Company Introduces Next Phase of Long-Term Strategy for Profitable Growth and 2028 Financial Targets,2024-05-22T21:02:00.000Z,Neutral,Very Positive,"MSA Safety hosted its Investor Day in New York City on May 22, 2024, unveiling its long-term strategy and 2028 financial targets.The company aims to achieve an organic revenue range of $2.1B to $2.3B, an adjusted operating margin of 23.5% to 25.0%, and an adjusted EPS of $10.00 to $11.00.Key strategic pillars include above-market profitable growth, targeted growth accelerators, the MSA Business System, and effective capital deployment.Leadership emphasized innovation, operational excellence, and social impact. CFO Lee McChesney expressed confidence in consistent mid-single-digit organic growth and maintaining a leading position in premium safety solutions. Presentation materials and a webcast replay are available on MSA Safety's Investor Relations website.",
Adagene to Present at Investor Conferences in June,2024-05-22T20:45:00.000Z,Low,Very Positive,"Adagene (Nasdaq: ADAG) will participate in multiple investor conferences in June 2024. CEO and Chairman, Peter Luo, Ph.D., will provide company updates, particularly on the ADG126 SAFEbody® anti-CTLA-4 progress. The Jefferies Global Healthcare Conference in New York City is scheduled for June 5, followed by the Goldman Sachs 45th Annual Global Healthcare Conference in Miami on June 13. Lastly, the HC Wainwright 2nd Annual Immune Cell Engager Virtual Conference will be held on June 25. Investors can access live webcasts and replays on Adagene's website.",
McDONALD'S ANNOUNCES QUARTERLY CASH DIVIDEND,2024-05-22T22:30:00.000Z,Low,Neutral,"On May 22, 2024, McDonald's Board of Directors announced a quarterly cash dividend of $1.67 per share of common stock. This dividend will be payable on June 17, 2024, to shareholders who are recorded by the close of business on June 3, 2024.For further updates, including future investor conferences and earnings calls, stakeholders are encouraged to visit McDonald's Investor Relations website.",
Banco BBVA Argentina S.A. announces First Quarter 2024 results,2024-05-22T20:49:00.000Z,Low,Neutral,"Banco BBVA Argentina S.A. (NYSE: BYMA; MAE: BBAR) announced its consolidated results for the first quarter of 2024, ended on March 31, 2024.The inflation-adjusted net income was $34.2 billion, a 53.7% decrease from 4Q23 and a 41.4% decrease from 1Q23. Operating income was $631.2 billion, down 12.9% from 4Q23 but up 106.6% from 1Q23.Total consolidated financing to the private sector was $2.7 trillion, down 12.7% from 4Q23 and 21.9% from 1Q23. Total consolidated deposits were $4.8 trillion, a 13.5% decrease from 4Q23 and a 21.7% decline year-over-year.The non-performing loan ratio was 1.23%, with a coverage ratio of 173.77%. The efficiency ratio deteriorated to 65.4%, and the regulatory capital ratio was 35.6%.The bank's market share of private sector loans was 10.08%, while its market share of private deposits was 7.37%. Total liquid assets represented 91.9% of total deposits.",
Datametrex Announces Disposition of Shares of New World Solutions Inc.,2024-05-22T20:30:00.000Z,Neutral,Neutral,"Datametrex AI  (TSXV: DM, FSE: D4G, OTC Pink: DTMXF) announced the sale of 4,570,000 common shares of New World Solutions Inc. (CSE: NEWS) at an average price of $0.02 per share, generating approximately $95,065 in proceeds. Before the sale, Datametrex held 11,500,000 shares, representing 11.14% of New World's outstanding shares. Post-sale, Datametrex retains 6,930,000 shares, now holding 6.71% of New World's shares—a 4.43% decrease in ownership. The sale was made for investment purposes, and the company may adjust its holdings based on market conditions.",
