title,datetime,impact_score,sentiment,summary,article
"Energy Fuels Announces Q1-2024 Results, Including Continued Net Income, Continued Successful Uranium Ramp-Up, Commissioning Rare Earth Oxides Production, and Steps to Secure World-Scale Sources of Heavy Mineral Sands and Monazite",2024-05-03T20:43:00.000Z,Neutral,Neutral,"Energy Fuels Inc. reported net income of $3.64 million for Q1-2024, with a robust balance sheet of $222.54 million in working capital and no debt. The company sold 300,000 pounds of uranium concentrates for $25.31 million, driving revenue. It completed Phase 1 REE Separation Circuit development and is well-positioned to capture market opportunities with an array of finished inventory. Energy Fuels also announced strategic moves to secure world-scale sources of heavy mineral sands and monazite.",
Tennant Company Announces Senior Leadership Updates to Direct ERP Transformation and Drive Product Innovation,2024-05-03T20:05:00.000Z,Neutral,Positive,"Tennant Company (NYSE: TNC) announced senior leadership updates with Barbara A. Balinski appointed as Senior Vice President, Chief Transformation Officer, and Patrick W. Schottler as Senior Vice President, Chief Marketing and Technology Officer, to drive ERP transformation and product innovation. Balinski will lead the business process transformation initiative while Schottler focuses on product innovation and disruptive technologies. The company aims to consolidate and modernize business processes through an organization-wide SAP conversion. Balinski's experience in leading R&D, Marketing, and IT functions will be important to the success of this initiative. Schottler, with his cross-functional expertise, will manage the company's growing portfolio of brands, innovation pipeline, product lifecycle management, and disruptive technologies to drive enterprise growth.",
Fate Therapeutics Announces Presentation of FT522 Preclinical Data for Autoimmune Diseases in Late-breaking Abstract at ASGCT Annual Meeting,2024-05-03T20:30:00.000Z,Neutral,Neutral,"Fate Therapeutics announced preclinical data for its FT522 program for autoimmune diseases at the ASGCT Annual Meeting. FT522, a CD19-targeted CAR NK cell product candidate, showed promising results in depleting SLE donor B cells and eliminating host immune cells. The ADR technology incorporated into FT522 enhances its potency, potentially offering a new treatment approach for autoimmune diseases.",
Aileron Therapeutics Announces Closing of Underwritten Registered Direct Offering of up to Approximately $40 Million,2024-05-03T20:05:00.000Z,Low,Neutral,"Aileron Therapeutics, Inc. announced the closing of an underwritten registered direct offering of approximately $40 million, with $20 million in initial funding and potential additional proceeds of $20 million from warrants. The offering included 4,273,505 shares of common stock and warrants at a combined public offering price of $4.68 per share. The warrants, exercisable immediately, have an exercise price of $4.68 per share and expire in three years. Titan Partners Group served as the book-running manager for the offering.",
"Great Ajax Corp. Announces Results for the Quarter Ended March 31, 2024",2024-05-03T20:05:00.000Z,Neutral,Neutral,"Great Ajax Corp. announced its results for the quarter ended March 31, 2024, focusing on acquiring and managing mortgage loans. The company reported interest income of $15.7 million, a net loss attributable to common stockholders of $(74.3) million, and an operating loss of $(4.8) million. Earnings per share were a loss of $(2.41) with a book value per common share of $6.87 at the end of the quarter. The company collected total cash of $80.9 million and held $100.1 million in cash and cash equivalents at the end of the quarter. Approximately 84.4% of their portfolio made at least 12 out of the last 12 payments.",
Taitron Announces Quarterly Cash Dividend,2024-05-03T20:05:00.000Z,Low,Neutral,"Taitron Components Incorporated (NASDAQ:TAIT) has announced a quarterly cash dividend of $0.05 per share of common stock, payable on May 31, 2024. The Company's dividend policy aims to provide $0.20 per share annually, paid in $0.05 quarterly installments. Future dividend declarations are subject to the Board of Directors' discretion.",
electroCore Announces Inducement Grant under NASDAQ Listing Rule 5635(c)(4),2024-05-03T20:05:00.000Z,Low,Very Positive,"electroCore, Inc. announced that Donald Melnikoff joined as SVP, Engineering, Regulatory, and Compliance, with an inducement grant of 10,000 RSUs. The RSUs were granted under NASDAQ Listing Rule 5635(c)(4) and will vest over three years.",
Jayud Global Logistics Receives Nasdaq Notification of Non-Compliance with Listing Rule 5550(b)(1),2024-05-03T20:30:00.000Z,Low,Very Positive,"Jayud Global Logistics, a leading supply chain provider, received a notification from Nasdaq regarding non-compliance with the minimum stockholders' equity requirement. The company has 45 days to submit a plan to regain compliance or face potential delisting.",
Caterpillar Announces Virtual 2024 Shareholder Meeting,2024-05-03T21:00:00.000Z,Neutral,Neutral,"Caterpillar Inc. (NYSE: CAT) will hold a virtual annual shareholder meeting on June 12, 2024. Shareholders owning CAT stock as of April 15, 2024, can participate, submit questions, and vote on various agenda items. Details can be found in Caterpillar's 2024 proxy statement.",
Priveterra Acquisition Corp. II Announces Receipt of Notice from Nasdaq Regarding Late Filing of Annual Report on Form 10-K,2024-05-03T21:30:00.000Z,Neutral,Neutral,"Priveterra Acquisition Corp. II (NASDAQ: PMGMU, PMGM, PMGMW) received a notice from Nasdaq due to the late filing of its Annual Report on Form 10-K for the period ended December 31, 2023. The delinquency may lead to delisting of the Company's securities from Nasdaq, and the Nasdaq Hearings Panel will review the matter. The Company must submit its views in writing by May 6, 2024.",
"Kernel Group Holdings, Inc. Extends Period to Consummate Initial Business Combination",2024-05-03T20:05:00.000Z,Low,Neutral,"Kernel Group Holdings, Inc. (NASDAQ: KRNL) has extended the period to consummate its initial business combination to June 5, 2024, marking the fourth out of six permitted extensions. The Company is a special purpose acquisition company.",
Dianthus Therapeutics Announces Inducement Grants Under Nasdaq Listing Rule 5635(c)(4),2024-05-03T20:30:00.000Z,Low,Neutral,"Dianthus Therapeutics, Inc. announced the granting of equity awards to two new non-executive employees as inducements for their employment. The awards comprised non-qualified stock options for a total of 52,000 shares, with a 10-year term and an exercise price of $22.53 per share. The options vest gradually over a 3-year period, subject to specific conditions.",
ORIC Pharmaceuticals Reports Inducement Grants under Nasdaq Listing Rule 5635(c)(4),2024-05-03T20:30:00.000Z,Low,Positive,"ORIC Pharmaceuticals, Inc. announced the granting of 14,500 non-qualified stock options and 2,300 restricted stock units to new non-executive employees under the 2022 Inducement Equity Incentive Plan. The grants were approved as inducements to employment and are subject to vesting conditions.",
"FG Acquisition Corp. Announces Proposed Acquisition of Strong/MDI Screen Systems, Inc. and launch of Saltire Holdings, Ltd.",2024-05-03T21:53:00.000Z,Neutral,Neutral,"FG Acquisition Corp. announces the proposed acquisition of Strong/MDI Screen Systems, Inc. and the launch of Saltire Holdings,  The acquisition aims to acquire a leading global manufacturing and distribution business, providing a compelling investment opportunity. The newly formed Saltire Holdings,  plans to build a portfolio of profitable private equity investments. MDI is a premier manufacturer of large-format projection screens, supplying major cinema operators worldwide. The acquisition values MDI at $30 million, with FGAC intending to acquire all outstanding shares. Upon completion, FGAC will rename itself Saltire Holdings, , with an emphasis on long-term total returns through capital appreciation by investing in undervalued securities.",
Signing Day Sports Provides Announcement on Its Annual Report,2024-05-03T20:15:00.000Z,Moderate,Neutral,"Signing Day Sports, Inc. provided an update on its annual report, revealing audited financial statements for the fiscal year ended December 31, 2023. The report included an audit opinion with a going concern emphasis of matter paragraph. This announcement is in compliance with NYSE American  regulations and does not alter any previous filings for the year.",
Summary Notice of Pendency and Proposed Settlement of Shareholder Derivative Actions,2024-05-03T20:39:00.000Z,Neutral,Neutral,"Apple Inc. announces the pendency and proposed settlement of shareholder derivative actions, with significant benefits for Apple and its shareholders. The settlement involves corporate governance reforms, approval by independent directors, and payment of attorneys' fees. Current shareholders have the right to object to the terms and attend a Settlement Fairness Hearing on July 16, 2024.",
Mersana Therapeutics Announces Inducement Grants Under Nasdaq Listing Rule 5635(c)(4),2024-05-03T20:30:00.000Z,Low,Very Positive,"Mersana Therapeutics, a clinical-stage biopharmaceutical company, granted an inducement award to a new employee on May 1, 2024, under Nasdaq Listing Rule 5635(c)(4). The award consists of a restricted stock unit (RSU) to acquire 35,100 shares of common stock, vesting over four years.",
Delcath Systems Announces Inducement Grants Under Nasdaq Listing Rule 5635(c)(4),2024-05-03T21:15:00.000Z,Low,Very Positive,"Delcath Systems, Inc. (Nasdaq: DCTH) granted equity awards to two individuals as inducements for employment, totaling 33,000 shares of common stock, with an exercise price of $5.20. The options vest over a 24-month period and have a ten-year term, subject to continued employment.",
Brookfield Property Partners Declares Quarterly Dividends on Listed Preferred Units,2024-05-03T20:30:00.000Z,Low,Neutral,"Brookfield Property Partners declared quarterly dividends on its listed preferred units, with distributions ranging from $0.359375 to $0.40625 per unit. The payments are slated for June 28, 2024, to holders of record on June 3, 2024. Brookfield Property Partners is a leading real estate company with a diverse global portfolio.",
Enstar Group Limited Announces Quarterly Preference Share Dividends,2024-05-03T20:15:00.000Z,Low,Neutral,"Enstar Group  announced the payment of cash dividends on its Series D and Series E preference shares. The dividends for both series will be $0.43750 per depositary share and will be payable on June 3, 2024, to shareholders of record on May 15, 2024.",
Adecoagro announces declaration of cash dividends,2024-05-03T20:30:00.000Z,Low,Neutral,"Adecoagro S.A. announced a cash dividend distribution of $17.5 million, equating to approximately $0.1682 per share for shareholders as of May 14, 2024. The first installment will be paid on May 29, 2024, with a second installment scheduled for November 2024. Adecoagro is a prominent sustainable production company in South America, owning vast farmland and industrial facilities in Argentina, Brazil, and Uruguay.",
Neuronetics Reports Inducement Grant Under Nasdaq Listing Rule 5635(c)(4),2024-05-03T20:30:00.000Z,Low,Neutral,"Neuronetics, Inc. granted inducement awards of Restricted Stock Units to thirteen new non-executive employees totaling 55,650 shares of common stock. The awards were approved under NASDAQ Listing Rule 5635(c)(4) as incentives for their employment. The RSU grants vest over four years subject to continued service, following the terms of the Neuronetics 2020 Inducement Plan.",
CNO Financial Group Announces Increase of Quarterly Dividend to $0.16,2024-05-03T20:15:00.000Z,Low,Neutral,"CNO Financial Group, Inc. (NYSE: CNO) announced a $0.01 per share increase in its quarterly dividend, marking the twelfth consecutive annual increase. The Board declared a quarterly cash dividend of $0.16 per share, payable on June 24, 2024, to shareholders of record on June 10, 2024.",
Cross Country Healthcare to Attend Benchmark’s Healthcare House Call Investor Conference,2024-05-03T20:15:00.000Z,Low,Neutral,"Cross Country Healthcare, Inc. (Nasdaq: CCRN) will attend Benchmark's Healthcare House Call Virtual One-on-One Investor Conference on May 21-22, 2024. William J. Burns, Executive Vice President & Chief Financial Officer, and Josh Vogel, Vice President, Investor Relations, will participate in virtual one-on-one investor meetings on Wednesday, May 22, 2024.",
"BlackRock MuniVest Fund, Inc. (MVF) Announces Adoption of Discount Management Program",2024-05-03T22:04:00.000Z,Low,Neutral,"BlackRock MuniVest Fund, Inc. (MVF) has announced the adoption of a discount management program. The Program allows the Fund to repurchase 2.5% of its common shares at 98% of NAV if shares trade at more than a 7.50% discount. The Program will run for six Measurement Periods until September 30, 2025, aiming to enhance long-term shareholder value. However, there's no guarantee of selling all desired shares or the effect on the market. The adoption is part of an Agreement with BlackRock Advisors,  and Karpus Investment Management.",
"OSI Systems President and CEO Deepak Chopra to Retire by Calendar Year-End, Will Remain as Executive Chairman",2024-05-03T21:00:00.000Z,Neutral,Neutral,"OSI Systems, Inc. (NASDAQ: OSIS) revealed that President and CEO Deepak Chopra will retire by the end of the year, continuing as Executive Chairman. A successor will be appointed to take over his current roles.",
"GMV Minerals Inc. Files Notice of Intent to Drill Daisy Creek Project in Lander County, Nevada",2024-05-03T21:05:00.000Z,Neutral,Neutral,"GMV Minerals Inc. has filed a Notice of Intent to drill Daisy Creek Project in Nevada and has applied to extend the expiry date for 4,500,000 common share purchase warrants. The company is targeting to drill in June/July 2024 and is focused on developing precious metal assets in Arizona.",
"LGI Homes, Inc. Reports April 2024 Home Closings",2024-05-03T21:47:00.000Z,Low,Neutral,"LGI Homes, Inc. reported closing 505 homes in April 2024 with 127 active selling communities as of April 30, 2024.",
Tenet Publishes CEO Q&A Interview on Year-End 2023 Financial Results,2024-05-03T20:56:00.000Z,Low,Neutral,Tenet Fintech Group Inc. released an interview with CEO Johnson Joseph discussing the year-end 2023 financial results. The interview covers key insights into the company's performance and is accessible on the company's website.,
"Globalstar, Inc. Earnings Release and Call Notice",2024-05-03T21:03:00.000Z,Moderate,Neutral,"Globalstar, Inc. (NYSE American: GSAT) will announce its first quarter 2024 financial results on May 8, 2024. The earnings call will be held at 5:00 p.m. ET on the same day. Details for participation are provided.",
"Electriq Power Holdings, Inc. Announces Chapter 7 Bankruptcy Filing",2024-05-03T21:47:00.000Z,Moderate,Negative,"Electriq Power Holdings, Inc. has announced a voluntary Chapter 7 bankruptcy filing, resulting in the liquidation of the company's assets. The decision was made after an investigation by the Board of Directors to protect the interests of investors, creditors, former employees, and other parties.",
IEH Corp Announces New Orders in Support of Overseas Allies and Munitions Reserves,2024-05-03T20:30:00.000Z,Neutral,Neutral,"IEH Corp (IEHC) has secured over $5 million in new orders for its Hyperboloid connectors to support various US military programs and overseas allies, boosting munitions reserves. President and CEO Dave Offerman highlights the importance of IEH's connectors in critical defense systems amid global tensions, expecting increased demand following recent congressional funding approval.",
Grupo Aeroportuario del Pacifico Reports in April 2024 a Passenger Traffic Decrease of 7.3% Compared to 2023,2024-05-03T22:34:00.000Z,Low,Neutral,"Grupo Aeroportuario del Pacifico reported a 7.3% decrease in passenger traffic in April 2024 compared to 2023, affecting various airports in Mexico. The company highlighted factors such as decreased seat availability due to engine revisions and the impact of the Holy Week Holiday. Despite introducing new routes, the overall passenger traffic declined, impacting both domestic and international terminals.",
"SiriusXM to Present at the 52nd Annual J.P. Morgan Global Technology, Media and Communications Conference",2024-05-03T20:30:00.000Z,Low,Neutral,"SiriusXM (NASDAQ: SIRI) will be represented by CEO Jennifer Witz at the 52nd Annual J.P. Morgan Global Technology, Media and Communications Conference on May 21. The event will take place at The Westin Boston Seaport District Hotel in Boston, MA, with a live webcast accessible on the SiriusXM Investor Relations website.",
CNH announces voting results of 2024 Annual General Meeting and publishes 2023 Sustainability Report,2024-05-03T20:30:00.000Z,No impact,Positive,"CNH Industrial N.V. (NYSE: CNHI) announced the results of its 2024 Annual General Meeting, where shareholders re-appointed directors and approved a dividend of $0.47 per common share. The AGM also appointed Deloitte Accountants B.V. as the independent auditor for the 2025 financial year and approved the Company's 2023 financial statements. Concurrently, CNH published its 2023 Sustainability Report aligning with GRI Standards and SASB framework.",
"BlackRock Municipal Income Fund, Inc. (MUI) Announces Tender Offer Contingent Upon Approval of Conversion of MUI to Unlisted Closed-End Interval Fund Structure",2024-05-03T22:05:00.000Z,Neutral,Neutral,"BlackRock Advisors,  announced the approval of a tender offer by the Board of Directors of BlackRock Municipal Income Fund, Inc. to repurchase 50% of outstanding common shares at a price equal to 98% of the net asset value. The offer is contingent on the Fund's conversion to an unlisted closed-end fund structure by December 31, 2024. The Conversion is expected to be completed in the second half of 2024, subject to approvals. The Tender Offer and Conversion are part of an agreement between the Fund, BlackRock, and Karpus Management, Inc.",
Spanish Mountain Gold Commences Trading on the Frankfurt Stock Exchange,2024-05-03T22:52:00.000Z,Moderate,Positive,Spanish Mountain Gold  has commenced trading its common shares on the Frankfurt Stock Exchange under the symbol 'S3Y'. This move aims to enhance global visibility and liquidity for European investors.,
FGI INDUSTRIES ANNOUNCES FIRST QUARTER 2024 RESULTS CONFERENCE CALL DATE,2024-05-03T20:34:00.000Z,Low,Neutral,"FGI Industries  (Nasdaq: FGI) will release its first quarter 2024 financial results on May 8, 2024, followed by a conference call on May 9, 2024, to discuss the results. The webcast and presentation materials will be available on the Investor Relations section of the company's website.",
Sentynl Therapeutics Announces Global Acquisition of Zokinvy® (Lonafarnib) for Treatment of Hutchinson-Gilford Progeria Syndrome from Eiger BioPharmaceuticals,2024-05-03T21:00:00.000Z,Neutral,Neutral,"Sentynl Therapeutics, a Zydus Group company, has acquired global rights to Zokinvy® (Lonafarnib) from Eiger BioPharmaceuticals, a treatment for Hutchinson-Gilford Progeria Syndrome. Zokinvy is approved in the U.S., European Union, Great Britain, and Japan for rare genetic diseases. The acquisition aims to broaden the portfolio of medicines for rare diseases, enhancing patient care and well-being.",
DXC Technology to Participate in Upcoming Investor Conferences,2024-05-03T21:00:00.000Z,Low,Neutral,"DXC Technology, a Fortune 500 global technology services company, will participate in investor conferences hosted by J.P. Morgan and TD Cowen in May 2024. The President and CEO, Raul Fernandez, will hold investor meetings and fire side chats at these events, providing a webcast for the audience.",
CMC Metals Ltd. Clarifies Technical Disclosure  For Canadian NI 43-101 Compliance,2024-05-03T20:45:00.000Z,Neutral,Neutral,"CMC Metals  clarifies technical disclosure for Canadian NI 43-101 compliance, addressing issues with the 2020 Technical Report on the Silver Hart Property in Yukon. The report is not compliant with NI 43-101 standards and should not be relied upon until verified. The company also provides information on proposed exploration activities for the 2024 season. Contact details for investor inquiries are included.",
"KB Home Announces the Grand Opening of Its Newest Community in Desirable Buckeye, Arizona",2024-05-04T00:16:00.000Z,No impact,Very Positive,"KB Home announced the grand opening of its newest community, Mystic Vista Enclaves, in Buckeye, Arizona. The homes are designed with modern features, spacious layouts, and stunning mountain views. The company offers personalized homebuilding experiences and is ranked #1 nationally for customer satisfaction. KB Home focuses on innovative design, energy efficiency, and sustainable practices, aiming to provide an exceptional lifestyle for homeowners.",
Canadian Natural Resources Limited Reports Voting Results at Annual and Special Meeting,2024-05-03T21:00:00.000Z,Neutral,Neutral,"Canadian Natural Resources  (CNQ) recently held its Annual and Special Meeting of Shareholders, reporting the voting results. Key highlights include the election of directors, appointment of auditors, approval of executive compensation approach, and a vote on a share split. The company operates in Western Canada, the U.K. North Sea, and Offshore Africa.",
Stellus Capital Investment Corporation Schedules First Quarter 2024 Financial Results Conference Call,2024-05-03T22:05:00.000Z,Low,Neutral,"Stellus Capital Investment  (NYSE: SCM) is set to announce its first-quarter financial results on May 9, 2024, followed by a conference call on May 10, 2024. The call will be led by the CEO and CFO, providing a platform for investors to discuss the company's performance.",
Cboe Global Markets Reports Trading Volume for April 2024,2024-05-03T20:30:00.000Z,Low,Negative,"Cboe Global Markets, a leading derivatives and securities exchange network, reported April trading volume statistics. The data includes average daily trading volume, market share by business segment, and volume in select index products. U.S. Options Trading in Cboe Volatility Index (VIX) options hit a record high. Cboe Japan achieved a record market share. Global FX had strong performance with a new record in spot Full Amount ADNV.",
Radio Fuels Appoints Bill de Jong as Director,2024-05-03T21:00:00.000Z,Low,Neutral,"Radio Fuels Energy Corp. has appointed Bill de Jong as Director, replacing Collin Kettell. Bill de Jong, a lawyer with expertise in Capital Markets, will bring his experience in securities, mergers and acquisitions, and corporate finance to the company. The company expresses gratitude for Mr. Kettell's past contributions.",
Zentek Announces Board and Management Changes,2024-05-03T20:50:00.000Z,Low,Positive,"Zentek  announces board and management changes with the resignation of Dr. Francis Dubé as COO and Brian Bosse as a director, who has been appointed to the advisory board. The Company granted Mr. Bosse stock options for 40,000 shares at $1.42 per share.",
American Oncology Network Announces CFO Transition,2024-05-03T21:30:00.000Z,Moderate,Very Positive,"American Oncology Network (AONC) announced that Dave Gould will step down as Chief Financial Officer, with David Afshar appointed as interim CFO. Afshar brings over 25 years of healthcare finance experience to the role, having worked in both private equity-backed and public company environments. AONC expressed gratitude to Gould for his contributions and emphasized their commitment to providing top-notch cancer care.",
"Unigold Announces Extension of Non-Brokered Private Placement of up to $2,000,000",2024-05-03T22:00:00.000Z,Neutral,Neutral,"Unigold Inc. announces the extension of its non-brokered private placement of up to $2,000,000 until May 30, 2024. The private placement consists of 25,000,000 units at $0.08 per unit, with each unit including a common share and a warrant. The proceeds will fund exploration and development in the Dominican Republic. The closing of the offering is subject to various conditions.",
Gran Tierra Energy Announces Final Voting Results of its Annual Meeting of Stockholders,2024-05-03T21:05:00.000Z,Neutral,Neutral,"Gran Tierra Energy Inc. announced the results of its annual meeting of stockholders, where all nine director nominees were elected, and the ratification of KPMG LLP as the independent registered public accounting firm for 2024 was approved along with the compensation of named executive officers. The detailed voting results were provided.The company also released its 2023 Sustainability Report, emphasizing its commitment to building long-term value and delivering on sustainability goals.",
"Samsara to Announce First Quarter Fiscal Year 2025 Financial Results on June 6, 2024",2024-05-03T20:30:00.000Z,Neutral,Neutral,"Samsara Inc. (NYSE: IOT) will announce its financial results for the first quarter of fiscal year 2025 on June 6, 2024, after the U.S. market closes. A live webcast to discuss the results will be held at 2:00 p.m. Pacific time. The press release will be available on the Samsara investor relations website.",
Sphere Entertainment Co. to Host Fiscal 2024 Third Quarter Conference Call,2024-05-03T20:30:00.000Z,Low,Neutral,"Sphere Entertainment Co. (NYSE: SPHR) will host a conference call to discuss its fiscal third quarter results on May 10, 2024. The call will be accessible via telephone and webcast, with a press release issued prior to the market opening. Call replay and webcast available until May 17, 2024.",
