title,datetime,impact_score,sentiment,summary,article
FICO Survey: Close to 1 in 2 Thais Worried About Being Scammed As Real-Time Payment Risks Grow,2024-05-23T02:00:00.000Z,No impact,Negative,"FICO's latest survey reveals that 45% of Thais are most worried about being tricked into making payments to criminals, highlighting the rising concern over real-time payment fraud. Furthermore, 25% cite identity theft as their top financial crime concern, with 61% believing they have or might have been victims. Interestingly, 36% of Thai consumers prioritize fraud protection when choosing new financial accounts. The rapid adoption of real-time payments in Thailand makes it a hotspot for scammers, necessitating heightened vigilance. The survey, conducted in November 2023, involved 1,002 Thai adults and around 12,000 consumers globally.",
"Copart, Inc. to Present at Baird’s Global Consumer, Technology & Services Conference",2024-05-23T00:26:00.000Z,Low,Neutral,"Copart, a global leader in online vehicle auctions, announced that CFO Leah Stearns will participate in a fireside chat at Baird's Global Consumer, Technology & Services Conference on June 6, 2024. The event will be live-streamed at 10:15 am ET and accessible via Copart's investor relations website. Founded in 1982, Copart connects vehicle consigners with buyers in over 185 countries, selling over 4 million units last year through its innovative online platforms. The company operates across 11 countries with 250 locations, offering services to insurance companies, financial institutions, dealers, and more.",
Feutune Light Acquisition Corporation Announces Extension of the Deadline for an Initial Business Combination and Issuances of Promissory Notes,2024-05-22T23:50:00.000Z,Low,Neutral,"Feutune Light Acquisition  (NASDAQ: FLFV), a blank check company, announced an extension of its deadline to complete an initial business combination. The deadline has been moved from May 21, 2024, to June 21, 2024, following a deposit of $60,000 into the Company's trust account. This extension can be renewed monthly until December 21, 2024, with an additional $60,000 deposit each month. Additionally, on May 22, 2024, the Company issued two promissory notes totaling $150,000 from certain lenders. The funds from these loans are intended to cover general corporate expenses, including costs related to the ongoing business combination.",
Molson Coors Beverage Company Announces Pricing of its Public Offering of Euro-Denominated Senior Notes,2024-05-22T23:35:00.000Z,Neutral,Neutral,"Molson Coors Beverage Company (NYSE: TAP) announced the pricing of its public offering of €800 million of 3.800% Senior Notes due 2032. The offering is expected to close on May 29, 2024, subject to customary conditions. Net proceeds are estimated at €793.5 million after underwriting discounts and expenses. The funds will be used for general corporate purposes, including repaying €800 million in notes maturing in July 2024. Joint book-running managers include Citigroup, BofA Securities, Goldman Sachs, among others. The offering is made under an effective SEC shelf registration statement.",
"PACS Group Announces Pending Acquisition of Operations at 53 Facilities in Pacific Northwest, Real Estate Joint Venture on Majority of the Locations",2024-05-23T00:56:00.000Z,Neutral,Neutral,"PACS Group announced that its subsidiaries will acquire operations of 53 skilled nursing and assisted/independent living facilities in the Pacific Northwest. The facilities, currently operated by Prestige, are spread across 8 states, including Oregon (21), Washington (19), Idaho (6), Nevada (3), and one each in Alaska, Arizona, California, and Montana, with a total of 2,511 skilled nursing beds and 1,334 assisted living units. PACS will lease 37 facilities from a joint venture where it holds a 25% interest, while the remaining 16 will be leased from third-party landlords. The acquisition is expected to close in Q3 2024, subject to regulatory approvals and consents. The upfront capital required includes $15 million for the real estate joint venture. PACS leadership expressed excitement about integrating these facilities and expanding their footprint to 5 new states.",
Zoetis Declares Third Quarter 2024 Dividend,2024-05-22T20:30:00.000Z,Low,Neutral,"The Board of Directors at Zoetis (NYSE: ZTS) has announced a dividend of $0.432 per share for the third quarter of 2024. This dividend will be disbursed on September 4, 2024, to all shareholders of record as of July 18, 2024. The company continues its commitment to returning value to its shareholders through regular dividend payments.",
Intercontinental Exchange CFO Warren Gardiner to Present at the Piper Sandler Global Exchange and Trading Conference on June 5,2024-05-22T20:30:00.000Z,Low,Neutral,"Intercontinental Exchange (NYSE: ICE) announced that CFO Warren Gardiner will present at the Piper Sandler Global Exchange and Trading Conference.The presentation is scheduled for June 5, 2024, at 11:30 a.m. ET. It will be available live and on replay via webcast, accessible on ICE’s investor relations and media webpage.The conference is an important event for showcasing ICE's financial health and strategic plans to investors and stakeholders.",
Peter Tian Appointed Group Treasurer of Equitable Holdings,2024-05-22T20:30:00.000Z,Low,Neutral,"Equitable Holdings (NYSE: EQH) has appointed Peter Tian as Group Treasurer, effective June 3, 2024. Reporting to CFO Robin M. Raju, Tian will join the Operating Committee. His responsibilities include managing banking relationships, capital and liquidity management, and overseeing hedging programs and third-party debt. Tian succeeds Julia Zhang, now Chief Risk Officer. Erik Bass, Head of Investor Relations, will handle ratings agency relationships. Tian, who joined Equitable in 2019, brings over a decade of industry experience, previously leading product and in-force management for Individual Retirement. He holds a degree in Biomedical Engineering from Yale University.",
Granite Awarded $89M Subcontract for United Airlines Terminal B Airside Transformation Program,2024-05-22T20:30:00.000Z,Low,Positive,"Granite (NYSE:GVA) has secured an $89 million subcontract from United Airlines and Manhattan Construction for the United Airlines Terminal B Airside Transformation program at George Bush Intercontinental Airport (IAH). This project is part of a $2 billion initiative funded by United Airlines and the City of Houston. Granite's responsibilities include demolishing and reconstructing the north concrete apron, involving 126,000 SY of demolition and 154,000 SY of concrete paving. The project aims to modernize Terminal B, adding more gates and amenities for travelers. It will start in Summer 2024 and complete by April 2026. The initiative supports Granite's strategy to broaden its Texas Region portfolio and enhance its presence in Houston.",
Verint Wins $4 Million Contract to Increase CX Automation for a Top Five U.S. Bank,2024-05-22T20:30:00.000Z,Low,Neutral,"Verint (NASDAQ: VRNT) announced securing a $4 million multi-year contract from a top five U.S. bank to enhance customer experience (CX) automation in their contact center using the Verint Open Platform. The contract will cover 5,000 agents out of the bank's 40,000 agents, with an option for further expansion. Discussions are also underway regarding the implementation of AI-powered bots, which are not included in the current contract.Dan Bodner, Verint's CEO, expressed confidence in the company's ability to support large brands in modernizing their contact centers and driving AI business outcomes. The initiative aims to improve CX by leveraging advanced AI solutions offered by Verint.",
Shift4 Announces Upcoming Investor Conference Participation,2024-05-22T20:30:00.000Z,Low,Neutral,"Shift4 (NYSE: FOUR), a leader in integrated payments and commerce technology, has announced its participation in several upcoming investor conferences. Key management figures, including President and Chief Strategy Officer Taylor Lauber and CFO Nancy Disman, will be participating in fireside chats at the Baird 2024 Global Consumer, Technology, & Services Conference on June 5, the RBC FinTech Conference on June 11, and the Mizuho Technology Conference on June 12. These events will provide opportunities for one-on-one and small group meetings. Additionally, the fireside chats will be webcasted live, accessible via the Investor Relations section on Shift4’s website.",
AdaptHealth Reports Inducement Grant Under Nasdaq Listing Rule 5635(c)(4),2024-05-22T20:30:00.000Z,Low,Neutral,"AdaptHealth Corp. (NASDAQ: AHCO) announced the grant of restricted stock units (RSUs) to Suzanne Foster, the newly appointed CEO, as an inducement under Nasdaq Listing Rule 5635(c)(4). The grant, approved by the Compensation Committee on May 11, 2024, covers 553,251 shares of common stock at target performance levels. The RSUs vest in three tranches: 229,740 shares over three years starting May 20, 2025, 93,771 shares over two years starting the same date, and the remaining shares based on the Total Shareholder Return (TSR) over a three-year period. The vesting depends on Ms. Foster's continued service with AdaptHealth. The company provides home medical equipment and services, reaching 4.1 million patients annually across 670 locations in 47 states.",
Farmer Brothers Names Vance Fisher Chief Financial Officer,2024-05-22T20:30:00.000Z,Neutral,Neutral,"Farmer Brothers (NASDAQ: FARM), a renowned coffee roaster, wholesaler, and distributor, has appointed Vance Fisher as its new Chief Financial Officer (CFO). Fisher succeeds Brad Bollner, who has been serving as the interim CFO since August 2023 and will now continue as Vice President of Finance. CEO John Moore expressed excitement over Fisher's appointment, citing his successful track record in increasing revenue and EBITDA at previous companies. Fisher's background includes roles at Nothing Bundt Cakes, Dunn’s River Brands, and Daisy Brand, where he significantly contributed to financial growth. Fisher holds dual bachelor's degrees in accounting and finance from the University of Oklahoma. He is enthusiastic about joining Farmer Brothers at a important time as the company focuses on optimizing its Direct Store Delivery (DSD) network and driving long-term growth.",
Gulf Resources Announces Receipt of Nasdaq Non-Compliance Notice,2024-05-22T20:30:00.000Z,Low,Neutral,"Gulf Resources (NASDAQ: GURE) has received a non-compliance notice from Nasdaq due to its failure to timely file its quarterly report for the quarter ended March 31, 2024. This follows a previous notice received in April 2024 for not filing its annual report for the fiscal year ended December 31, 2023. The company has until June 17, 2024, to submit a compliance plan to Nasdaq. If accepted, Gulf Resources may have until October 14, 2024, to comply. Failure to meet these deadlines could result in the delisting of its common stock. Gulf Resources is working diligently to complete the outstanding reports.",
Kronos Bio to Participate in Three Upcoming Healthcare Conferences and Events,2024-05-22T20:30:00.000Z,Low,Neutral,"Kronos Bio announces its participation in three upcoming healthcare conferences. CEO Norbert Bischofberger will represent Kronos Bio at these events. On May 28, 2024, he will join a virtual fireside chat at TD Cowen's Oncology Innovation Summit. On June 5, 2024, he will present a corporate overview and host investor meetings at the Jefferies Global Healthcare Conference in New York. Lastly, on June 11, 2024, he will participate in a fireside chat and host investor meetings at the Goldman Sachs Global Healthcare Conference in Miami. Live webcasts of these events will be available on Kronos Bio's website.Kronos Bio is a clinical-stage company focused on developing small molecule therapeutics for cancers driven by deregulated transcription. Its drug candidates include KB-0742, targeting CDK9 for solid tumors, and KB-9558, targeting p300 for multiple myeloma.",
NVIDIA Announces Financial Results for First Quarter Fiscal 2025,2024-05-22T20:20:00.000Z,Neutral,Neutral,"NVIDIA announced its Q1 FY25 financial results, reporting a record quarterly revenue of $26.0 billion, an increase of 18% from Q4 and 262% year-over-year. Data Center revenue also reached a record $22.6 billion, up 23% from Q4 and 427% year-over-year. GAAP earnings per share were $5.98, up 21% from Q4 and 629% year-over-year, while non-GAAP earnings per share were $6.12, up 19% from Q4 and 461% year-over-year. The company introduced a ten-for-one forward stock split effective June 7, 2024, and raised its quarterly cash dividend by 150% to $0.01 per share on a post-split basis. The revenue outlook for Q2 FY25 is projected at $28.0 billion, with gross margins expected to be around 74.8% GAAP and 75.5% non-GAAP. Key drivers for the growth include strong demand for generative AI and the launch of new platforms such as Blackwell and Spectrum-X. NVIDIA also expanded partnerships with major cloud providers and automotive companies.",
Coty Inc. Prices €500 Million of Senior Secured Notes,2024-05-22T20:24:00.000Z,Low,Neutral,"Coty has announced the pricing of €500 million in Senior Secured Notes due 2027, with a 4.500% interest rate. The Notes, issued alongside its subsidiaries HFC Prestige Products and HFC Prestige International U.S. , are part of a private offering. Closing is expected on May 30, 2024, pending customary conditions. The proceeds will be used to redeem existing 6.500% Senior Notes due 2026, repay part of its revolving credit facility, and cover offering expenses. The Notes will be secured by first-priority liens, which will be released upon achieving investment-grade ratings from two of three major ratings agencies.",
Goldlogic Corp. Announces Amendment to Offtake Agreement with Soma Gold Corp. to Support 2024 Exploration and Development Initiatives,2024-05-22T20:27:00.000Z,Neutral,Very Positive,"Goldlogic Corp. has amended its offtake agreement with Soma Gold Corp. to include an additional $3 million advance.This brings the total amount to $8 million to support Soma's Aurora Mine development and increase its 2024 exploration budget. Soma will provide Goldlogic with a monthly cash payment equivalent to 59.9 ounces of gold for 36 months starting June 2024. The funds will expedite drilling on several targets across Soma's 41,000-hectare property in Colombia, aiming to enhance production and resource identification. The amendment follows successful completion of earlier tranches and aligns with Goldlogic's goal of fostering growth in the Colombian gold mining sector.",
Crescent Energy Receives Favorable Responses from All Three Rating Agencies on Its Recently Announced Agreement to Acquire SilverBow Resources,2024-05-22T20:20:00.000Z,Neutral,Neutral,"Crescent Energy Company (NYSE: CRGY) announced favorable responses from S&P Global Ratings, Fitch Ratings, and Moody’s Ratings regarding its agreement to acquire SilverBow Resources, expected to close on May 16, 2024. S&P and Fitch took positive rating actions while Moody’s reaffirmed its stable outlook. The acquisition, valued at $2.1 billion, aims to enhance Crescent's scale and financial strength. SilverBow shareholders can opt for stock or cash, with a maximum cash consideration of $400 million. The merger is anticipated to close by Q3 2024, pending customary approvals.",
"Sysco Defines Plans at 2024 Investor Day to Improve Core Performance, Advance Recipe for Growth Strategy, Increase Shareholder Value",2024-05-22T20:30:00.000Z,Neutral,Very Positive,"On May 22, 2024, Sysco hosted its Investor Day at the NYSE, detailing its three-year growth strategy. CEO Kevin Hourican outlined plans to enhance core performance and continue its 'Recipe for Growth' initiative.Sysco aims for 4-6% annual sales growth and 6-8% adjusted operating income growth. Anticipated total return to shareholders is 9-11% per year via dividends. They will leverage merchandising, supply chain capabilities, and international market growth.Sysco introduced 'Sysco Marketplace' to expand product offerings and facilitate third-party sales. The company focuses on local case growth and independent market share through Total Team Selling.",
Codexis to Participate in Jefferies Global Healthcare Conference,2024-05-22T20:25:00.000Z,Low,Neutral,"Codexis (NASDAQ: CDXS), a prominent enzyme engineering company, announced its participation in the Jefferies Global Healthcare Conference on June 5-6, 2024, in New York. Management will engage in a fireside chat on June 5 at 11:30 am ET. A live webcast and an archived replay will be accessible via Codexis' Investor Relations webpage.",
"Dycom Industries, Inc. to Participate in Upcoming Investor Conferences",2024-05-22T20:30:00.000Z,Low,Neutral,"Dycom Industries (NYSE: DY) announced it will participate in several investor conferences:- May 29, 2024: KeyBanc Industrials and Basic Materials Conference in Boston, MA, with senior management available for meetings.- June 4, 2024: UBS Reshoring and Infrastructure Conference in New York, NY, with senior management available for meetings.- June 5, 2024: Stifel 2024 Cross Sector Insight Conference in Boston, MA, featuring a fireside chat by CEO Steve Nielsen at 9:45 a.m. ET, along with senior management meetings. The fireside chat will be webcasted live and available for replay for 90 days on Dycom's Investor Center website.",
Radian Increases Share Repurchase Authorization from $300 Million to $900 Million and Approves Regular Quarterly Dividend on Common Stock,2024-05-22T20:20:00.000Z,Low,Neutral,"Radian Group (NYSE: RDN) has announced an increase in its share repurchase authorization from $300 million to $900 million, extending the program to June 30, 2026. This move allows the company to repurchase an additional $600 million in shares, depending on market and business conditions. As of March 31, 2024, Radian has already repurchased approximately 7 million shares for a total of $183 million. Additionally, the Board of Directors has approved a regular quarterly dividend of $0.245 per share, payable on June 20, 2024, to stockholders of record as of June 4, 2024.",
Avangrid Celebrates Cape Cod Grid Upgrades Supported by New England Wind 1 Project,2024-05-22T20:28:00.000Z,No impact,Positive,"Avangrid, a sustainable energy company, announced the completion of Phase 1 of the Cape Cod Solution grid upgrade in Massachusetts, investing over $13.7 million. This upgrade, part of the New England Wind 1 project, enhances reliability and resiliency by converting a 115kV line to 345kV between Bourne and West Barnstable. Future upgrades will further support this transformation. New England Wind 1 aims to provide clean energy to approximately 400,000 homes and create over 4,400 jobs. The project has received necessary approvals and is poised to commence construction in 2024, potentially achieving commercial operations by the end of the decade. The initiative aligns with state climate goals and promises significant economic and environmental benefits for the region.",
Teucrium Announces Changes to Fund Lineup,2024-05-22T20:30:00.000Z,Neutral,Neutral,"Teucrium Investment Advisors has announced the liquidation of the Teucrium AiLA Long-Short Base Metals Strategy ETF (OAIB). The fund will cease accepting creation orders around June 5, 2024, and trading will halt on the NYSE Arca before market open on June 6, 2024. Liquidation proceeds are expected to be distributed to shareholders on June 6, 2024. During this period, the fund will shift from its investment objective and increase its cash holdings. Shareholders are advised to consult with tax advisers regarding potential tax implications.",
"United Natural Foods to Release Fiscal 2024 Third Quarter Results on June 5, 2024",2024-05-22T20:20:00.000Z,Low,Neutral,"United Natural Foods (NYSE: UNFI) will announce its fiscal 2024 third quarter results on June 5, 2024. The quarter ended on April 27, 2024. Management will discuss the results during a conference call at 8:30 a.m. ET the same day. Investors can join the call via a toll-free number or access the audio webcast on the company's website. The webcast will be archived online for 120 days.",
EnerSys Reports Fourth Quarter and Full Year Fiscal 2024 Results,2024-05-22T20:19:00.000Z,Neutral,Neutral,"EnerSys (NYSE: ENS) reported its fourth quarter and fiscal year 2024 results, ending March 31, 2024.Fourth-quarter net sales were $911 million, an 8% decrease from the previous year, mainly due to temporary spending pauses in telecom and broadband sectors.The gross margin improved by 300 basis points to 27.9%, driven by cost-improvement actions and tax credits.Full-year net sales declined by 3% to $3.6 billion. Despite this, the company achieved a record diluted EPS of $6.50, up 53%, and an adjusted diluted EPS of $8.35, up 56%.EnerSys announced the acquisition of Bren-Tronics, expected to close by the end of the fiscal first quarter.The company's fiscal 2025 outlook includes net sales between $3.675 billion and $3.825 billion and adjusted diluted EPS between $8.55 and $8.95.EnerSys is advancing its lithium-ion cell gigafactory and expects funding awards from the Department of Energy in August.",
EnerSys Announces Dividend of $0.225 Per Share for the First Quarter of Fiscal Year 2025,2024-05-22T20:17:00.000Z,Low,Neutral,"EnerSys (NYSE: ENS) has announced a quarterly cash dividend of $0.225 per share for the first quarter of fiscal year 2025. The dividend is payable on June 28, 2024, to shareholders recorded as of June 14, 2024. EnerSys is a leading provider of stored energy solutions for industrial applications.",
Lifecore Announces Inducement Grants Under Nasdaq Listing Rule 5635(c)(4),2024-05-22T20:16:00.000Z,Low,Very Positive,"Lifecore Biomedical announced the granting of restricted stock unit (RSU) and performance stock unit (PSU) awards to Paul Josephs, their new President and CEO. The RSU comprises 525,000 shares and the PSU up to 1,500,000 shares. Approved by Lifecore's compensation committee, these inducement awards were granted under Nasdaq Listing Rule 5635(c)(4) and Lifecore's Equity Inducement Plan. The RSU will vest in tranches over five years, while the PSU's vesting depends on meeting share price performance targets within a five-year period. This move aims to align Josephs’ incentives with company performance and shareholder value.",
Universal Corporation Reports Annual Results,2024-05-22T20:16:00.000Z,Low,Neutral,"Universal  (NYSE: UVV) reported its annual results for fiscal year 2024, ending March 31. The company saw a 7% increase in consolidated revenues, reaching $2.75 billion, driven mainly by higher tobacco sales prices. Tobacco operations yielded $2.44 billion in revenues, an 8% increase. However, the ingredients business saw a slight decline in revenues to $309.8 million. Operating income improved by 23% to $222 million, with adjusted operating income up by 27% to $230.3 million. Despite the higher revenues, diluted earnings per share dropped 4% to $4.78. The company faced higher costs due to increased green tobacco prices and other operational expenses.Universal's sustainability initiatives made progress, including significant steps towards emissions targets and a renewable energy agreement. The company is optimistic about future growth, particularly in its ingredients business, supported by new product sales and an ongoing expansion project at the Lancaster facility.",
InterContinental Hotels Group PLC - Transaction in Own Shares - May 23,2024-05-23T06:00:00.000Z,Low,Neutral,"InterContinental Hotels Group (IHG) announced the repurchase of 60,000 of its ordinary shares on May 22, 2024, through Goldman Sachs International. The shares were bought at prices ranging from £77.60 to £78.56, averaging £78.08 per share.The buyback was conducted under the authority granted at the Annual General Meeting on May 3, 2024.Following this transaction, IHG has a total of 162,306,263 ordinary shares in issue, excluding 7,006,782 shares held in treasury.",
CrowdStrike Partner Award Winners Recognized at Annual Europe Partner Symposium,2024-05-23T07:00:00.000Z,No impact,Neutral,"CrowdStrike recently announced the winners of its annual Europe Partner Awards at the CrowdStrike Partner Symposium in Venice, Italy. This event brought together top regional partners to strategize on scaling businesses, consolidating security spend, and stopping breaches using the AI-powered CrowdStrike Falcon® XDR platform.The awards recognize the outstanding contributions of regional partners in the previous year. Awardees include BT, Henning Dey from PMCS, Exaprobe, Kudelski Security, Computacenter GmbH, Telefonica Tech Spain, Softcat, and AWS.John Taylor, VP of Alliances, Europe at CrowdStrike, emphasized the importance of the Falcon platform and partner expertise in achieving exceptional results for joint customers. CrowdStrike aims to continue expanding its market presence in Europe and globally.",
Argo Blockchain PLC Announces 1st Quarter Results,2024-05-23T06:00:00.000Z,Neutral,Neutral,"Argo Blockchain plc (LSE:ARB, NASDAQ:ARBK), a global leader in cryptocurrency mining, has released its unaudited financial results for Q1 2024, ending March 31, 2024. The company reported a revenue increase of 4% to $16.8 million compared to Q4 2023. Argo mined 319 Bitcoin, averaging 3.5 BTC per day, with a mining margin of 38%, up from 34% in the previous quarter. The company reduced its debt by $12.4 million, ending the quarter with $12.4 million in cash and 11 BTC. A gain of $3.0 million was recorded from the sale of the Mirabel facility. Despite these positives, Argo reported a net loss of $3.2 million for the quarter. Adjusted EBITDA stood at $3.8 million.",
