title,datetime,impact_score,sentiment,summary,article
MarketWise Declares Dividend on Common Stock,2024-05-03T21:15:00.000Z,Low,Neutral,"MarketWise, Inc. (NASDAQ: MKTW) declared a quarterly cash dividend of $0.01 per share for Class A common stock and $0.01 per unit for MarketWise,  units. The payment date is June 25, 2024, with a Record Date of May 15, 2024. MarketWise is a digital subscription service platform providing financial research and tools for investors.",
"Praxis Precision Medicines, Inc. Announces Inducement Grants Under Nasdaq Listing Rule 5635(c)(4)",2024-05-03T20:45:00.000Z,Low,Very Positive,"Praxis Precision Medicines, Inc. announced the granting of non-qualified stock options and restricted stock units to six new non-executive employees under the 2024 Inducement Plan. The options have an exercise price of $55.16 per share and will vest over four years, while the restricted stock units will vest in four equal annual installments. This move aims to attract and retain top talent for the company.",
Sunoco LP Announces Purchase of NuStar Preferred Units and Full Redemption of NuStar Logistics Subordinated Notes,2024-05-03T20:01:00.000Z,Low,Neutral,"Sunoco LP announced the purchase of NuStar Preferred Units and the full redemption of NuStar Logistics Subordinated Notes. SUN will buy all outstanding units of NuStar's Preferred Units on June 3, 2024, while Logistics will redeem all of its outstanding Subordinated Notes due 2043. The redemption and purchase will be made on the Redemption Date with final cash distributions to holders of the Preferred Units. The redemption price for the Preferred Units and Subordinated Notes will be paid out accordingly.",
"Atara Biotherapeutics, Inc. Reports Inducement Grant Under Nasdaq Listing Rule 5635(c)(4)",2024-05-03T20:01:00.000Z,Low,Very Positive,"Atara Biotherapeutics, Inc. granted 4,150 restricted stock units to a newly hired employee under the Nasdaq Listing Rule 5635(c)(4). The stock units vest over four years, subject to continuous employment.",
NewAmsterdam Pharma Reports Inducement Grants Under Nasdaq Listing Rule 5635(c)(4),2024-05-03T20:01:00.000Z,Low,Very Positive,"NewAmsterdam Pharma Company N.V. announced the grant of inducement share options to three non-executive new hires under the 2024 Inducement Plan. The options cover 30,000 ordinary shares, with an exercise price of $21.97 per share. The shares will vest over four years, with 25% vesting after one year and the rest in monthly installments, contingent on continued service.",
Verve Therapeutics Announces Inducement Grants under Nasdaq Listing Rule 5635(c)(4),2024-05-03T20:01:00.000Z,Low,Very Positive,"Verve Therapeutics granted equity awards to ten new employees under the company's 2024 Inducement Stock Incentive Plan. The employees received stock options and restricted stock units, totaling 64,200 shares and 56,100 RSUs. The options have an exercise price of $6.01 per share and will vest over four years, while the RSUs will vest annually over four years.",
OSI Systems to Present at Oppenheimer 19th Annual Industrial Growth Conference,2024-05-03T20:01:00.000Z,Low,Neutral,"OSI Systems, Inc. (NASDAQ: OSIS) will be presenting at the Oppenheimer 19th Annual Industrial Growth Conference on May 6, 2024. Investors can tune in to the live webcast on the company's website.",
Aston Bay Holdings Files Amended Offering Document and Refiles Interim Financial Statements,2024-05-03T20:00:00.000Z,Moderate,Neutral,"Aston Bay Holdings  (OTCQB:ATBHF) has filed an amended Offering Document and refiled its condensed interim financial statements for the nine months ended December 31, 2023. The corrections made include fixing a typographical error in the number of warrants issued and reflecting the expiration of warrants. No other changes were made to the financial statements. The refiled financial statements replace the previously filed interim financial statements.",
Arcutis Biotherapeutics Reports Inducement Grants Under Nasdaq Listing Rule 5635(c)(4),2024-05-03T20:00:00.000Z,Low,Neutral,"Arcutis Biotherapeutics, Inc. (Nasdaq: ARQT) granted restricted stock units and options to 13 new employees as an inducement for joining the company. The awards were approved by the Compensation Committee of Arcutis' Board of Directors and are part of the 2022 Inducement Plan. The grants are subject to vesting conditions over four years, with stock options having a ten-year term and an exercise price of $8.84 per share.",
Omnicell to Present at the BofA Securities 2024 Health Care Conference,2024-05-03T20:01:00.000Z,Low,Neutral,"Omnicell, Inc. (OMCL) will be presenting at the BofA Securities 2024 Health Care Conference in Las Vegas, NV. The presentation will take place on May 15, 2024, at 3:40 p.m. PT. The event will be live-streamed and available for viewing on the Omnicell website.",
Mural Oncology Reports Inducement Grants Under Nasdaq Listing Rule 5635(c)(4),2024-05-03T20:00:00.000Z,Low,Very Positive,"Mural Oncology plc announced the granting of non-statutory stock options and restricted stock units to three newly hired employees as inducement material. The stock options have an exercise price of $3.78 per share, with a ten-year term and vesting over four years. The restricted stock units also vest over four years, 25% per year, subject to continued service with the Company.",
"Pacific West Bancorp (""PWBK"") announces Leadership Promotions: Transition of CEO, Promotion of President to CEO, and Key Leadership Appointments",2024-05-03T20:00:00.000Z,Neutral,Very Positive,"Pacific West Bancorp announces leadership promotions, including the transition of the CEO and the promotion of the President to CEO on June 1st, 2024. Terry Peterson retires as CEO, with Jason Wessling taking over. Lisa Fajardo-Faust and Sujana Regmi-Schuler also receive promotions within the company. The company emphasizes continuity and talent development in its leadership team.",
"S&P Global to Present at the Barclays Americas Select Franchise Conference on May 7, 2024",2024-05-03T20:00:00.000Z,Low,Neutral,"S&P Global's President and CEO, Doug Peterson, will be participating in the Barclays Americas Select Franchise Conference on May 7, 2024, in London, UK. The session will be webcast, with Mr. Peterson scheduled to speak from 1:30 p.m. to 2:10 p.m. BST.",
Tortoise Announces Revision of Treatment of Constituent Changes Due to Corporate Action,2024-05-03T20:00:00.000Z,Low,Neutral,"Tortoise announced a revision to the corporate action treatment for the Tortoise North American Pipeline Index (TNAP), with NuStar Energy LP being removed due to an approved acquisition by Sunoco LP. Special rebalancings will occur in the Tortoise MLP Index (TMLP) and the TNAP as a result of these changes.",
Vor Bio Reports Inducement Grant Under Nasdaq Listing Rule 5635(c)(4),2024-05-03T20:01:00.000Z,Low,Very Positive,"Vor Bio granted stock options and restricted stock units to six newly hired employees as inducements to employment, in accordance with Nasdaq Listing Rule 5635(c)(4). The options and RSUs have a ten-year term, with vesting over a four-year period based on continued employment.",
"Nepra Foods Announces Filing of March 31, 2023, Audited Financial Statements",2024-05-03T19:55:00.000Z,Neutral,Neutral,"Nepra Foods announced the filing of audited financial statements for March 31, 2023, along with MD&A and subsequent quarterly financial statements. The company aims to resume trading on the Canadian Securities Exchange after the cease trade order issued in October 2023.",
Marcus & Millichap Releases Cold Storage Property Research Report,2024-05-03T19:38:00.000Z,Neutral,Neutral,"Marcus & Millichap, a leading commercial real estate brokerage firm, released a research report on cold storage properties. The report highlights the increasing demand for temperature-controlled storage facilities due to the rise in online grocery sales. Cold storage spaces are important for climate-sensitive goods like food and pharmaceuticals, with projected growth in demand driven by online grocery spending and population migration. The report emphasizes the role of cold storage in the exportation of agricultural products internationally. Marcus & Millichap closed 7,546 transactions in 2023, with a sales volume of approximately $43.6 billion.",
"Jessica Green joins the Community Heritage Financial, Inc. Board of Directors",2024-05-03T19:00:00.000Z,No impact,Neutral,"Community Heritage Financial, Inc. welcomes Jessica Green as an independent director to the board of directors. Ms. Green brings operational expertise from her background in organizations like L'Oréal USA and Antrim Way Honda. Her appointment is expected to add value to the company and the Bank as she joins the dedicated board members in steering the organization towards continued success.",
The Future of PropStream is Here: New Features + AI Datasets,2024-05-03T19:15:00.000Z,Low,Very Positive,"PropStream's President, Brian Tepfer, unveils the future of real estate data with upgrades leveraging Predictive Real Estate Data for new features and AI predictive analytics. The platform focuses on coverage, speed, and accuracy to empower real estate professionals with informed decisions. The enhancements include data partnerships, infrastructure upgrades, AI tools, valuation modeling, demographic data, lead lists, photo AI insights, and predictive property scores for streamlined lead generation.",
Capstone Holding Corp. Reinstates Tax Benefit Plan,2024-05-03T16:15:00.000Z,Moderate,Neutral,"Capstone Holding Corp. reinstated a Tax Benefit Plan, declaring a dividend distribution of one Right for each outstanding share of common stock to shareholders of record as of May 1, 2024. Each Right entitles the holder to purchase Series A Preferred Stock at an exercise price of $5. The Board aims to protect the Company's Tax Benefits through the Benefit Plan until April 1, 2027.",
DXP Sets Date for 2024 First Quarter Earnings Release and Conference Call,2024-05-03T19:21:00.000Z,Low,Neutral,"DXP Enterprises, Inc. (NASDAQ:DXPE) will release its financial results for the first quarter of 2024 on May 8th after the market closes. A conference call will be held on May 9th at 10:30 A.M. Central Time, with a webcast available on the company's website. Earnings press release, slides, and other presentation materials will be posted on the Investor Relations section of DXP's website.",
Hertz Energy Submits Applications to Acquire Uranium Focused Claims in Namibia,2024-05-03T19:15:00.000Z,Neutral,Positive,"Hertz Energy Inc. has submitted applications for uranium Exclusive Prospecting Licenses (EPLs) in Namibia, a country with rich uranium mineral reserves. Namibia is a key uranium jurisdiction, boasting political stability, infrastructure, and community support for mining. The applications cover areas in Central Namibia with primary and secondary uranium deposits. The company is targeting secondary uranium mineralization with the potential for primary mineralization in the application areas. The applications were filed by Odikwa Geoservices, led by Mary Barton, a respected geologist. Hertz Energy aims to expand its presence in the green energy metals markets by entering Namibia.",
CMS Energy Declares Quarterly Dividend on Cumulative Redeemable Perpetual Preferred Stock,2024-05-03T19:00:00.000Z,Low,Neutral,"CMS Energy Declares Quarterly Dividend on Cumulative Redeemable Perpetual Preferred StockThe Board of Directors of CMS Energy has declared a dividend on the 4.200% Cumulative Redeemable Perpetual Preferred Stock, Series C, payable on July 15, 2024. The dividend is $0.2625 per depositary share. For more information on CMS Energy's dividend distributions and tax status, visit their website.",
Rubric Capital Management Responds to Xperi Inc.’s Amended Investor Presentation,2024-05-03T16:58:00.000Z,Neutral,Neutral,"Rubric Capital Management responds to Xperi Inc.'s amended investor presentation, highlighting the company's falsified version of performance and dilution issues, urging stockholders to vote for Rubric's nominees. Rubric criticizes Xperi's board members for presiding over significant losses and exemplifies the company's aggressive stock-based compensation practices. Rubric aims to restore accountability and performance culture through its director nominees.",
Neurocrine Biosciences Presented CAHtalyst™ Pediatric Study Baseline Characteristics and CAHtalog™ Registry Data at PES 2024,2024-05-03T17:15:00.000Z,Neutral,Neutral,"Neurocrine Biosciences presented CAHtalyst™ Pediatric Study Baseline Characteristics and CAHtalog™ Registry Data at PES 2024, highlighting the need for novel treatments in children and adolescents with Congenital Adrenal Hyperplasia (CAH). The data showcased the challenges in long-term CAH management, emphasizing the limitations of current treatment approaches and the difficulties in disease management as patients age into adulthood. Additionally, positive top-line data from previous Phase 3 clinical studies supported two New Drug Applications submitted to the FDA in April 2024.",
U.S. Air Force Secretary Kendall Flies in AI-piloted X-62A VISTA,2024-05-03T17:21:00.000Z,Neutral,Neutral,"Lockheed Martin's X-62A VISTA aircraft, equipped with AI technology, hosted U.S. Air Force Secretary Frank Kendall for flights to test and advance AI-enabled autonomous flight capabilities. The AI pathfinder facilitates the development and testing of cutting-edge AI techniques for uncrewed vehicles. With over 100,000 lines of flight-critical software changes completed, the platform demonstrates the potential of AI in aerospace innovation.",
PotlatchDeltic: Risk Management,2024-05-03T17:20:00.000Z,Low,Neutral,"PotlatchDeltic utilizes an Enterprise Risk Management (ERM) framework to identify, assess, and mitigate significant risks facing the company, including those related to corporate responsibility. The Risk Committee, Audit Committee, and senior management play key roles in overseeing risks. Environmental issues and climate change are specifically addressed in the ERM process, with a focus on identifying, assessing, and mitigating related risks. The company is committed to enhancing its ERM framework to address emerging risks and opportunities.",
Gold Reserve Announces Appointment of Executive Vice-Chairman; Amendment to Equity Incentive Plan,2024-05-03T18:00:00.000Z,Low,Very Positive,"Gold Reserve Inc. (GDRZF) appoints Paul Rivett as Executive Vice-Chairman, granting him 750,000 stock options. The company also increases available shares under the 2012 Equity Incentive Plan to 14,932,307 and grants Rivett 2,500,000 conditional stock options.",
Otter Tail Corporation Declares Quarterly Dividend,2024-05-03T19:30:00.000Z,Low,Neutral,"Otter Tail  (OTTR) declared a quarterly common stock dividend of $0.4675 per share, payable on June 10, 2024, to shareholders of record May 15, 2024. The  will release its first quarter 2024 financial results on May 6, 2024, and hold an earnings call on May 7, 2024.",
"Northern Trust Named Best Private Bank in U.S. for Digital Wealth Planning, Best Digital Innovator of the Year in U.S.",2024-05-03T19:21:00.000Z,No impact,Very Positive,"Northern Trust has been awarded Best Private Bank in the US for Digital Wealth Planning and Best Digital Innovator of the Year in the US by the Financial Times and PWM's Wealth Tech Awards. The recognition showcases Northern Trust's success in enhancing client experiences through technology innovations. With a focus on client and advisor needs, Northern Trust has implemented new patented technology, improved speed-to-market, and deployed high-performing teams to transform the wealth management experience.",
Aqua Texas Begins $4M Main Replacement Project in Wimberley Valley,2024-05-03T17:28:00.000Z,Low,Neutral,"Aqua Texas has initiated a $4 million water main replacement project in Hays County, benefiting the Woodcreek North community, to improve water infrastructure and conserve water. The project aims to replace 5,000 feet of aging water mains initially, with a total of over 25,000 feet planned to be replaced. Residents may experience traffic disruptions, but the investment will enhance water service reliability and quality.",
"Overseas Shipholding Group to Announce First Quarter 2024 Results on May 10, 2024",2024-05-03T19:50:00.000Z,Low,Neutral,"Overseas Shipholding Group, Inc. (NYSE: OSG) will announce its first quarter 2024 results on May 10, 2024. The Company will host a conference call and webcast to discuss the results. Participants can dial in or watch the live webcast on the Investors section of the company's website.",
U.S. Bancorp promotes Gunjan Kedia to president,2024-05-03T18:30:00.000Z,Low,Very Positive,"U.S. Bancorp (NYSE: USB) has promoted Gunjan Kedia as the new president, overseeing all revenue lines to ensure growth and enhance client experiences. Kedia brings nearly 30 years of financial services experience and a track record of success, recognized for her leadership and influence in the industry.",
MultiSensor AI Announces Investor Agreements for the Conversion of $6.555 Million Convertible Debt to Equity,2024-05-03T19:25:00.000Z,Moderate,Neutral,"MultiSensor AI Holdings, Inc. (NASDAQ:MSAI) recently converted $6.555 million of convertible debt to equity, fortifying its balance sheet and improving capital structure. Only $250,000 of the original $6,805,000 notes remain outstanding after a strategic move to eliminate debt. The company now has 13,702,265 shares of common stock outstanding, with the conversions signaling investor optimism and providing resources for future growth.",
"CSPi to Announce Fiscal Second Quarter Results on May 8, 2024",2024-05-03T18:00:00.000Z,Low,Neutral,"CSPi (NASDAQ: CSPI) will announce its fiscal second quarter results on May 8, 2024. The company provides security and packet capture products, managed IT services, and technology solutions. The conference call hosted by President Victor Dellovo and CFO Gary W. Levine will review the financial results and business update.",
Livingston Floods: U-Haul Offers 30 Days Free U-Box Storage to Victims,2024-05-03T19:12:00.000Z,Low,Neutral,"U-Haul is providing 30 days of free U-Box storage to Livingston flood victims, aiding in recovery efforts due to severe flooding in the area. The offer is for new U-Box rentals and subject to availability, with mobile storage helping impacted families deal with property clean-up.",
"Monthly information related to total number of voting rights and shares composing the share capital – April 30, 2024",2024-05-03T16:05:00.000Z,Neutral,Neutral,"PHXM releases monthly information on the total number of voting rights and shares composing the share capital for April 30, 2024. The data shows consistency in the number of shares and voting rights over the past few months, with 6,075,105 shares and 6,226,932 gross and net voting rights, respectively.",
DLT Resolution Inc. Provides Shareholder Update,2024-05-03T19:30:00.000Z,Neutral,Neutral,"DLT Resolution Inc., a publicly traded acquisition company, provided an update on its share exchange transactions with Ciscom Corp., aiming to consolidate ownership but later unwinding due to regulatory issues. DLT issued shares to Concerned Shareholders and entered new agreements with Subject Shareholders. The company focuses on growth initiatives and aligning with disenfranchised shareholders. DLT's ownership position in Ciscom changed from 42.05% to 0%. The closing price per Ciscom common share was $0.09.",
i3 Verticals Announces Earnings Release and Conference Call Date for Second Quarter of Fiscal 2024,2024-05-03T19:45:00.000Z,Low,Neutral,"i3 Verticals, Inc. (Nasdaq: IIIV) will release its financial results for the second quarter ended March 31, 2024, on May 10, 2024, before the Nasdaq market open. A conference call will be held on the same day at 9:00 a.m. ET to discuss financial results and operations.",
Playgon Reports 2023 Financial and Operational Highlights and Provides Business Update,2024-05-03T17:52:00.000Z,Moderate,Very Positive,"Playgon Games Inc. reports its 2023 financial and operational highlights, showcasing an increase in revenues, total wagering turnover, and betspots. Despite a net loss, the company is focusing on market expansions and product enhancements to drive future growth. With successful integrations and certifications, Playgon aims to tap into lucrative markets like Ontario, LATAM, and Italy. The company's focus on product development and player engagement underscores its commitment to long-term success.",
"MARPAI TO HOST WEBCAST ON MAY 10, 2024 TO DISCUSS FIRST QUARTER 2024 FINANCIAL RESULTS",2024-05-03T17:50:00.000Z,Low,Neutral,"Marpai, Inc. will host a webcast on May 10, 2024, to discuss its first quarter 2024 financial results. The company is an independent national Third-Party Administration (TPA) company in the $22 billion TPA market, providing affordable healthcare solutions to self-funded employer health plans.",
IBM Appoints New Chief Sustainability Officer Christina Shim,2024-05-03T16:30:00.000Z,No impact,Very Positive,"IBM has appointed Christina Shim as the new Chief Sustainability Officer, succeeding Wayne Balta, effective June 15. Christina brings 20 years of experience and is focused on advancing IBM's sustainability efforts. She aims to leverage technology to drive environmental impact and sustainability.",
Sotherly Hotels Inc. Announces Refinancing and Renovation Plans for Philadelphia Hotel,2024-05-03T18:30:00.000Z,Neutral,Neutral,"Sotherly Hotels Inc. announced refinancing and renovation plans for the DoubleTree by Hilton Philadelphia Airport. The mortgage loan terms were amended with TD Bank, reducing the loan by $3.0 million to $35.9 million. The loan matures in April 2026 with an interest rate based on SOFR plus 3.5%. The company also signed a new 10-year franchise agreement with Hilton Worldwide and will undergo an $11.5 million renovation scheduled for completion by April 2026.",
Dimick Completes GSBC’s Prestigious Executive Development Institute,2024-05-03T16:00:00.000Z,Low,Neutral,"Caleb Dimick, Chief Banking Officer at Bank of Idaho, recently graduated from the Graduate School of Banking at Colorado's Executive Development Institute for Community Bankers. The program aims to develop future executives for community banks, providing individualized resources for professional growth and strategic planning. Dimick's completion of the program highlights his commitment to the industry and customer-centric approach. Bank of Idaho, a regional community bank, offers a variety of financial products and services in Southern Idaho and Eastern Washington.",
Barton Gold: Invitation to 121 Mining Investment London,2024-05-03T16:00:00.000Z,Neutral,Neutral,"Barton Gold (ASX: BGD) (OTCQB: BGDFF) will be participating in the 121 Mining Investment Conference in London, with MD & CEO Alexander Scanlon presenting the Company's recent and future activities. The event will host over 100 mining companies and 400 investors for targeted meetings, offering market intelligence on industry developments. The conference is scheduled for May 15-16, 2024.",
Cyngn Announces Exercise and Closing of Underwriter's Over-Allotment Option,2024-05-03T16:00:00.000Z,Low,Neutral,"Cyngn Inc., a developer of AI-powered autonomous driving software solutions, announced the exercise of the underwriter's over-allotment option, resulting in the purchase of an additional 2,040,000 shares of common stock at $0.10 per share. The total gross proceeds from the offering amount to approximately $5.2 million. Aegis Capital Corp. served as the sole bookrunner for the offering.",
,,,,,
"Andrew Briggs Appointed Chairman of Farmers & Merchants Bancorp, Inc. and F&M Bank",2024-05-03T19:02:00.000Z,Low,Neutral,"F&M Bank, owned by Farmers & Merchants Bancorp, Inc., appointed Andrew Briggs as Chairman of the Board, succeeding Jack Johnson. Briggs brings 40+ years of banking experience and leadership to the role. The appointment reflects F&M's succession plan and commitment to adding new members to the Board.",
Comcast Earns VETS Indexes 5 Star Employer Award for Fourth Consecutive Year,2024-05-03T15:30:00.000Z,No impact,Very Positive,"Comcast has been awarded the VETS Indexes 5 Star Employer Award for the fourth consecutive year, recognizing its commitment to providing employment opportunities and fostering an inclusive culture for military-connected individuals. The organization's efforts in veteran hiring and retention, veteran-friendly policies, and support for military spouses and families have been highlighted. Comcast has hired over 21,000 veterans, military spouses, and National Guard and Reserve members since 2015, offering unique benefits and programs to create an empowering workplace for military-connected employees.",
Verizon Business to spotlight the fast-changing cybersecurity landscape and how to manage it at RSA Conference™,2024-05-03T16:39:00.000Z,Low,Very Negative,"Verizon Business will be showcasing cybersecurity strategies and solutions at RSA 2024, emphasizing the importance of data protection. The 2024 Data Breach Investigations Report reveals a significant increase in vulnerability exploitation and stolen credentials. The report aims to educate businesses on current cyber threats and the need for robust cybersecurity measures.",
Hurricane Preparedness Week: PSEG Long Island Announces Climate Change Resilience Plan,2024-05-03T16:05:00.000Z,No impact,Neutral,"PSEG Long Island has spent a decade fortifying its electric infrastructure against extreme weather, resulting in a resilient grid. The company unveiled a Climate Change Resilience Plan to prepare for future risks. Through storm-hardening efforts and a proactive study, PSEG Long Island aims to enhance reliability and address climate change challenges.",
