title,datetime,impact_score,sentiment,summary,article
Kolibri Global Energy Inc. Revocation of Management Cease Trade Order,2024-05-04T01:45:00.000Z,Neutral,Neutral,"Kolibri Global Energy Inc. has successfully completed the filing of its annual information form and audited financial statements, resulting in the revocation of the management cease trade order by the British Columbia Securities Commission. The company's focus on energy projects in oil, gas, and sustainable energy continues to drive its operations and growth.",
Chemistree Directors Ratify Debenture Restructuring,2024-05-04T02:51:00.000Z,Low,Neutral,"Chemistree Technology Inc. announces the approval of a restructuring transaction by its board of directors to settle outstanding 10% senior unsecured convertible debentures in exchange for common shares. The transaction involves issuing 666,800,000 Common Shares at a price of $0.01 per share to Debentureholders. The Company anticipates the transaction to be effective around May 9, 2024. The Canadian Securities Exchange Listings Committee has approved the Company's reliance on an exception to shareholder approval requirements due to financial difficulties.",
Bel Fuse Announces Upcoming Investor Conference Schedule for May 2024,2024-05-03T20:05:00.000Z,Low,Neutral,"Bel Fuse Inc. (Nasdaq: BELFA and BELFB) announced its investor conference schedule for May 2024, including participation in the Oppenheimer 19th Annual Industrial Growth Conference and the Cowen 52nd Annual Technology, Media & Telecom Conference. The presentations will feature the company's CFO and VP Financial Reporting & Investor Relations. Investors can access the presentation decks and webcasts through the investor relations section of Bel Fuse's website.",
Taysha Gene Therapies Announces Inducement Grant Under Nasdaq Listing Rule 5635(c)(4),2024-05-03T20:05:00.000Z,Low,Very Positive,"Taysha Gene Therapies, a clinical-stage gene therapy company, granted options to purchase 528,000 shares of common stock to four new employees under the 2023 Inducement Plan. The options have an exercise price of $2.42 per share, a 10-year term, and will vest over four years. This grant is in accordance with Nasdaq Listing Rule 5635(c)(4).",
Roscan Gold Announces Debt Settlement,2024-05-03T21:15:00.000Z,Neutral,Neutral,"Roscan Gold  announces a Debt Settlement agreement to settle US$1,050,000 owing to a creditor for drilling and services, involving a cash payment, issuance of common shares, and a promissory note. The settlement includes trading restrictions and interest at 12% per annum, secured by a general security agreement. The securities offered are not registered under the U.S. Securities Act and are not available for sale in the United States.",
Thorpedo Anna Claims the Lilies for the 150th Running of the Longines Kentucky Oaks,2024-05-04T00:36:00.000Z,Neutral,Negative,"Churchill Downs Incorporated announced a new Kentucky Oaks Day handle record as Thorpedo Anna won the 150th Longines Kentucky Oaks, with a total wagering record of $75.3 million. Despite a 3% decrease in wagering on the Kentucky Oaks race, the event was a success, celebrating deep-rooted traditions and raising money for women's health initiatives.",
Canoo to Announce First Quarter 2024 Financial Results,2024-05-03T23:30:00.000Z,Low,Neutral,"Canoo Inc. (Nasdaq: GOEV) will announce its financial results for the first quarter of 2024 on May 14, 2024, after market close. The company, a high-tech advanced mobility company, will host a conference call and live webcast to discuss the results, followed by a question-and-answer period. Interested individuals can listen to the live webcast online and access a replay shortly after the event.",
Newbury Street Acquisition Corporation Announces Receipt of Nasdaq Letter,2024-05-03T21:11:00.000Z,Neutral,Neutral,"Newbury Street Acquisition  (NASDAQ: NBST) received a letter from Nasdaq indicating non-compliance with timely filing of financial reports. The delay is due to finalizing financial statements for the year ended December 31, 2023, with plans to file the Form 10-K soon.",
Snow Lake Announces Adjournment of Annual Meeting of Shareholders,2024-05-03T20:35:00.000Z,Neutral,Neutral,"Snow Lake Resources , d/b/a Snow Lake Energy, (NASDAQ: LITM) announced the adjournment of its 2024 Annual Meeting of Shareholders to May 8, 2024, due to a lack of quorum. The meeting will be held virtually, and shareholders can vote on proposals. The Company has engaged a proxy solicitor to help achieve the required quorum. Shareholders are urged to vote before the new meeting date to avoid additional adjournment costs.",
One of Canada’s Fastest Growing Health and Wellness Retail Chains Adds bettermoo(d)’s Moodrink(TM) to its 33 stores in Eastern Canada,2024-05-03T23:25:00.000Z,Neutral,Positive,"bettermoo(d) Food , an innovator in the plant-based food industry, has announced that a leading health and wellness retail chain in Canada will carry their dairy alternative beverage, Moodrink™, in 33 stores across Ontario. Moodrink™ offers a nutritious option with plant-based protein, fiber, and a taste inspired by the Alps. This strategic partnership aligns with the Retail Chain's focus on health and sustainability, providing consumers with a nourishing and delicious choice.",
Global Helium Corp. Grants Stock Options,2024-05-03T21:05:00.000Z,Moderate,Neutral,"Global Helium Corp. has granted stock options to acquire up to 1,075,000 common shares to directors, officers, and consultants. The options are exercisable at $0.11 per share for five years.",
GALIANO GOLD 2024 ANNUAL GENERAL MEETING INFORMATION,2024-05-03T21:00:00.000Z,Low,Neutral,"Galiano Gold Inc. announces its Annual General Meeting will be held virtually on June 13, 2024, to address key agenda items like financial statements approval and director elections. The Company has nominated seven director candidates, including new nominees Moira Smith and Navin Dyal. Shareholders can access meeting materials online or request a paper copy.",
Morgan Group Holding Co. Reports Annual Results,2024-05-03T20:35:00.000Z,Neutral,Negative,"Morgan Group Holding Co. (MGHL) reported an increase in revenues for 2023, reaching $2.1 million. Despite steady expenses at $3.0 million, the net loss decreased to $0.8 million. The company's book value per share stands at $2.07. MGHL de-registered from the SEC in January 2024, but plans to continue publishing current information.",
"Vision Sensing Acquisition Corp. Announces Payment of Fee to Extend Period to Consummate Initial Business Combination to June 3, 2024",2024-05-03T20:30:00.000Z,No impact,Neutral,"Vision Sensing Acquisition Corp. announced the payment of a fee to extend the period to consummate its initial business combination with Mediforum Co.  from May 3, 2024, to June 3, 2024. The Company's sponsor deposited $51,016.10 into the trust account for the extension, with the option for up to six one-month extensions. This move provides the Company with more time to finalize the Business Combination as per the Merger Agreement.",
Queen Anne Departs for Historic Maiden Voyage,2024-05-04T00:10:00.000Z,Low,Very Positive,"Cunard's luxury new ship Queen Anne embarked on her maiden voyage to Lisbon, marking a new era in ocean travel. The ship's departure from Southampton was celebrated with a sail away party and guests are set to enjoy a gala evening and performances during the voyage. Queen Anne joins Cunard's fleet of iconic Queens, offering unforgettable experiences with fine dining, entertainment, and service excellence.",
Anika Reports Inducement Grants Under Nasdaq Listing Rule 5635(c)(4),2024-05-03T20:01:00.000Z,Low,Very Positive,"Anika Therapeutics, a global joint preservation company, granted non-statutory stock options to a newly hired non-executive employee under the 2021 Inducement Plan. The options cover 3,800 shares at an exercise price of $26.49 per share, equal to the closing price on the grant date. The vesting schedule spans over three years, contingent on continuous service, expiring after ten years. The grant was made in line with Nasdaq Listing Rule 5635(c)(4) as part of the employee's compensation package.",
Entergy CEO shares bold vision for improving stakeholder outcomes at annual meeting,2024-05-03T20:45:00.000Z,Low,Neutral,"Entergy CEO Drew Marsh shared a bold vision for improving stakeholder outcomes at the company's 75th annual meeting. The focus is on customer growth, cleaner energy, reliability, and resilience while maintaining affordability. Key achievements in 2023 include strong industrial sales, customer growth, renewable energy investments, and approvals for major resilience projects. Entergy is committed to meeting customer expectations and driving growth opportunities for the future.",
Hudson Global to Report First Quarter 2024 Financial Results on May 10th,2024-05-03T20:15:00.000Z,Low,Neutral,"Hudson Global, Inc. (Nasdaq: HSON) will release its first-quarter financial results on May 10, 2024, before the market opens. The company will hold a conference call to discuss the results at 10:00 am ET. Hudson Global, Inc. is a leading total talent solutions provider offering recruitment outsourcing and total talent solutions worldwide under the brand name Hudson RPO. For more information, visit hudsonrpo.com.",
Arena Investors Completes Recapitalization of Charge Enterprises,2024-05-03T20:45:00.000Z,Neutral,Positive,"Arena Investors has completed the recapitalization of Charge Enterprises, a leading EV charging and broadband infrastructure company, with Arena becoming the majority owner. This move has significantly reduced Charge's indebtedness, providing a solid financial foundation for future growth. Under new leadership, Charge aims to capitalize on its market-leading EV charging infrastructure capabilities and services, with a focus on continued business expansion.",
"KLDiscovery Inc. to Report First Quarter 2024 Financial Results on May 8, 2024; Conference Call 8:30 AM ET May 9, 2024",2024-05-03T20:05:00.000Z,Low,Neutral,"KLDiscovery Inc. (KLD), a global provider of electronic discovery and data recovery solutions, will release their first quarter 2024 financial results on May 8, 2024. A conference call to discuss the results will be held on May 9, 2024, at 8:30 AM ET. Participants can register via a provided link and access the call through the company's website. An audio recording will be available for replay for two weeks post-call.",
Global Ship Lease Announces Annual Meeting of Shareholders,2024-05-03T20:15:00.000Z,Low,Neutral,"Global Ship Lease, Inc. (NYSE:GSL) announces its Annual Meeting of Shareholders scheduled for June 17, 2024, to elect three Term I Directors and ratify the appointment of PricewaterhouseCoopers S.A. as the independent registered public accounting firm. Shareholders entitled to participate were determined based on the record date of April 18, 2024. Documentation and voting instructions were mailed to shareholders and will be available on the SEC's website.",
"General American Investors Reports Net Assets as of March 31, 2024",2024-05-03T20:25:00.000Z,Low,Neutral,"General American Investors Company, a closed-end investment company listed on the NYSE as GAM, reported net assets applicable to common stock of $1.35 billion as of March 31, 2024, showing an increase from the previous quarter. The company's quarterly report highlighted key financial metrics such as net investment income, net gain/loss on investments, and dividend distributions. Additionally, the report disclosed the top five stock holdings in the company's portfolio, including Microsoft, Republic Services, Berkshire Hathaway, Alphabet, and ASML Holding.",
Tisdale Clean Energy Corp. Presents in Red Cloud's Virtual Webinar Series,2024-05-04T00:00:00.000Z,Neutral,Neutral,"Tisdale Clean Energy Corp. (CSE: TCEC) will be presenting a live virtual corporate update hosted by Red Cloud Financial Services on May 6th, 2024 at 2pm ET. The company invites shareholders and interested parties to register for the webinar and participate in the live Q&A session. The replay will be available for all registrants. The company is an undervalued microcap explorer developing a near-surface uranium deposit within the Athabasca Basin.",
Chesapeake Granite Wash Trust Announces Distribution of $0.0098 Per Common Unit,2024-05-03T20:15:00.000Z,Neutral,Neutral,"Chesapeake Granite Wash Trust (OTC: CHKR) announced a common unit distribution of $0.0098 for the quarter ended March 31, 2024, payable on May 30, 2024. The Trust's royalty interests generated revenue of $1,154 thousand, resulting in a distributable income of $460 thousand. The distribution is based on sales volumes of 10 mbbl of oil, 229 mmcf of natural gas, and 18 mbbl of natural gas liquids, with an average price received per unit. The Trust owns royalty interests in the Colony Granite Wash play in Oklahoma, with fluctuating revenues based on production sales and prices.",
First Trust Energy Infrastructure Fund Issues Notice Regarding May 2024 Distribution,2024-05-03T20:36:00.000Z,No impact,Negative,"First Trust Energy Infrastructure Fund (FIF) issues a notice regarding its May 2024 distribution. The Fund declared its final distribution payable on May 2, 2024, to shareholders of record as of April 29, 2024, with an ex-dividend date of April 26, 2024. The Managed Distribution Plan allows for periodic distributions of long-term capital gains. The notice provides information on the distribution sources and amounts. The Fund anticipates that a portion of distributions may be a return of capital.",
Terns Pharmaceuticals Reports Inducement Grant to New Employee Under Nasdaq Listing Rule 5635(C)(4),2024-05-03T20:05:00.000Z,Low,Very Positive,"Terns Pharmaceuticals, Inc. announced the granting of an equity inducement award to Melita Sun Jung, the new Chief Business Officer, under the terms of the Inducement Plan. The award includes an option to purchase 475,000 shares of Terns common stock at an exercise price of $5.08 per share, with a 10-year term and vesting over four years.",
ManpowerGroup Increases Dividend 4.8 Percent,2024-05-03T20:15:00.000Z,Low,Neutral,"ManpowerGroup, a leading workforce solutions provider, has announced a 4.8% increase in its semi-annual dividend, now totaling $1.54 per share. The dividend is set to be paid on June 14, 2024, to shareholders of record as of June 3, 2024. Investors can access more financial information on ManpowerGroup's website.",
"Intercontinental Exchange, Inc. Commences Private Exchange Offer for Black Knight InfoServ LLC’s Outstanding 3.625% Senior Notes due 2028",2024-05-03T21:00:00.000Z,Low,Neutral,"Intercontinental Exchange, Inc. (ICE) has initiated a private exchange offer for Black Knight InfoServ 's 3.625% Senior Notes due 2028. The exchange offer allows eligible holders of BK Notes to receive ICE Notes with the same interest payment and maturity dates as the BK Notes. The offering is valid until June 3, 2024, with an Early Tender Deadline of May 16, 2024. The Exchange Consideration involves the issuance of $970 principal amount of ICE Notes for each $1,000 principal amount of BK Notes tendered.",
CareDx Reports Inducement Grants under Nasdaq Listing Rule 5635(c)(4),2024-05-03T20:10:00.000Z,Low,Neutral,"CareDx, Inc. (Nasdaq: CDNA) announced the award of 54,350 restricted stock units (RSUs) to 17 new employees as an inducement for employment. The RSUs were granted under the 2019 Inducement Equity Incentive Plan and vest over different periods based on the number of shares awarded.",
Mondelēz International's Near-Term 2030 Targets and 2050 Net-Zero Targets Validated by Science Based Targets Initiative,2024-05-03T20:45:00.000Z,No impact,Neutral,"Mondelēz International, Inc. (NASDAQ: MDLZ) has had its near-term 2030 greenhouse gas reduction targets and 2050 net-zero target validated by the Science Based Targets initiative (SBTi). This approval showcases the company's commitment to sustainability and creating a more sustainable snacking company. Mondelēz International has made significant progress in reducing emissions, increasing renewable energy usage, and designing recyclable packaging. These efforts align with the company's Vision 2030 growth strategy, highlighting sustainability as a important focus.",
Kingsway To Report Financial Results for First Quarter 2024 on May 8,2024-05-03T20:07:00.000Z,Low,Neutral,"Kingsway Financial Services Inc. will report financial results for the first quarter of 2024 on May 8, 2024, after the close of trading. The company will host a conference call to discuss the results and answer questions. Key details such as the date, time, and call-in information are provided for investors and analysts.",
Predictiv AI Announces Extension of Private Placement Financing,2024-05-04T00:00:00.000Z,Neutral,Neutral,"Predictiv AI Inc. announces a 30-day extension to complete a non-brokered private placement of up to 12,500,000 units at $0.02 per unit for gross proceeds of up to $250,000. The Offering is subject to TSXV regulatory approval.",
Millicom (Tigo) share repurchase activity,2024-05-03T21:30:00.000Z,Neutral,Neutral,"Millicom (Tigo) announced the repurchase of 27,477 of its Swedish Depository Receipts (SDRs) between April 29, 2024, and May 3, 2024. The purchases were made on Nasdaq Stockholm by Citigroup Global Markets , totaling 824,911 treasury shares as of May 3, 2024.",
BetterLife Announces Intent to Complete Private Placement of Units,2024-05-03T22:00:00.000Z,Neutral,Negative,"BetterLife Pharma Inc. announced its intent to conduct a Non-Brokered Private Placement offering of up to $500,000 to advance its lead compound BETR-001, a non-hallucinogenic LSD derivative, for mental disorders. The offering consists of units containing common shares and warrants.",
Spyre Therapeutics Announces Grants of Inducement Awards,2024-05-03T21:00:00.000Z,Neutral,Neutral,"Spyre Therapeutics, Inc. announced the approval of grants of stock options to 4 non-executive employees as equity inducement awards. These options were granted under the 2018 Equity Inducement Plan with a 10-year term and an exercise price of $33.87 per share. The options will vest over time, subject to continuous service with Spyre.",
Quantum Provides Updated Plan to Nasdaq,2024-05-03T20:05:00.000Z,Moderate,Positive,"Quantum  (Nasdaq: QMCO) provided an update on its efforts to become current with SEC financial reports, securing a stay on the delisting of its common stock by Nasdaq. The company outlined plans to comply with Nasdaq listing criteria, including progress towards applying ASC Topic 606 and updated timelines for filing quarterly and annual reports.",
Cornerstone Funds Announce Continuing Monthly Distributions,2024-05-03T20:30:00.000Z,No impact,Neutral,"Cornerstone Strategic Value Fund, Inc. and Cornerstone Total Return Fund, Inc. announced continuing monthly distributions in line with their distribution policy. The distributions are not tied to investment income or capital gains and may include earnings, capital gains, or return-of-capital. The Boards review and approve the distribution policy annually for the benefit of stockholders. Stockholders have the option to reinvest distributions or receive them in cash. The distributions may consist of a return-of-capital, which reduces the cost basis of stockholder shares. Each Fund's net asset value determines the Distribution Amount, which may change annually. The distribution composition for 2024 is subject to market conditions and may include a return of the stockholder's capital. Stockholders will receive tax-reporting information for 2024 distributions by February 2025. Cornerstone Funds aim to create opportunities through investments in closed-end funds, which enhance portfolio diversification but may be subject to risks and expenses. Each Fund may engage in share repurchase activity to enhance stockholder value.",
East West Bancorp Announces Dates for 2024 Second and Third Quarter Earnings Calls,2024-05-03T20:10:00.000Z,Neutral,Neutral,"East West Bancorp, Inc. has announced the dates for their 2024 second and third quarter earnings calls, giving investors insights into the company's financial performance. The calls are scheduled for July 23 and October 22, 2024, respectively.",
Territorial Bancorp Inc. Announces First Quarter 2024 Results,2024-05-03T20:30:00.000Z,Low,Neutral,"Territorial Bancorp Inc. reported a net loss of $482,000 for the first quarter of 2024, with tier one leverage and risk-based capital ratios at 11.58% and 28.84% respectively. The company's liquidity position remains strong with $90 million in cash balances. Additionally, the merger agreement with Hope Bancorp, Inc. values the transaction at approximately $78.6 million.",
Meta Materials Announces Workforce Reduction,2024-05-03T20:05:00.000Z,Moderate,Neutral,"Meta Materials Inc. (NASDAQ: MMAT) announced a significant reduction of 80% of its workforce due to liquidity challenges and the need for additional financing. The company is exploring strategic alternatives like asset divestiture and securing additional financing to avoid potential bankruptcy. However, the outcome remains uncertain without adequate cash influx.",
Loop Media Reports 2024 Fiscal Second Quarter Financial Results,2024-05-03T20:30:00.000Z,Moderate,Neutral,"Loop Media, Inc. reported its 2024 fiscal second quarter financial results, showing a decrease in revenue to $4.0 million from $5.4 million in the previous year. The net loss was $(7.6) million compared to $(9.8) million. Adjusted EBITDA was $(4.5) million. Gross profit decreased to $0.42 million from $1.6 million. The company had 32,658 QAUs and 50,000 screens across Partner Platforms as of March 31, 2024. Operational changes were implemented to cut costs and improve profitability.",
Dover Declares Regular Quarterly Cash Dividend,2024-05-03T20:09:00.000Z,Low,Neutral,"Dover  (NYSE: DOV) announced a regular quarterly cash dividend of $0.51 per share, payable on June 14, 2024. The dividend will be given to shareholders of record as of May 31, 2024.",
ATEX Announces AGM Results and Appointment of Additional Director,2024-05-03T21:52:00.000Z,Low,Neutral,"ATEX Resources Inc. announced the positive results of its Annual General and Special Meeting, with all motions approved by shareholders. The new CEO, Ben Pullinger, was appointed to the board of directors. The detailed voting results showed overwhelming support for various resolutions, including setting the number of directors at five and approving the appointment of the Company's auditor and amended stock option and restricted share unit plans.",
"Stonegate Updates Coverage on NCS Multistage Holdings, Inc. (NCSM) 2024 Q1",2024-05-03T20:35:00.000Z,Neutral,Neutral,"NCS Multistage Holdings, Inc. (NCSM) is being covered by Stonegate Capital Partners, showing growth exceeding market expectations, expanding internationally, and experiencing a 24.8% year-over-year growth in adjusted EBITDA.",
JPMorgan Chase Investor Day 2024,2024-05-03T20:32:00.000Z,Low,Neutral,"JPMorgan Chase & Co. (NYSE: JPM) will host an Investor Day in New York City on May 20, 2024, presenting financial data, assets, and services offered by the firm. The event will showcase executive management presentations and provide access to the general public through various channels, including phone dial-ins and online webcasts. JPMorgan Chase is a leading financial services firm with a strong presence in the U.S. and globally, offering investment banking, consumer services, commercial banking, financial processing, and asset management.",
Amdocs Releases Third Quarter Fiscal 2024 Investor Conference Schedule,2024-05-03T20:05:00.000Z,Low,Neutral,Amdocs (NASDAQ: DOX) has announced its schedule for attending various investor conferences during the third quarter of fiscal 2024. The conferences will feature key members of Amdocs leadership engaging with investors and discussing the company's performance and future prospects.,
Syndax Pharmaceuticals Reports Inducement Grants Under NASDAQ Listing Rule 5635(c)(4),2024-05-03T20:05:00.000Z,Low,Neutral,"Syndax Pharmaceuticals granted inducement awards to six new employees to purchase up to 100,600 shares of common stock under the 2023 Inducement Plan. The stock options will vest over four years, with gradual vesting conditions tied to the employees' continued service relationship.",
Ryder Declares Quarterly Cash Dividend,2024-05-03T20:30:00.000Z,Low,Neutral,"Ryder System, Inc. (NYSE: R) has declared a regular quarterly cash dividend of $0.71 per share, paying on June 21, 2024, to shareholders of record on May 20, 2024. This marks Ryder's 191st consecutive quarterly dividend payment, demonstrating over 47 years of consistent dividend distribution.",
Allied Gaming & Entertainment Announces Updates to Board of Directors and Management Team,2024-05-03T20:05:00.000Z,Low,Neutral,"Allied Gaming & Entertainment, Inc. (AGAE) announced changes to its Board of Directors and management team, appointing Ms. Chi Zhao as an independent director, Mr. Yangyang Li as President, and acknowledging resignations of Mr. Adam Pliska and Ms. Yinghua Chen. Ms. Zhao's extensive experience in strategic management and corporate oversight is expected to benefit the company, while Mr. Li will focus on strategic initiatives and legal proceedings.",
