title,datetime,impact_score,sentiment,summary,article
"RLI Names Deb Millum as Vice President, Claim",2024-05-10T20:05:00.000Z,Low,Neutral,"RLI Corp announced the promotion of Deb Millum as Vice President, Claim, overseeing product claims. Millum brings 30 years of insurance claim and legal experience to the role, holding a Juris Doctorate degree and a Bachelor of Science. RLI sees her as a valuable addition to their claim leadership team.",
89bio Announces Inducement Grants Under Nasdaq Listing Rule 5635(c)(4),2024-05-10T20:05:00.000Z,Low,Very Positive,"89bio, Inc. announced the approval of non-qualified stock options for four new employees under the 2023 Inducement Plan. The options allow the purchase of 48,150 shares of the Company's common stock at the closing price on May 6, 2024. The options will vest over a four-year period, contingent on continued employment.",
Denali Capital Acquisition Corp. Announces Extension of Deadline to Complete Business Combination,2024-05-10T20:30:00.000Z,Low,Neutral,"Denali Capital Acquisition Corp. (DECA) has extended the deadline for completing its business combination by depositing $50,000 into its trust account, pushing the deadline to June 11, 2024. This move is in line with the amended terms of the Company's memorandum and articles of association.",
"The Herzfeld Caribbean Basin Fund, Inc. Pays Quarterly Distribution",2024-05-10T20:01:00.000Z,Low,Neutral,"The Herzfeld Caribbean Basin Fund, Inc. (NASDAQ: CUBA) has announced a quarterly distribution under its Managed Distribution Plan. Stockholders received a distribution of $0.135375 per share on May 10, 2024, with 80% paid in shares and 20% in cash. The distribution totaled $437,354.93 in cash and 680,934 shares. The Fund aims to provide a consistent distribution each quarter, subject to market price fluctuations. Stockholders can receive distributions in cash, stock, or a combination of both.",
Ocugen Announces Distribution of Series C Preferred Stock to Holders of its Common Stock,2024-05-10T20:05:00.000Z,Moderate,Neutral,"Ocugen, a biotechnology company, has announced the distribution of newly designated Series C Preferred Stock to holders of its common stock. Each outstanding share of common stock will receive one one-thousandth of a share of Series C Preferred Stock. The Series C Preferred Stock will vote together with the common stock on certain proposals and will have 1,000,000 votes per share. Shares not present at the shareholders meeting will be automatically redeemed with no voting power. The Series C Preferred Stock will be uncertificated and non-transferable except in connection with a transfer of common stock.",
"Wayne Savings Bancshares, Inc. Announces 2024 Special Meeting Voting Results",2024-05-10T20:01:00.000Z,Low,Positive,"Wayne Savings Bancshares, Inc. announced the results of the 2024 special meeting where shareholders approved the merger with Main Street Financial Services Corp. Voting results showed a 95% approval rate for the merger agreement, indicating strong shareholder support. President and CEO James VanSickle expressed satisfaction with the outcome, highlighting the commitment to community banking.",
"East Africa Metals Announces Tibet Huayu Moving Forward with Mine Development Programs at the Mato Bula and Da Tambuk Mines, Ethiopia",2024-05-10T20:05:00.000Z,Neutral,Neutral,"East Africa Metals Inc. (TSXV: EAM) announces the initiation of mine development programs at the Mato Bula and Da Tambuk mines in Ethiopia in partnership with Tibet Huayu Mining Co.,  EAM will have a Net Profits Interest of 30% once commercial production begins. Operations were suspended due to regional conflict but have resumed, with detailed design parameters completed and road construction set to start soon. The community and government support the project, with a drill program planned for the Halima Hill prospect.",
BIGLARI HOLDINGS INC. NEWS RELEASE,2024-05-10T20:07:00.000Z,Neutral,Neutral,"Biglari Holdings Inc. (NYSE: BH) has announced its first-quarter results for 2024, reporting pre-tax operating earnings of $5,697 compared to $9,049 in 2023. The company saw investment gains of $23,698 in 2024, a decline from $76,226 in 2023. However, net earnings attributable to Biglari Holdings shareholders were $22,579 in 2024, down from $64,886 in 2023. Shareholders are advised to review the detailed 10-Q report available on the company's website for a comprehensive understanding of the results.",
BMEX Gold Inc. Announces Financing,2024-05-10T20:00:00.000Z,Neutral,Negative,"BMEX Gold Inc. is initiating a non-brokered private placement financing, aiming to raise up to $1,250,000 through the sale of flow-through and non-flow-through units. Each unit will include a common share and a warrant. The proceeds will be used for exploring the Dunlop Bay project in Quebec and general working capital. The Offering is subject to regulatory approvals and does not involve US securities.",
TherapeuticsMD Announces First Quarter 2024 Financial Results,2024-05-10T20:05:00.000Z,Neutral,Neutral,"TherapeuticsMD, Inc. reported its First Quarter 2024 Financial Results, showing a net loss from continuing operations of $(0.8) million, or $(0.07) per share, compared to $(2.3) million in 2023. The company generated approximately $1.2 million in gross license royalties under the Mayne License Agreement, with total operating expenses decreasing by 52.8% to $1.5 million. Additionally, the company is exploring various strategic alternatives without a set timetable for completion.",
"Ingersoll Rand Successfully Completes $3,300 Million Senior Unsecured Bond Offering and New $2,600 Million Senior Unsecured Revolving Credit Facility, Upgraded One Notch by All Three Rating Agencies",2024-05-10T20:05:00.000Z,Low,Neutral,"Ingersoll Rand Inc. successfully completed a $3,300 million Senior Unsecured Bond Offering and established a new $2,600 million Senior Unsecured Revolving Credit Facility. The funds raised will be used for various purposes, including the repayment of term loans, funding an acquisition, and general corporate uses. The company also received an upgrade in its credit ratings by all three major agencies, reflecting its strong financial performance and improved capital structure.",
InsuraGuest Closes Rights Offering,2024-05-10T19:17:00.000Z,Neutral,Neutral,"InsuraGuest Technologies, Inc. closed its Rights Offering with 65,048,925 rights exercised, generating approximately $813,111 in gross proceeds. Douglas Anderson, the guarantor, received a warrant to purchase 311,209 common shares. Mr. Anderson now holds a total of 52,852,605 common shares, representing 31% of the total outstanding shares. The company is revolutionizing insurance delivery through its proprietary software platform.",
Atlanta Student Wins $25K Taco Bell Foundation Scholarship,2024-05-10T19:15:00.000Z,No impact,Neutral,An Atlanta high school senior has won a $25K Taco Bell Foundation scholarship for her passion in helping others with mental health issues. The scholarship was awarded by Yum! Brands. The student's achievement was highlighted by FOX 5 Atlanta.,
Ameren Corporation Directors Declare Quarterly Dividend,2024-05-10T19:26:00.000Z,Low,Neutral,"Ameren  (NYSE: AEE) declared a quarterly cash dividend of 67 cents per share on its common stock, payable on June 28, 2024. Additionally, Union Electric Company and Ameren Illinois Company declared regular quarterly cash dividends on their preferred stock.",
EQUATOR Beverage Company Reports First Quarter 2024 Financial Results,2024-05-10T19:36:00.000Z,Neutral,Neutral,"EQUATOR Beverage Company (OTCQB: MOJO) reported its Q1 2024 financial results, showing a 24% revenue increase to $640,653 from the same period last year. Gross margin increased to 42% of revenue due to higher sales of one-liter products, while net loss was $103,020 compared to net income of $4,485 in Q1 2023, attributed to higher executive compensation and selling expenses.",
Assertio to Present at the Citizens JMP Life Sciences Conference in New York City,2024-05-10T19:12:00.000Z,Low,Neutral,"Assertio Holdings, Inc. will present at the Citizens JMP Life Sciences Conference in New York City on May 13, 2024. Ajay Patel, Chief Financial Officer, will lead the presentation at 12:00 pm Eastern Time. Investors can request meetings with the Company through JMP representatives or contact Assertio investor relations. Presentation information will be available on the event day at https://investor.assertiotx.com. To listen to the webcast, connect to the website link 15 minutes before the live webcast.",
"Mueller Industries, Inc. Declares Cash Dividend for Second Quarter",2024-05-10T20:00:00.000Z,Low,Neutral,"Mueller Industries, Inc. (NYSE: MLI) declared a quarterly cash dividend of 20 cents per share for the second quarter. The dividend will be paid on June 21, 2024, to shareholders of record on June 7, 2024. Mueller Industries is an industrial  with diverse holdings in key markets globally.",
Morgan Group Holding Co. Reports First Quarter Results,2024-05-10T19:18:00.000Z,Moderate,Negative,"Morgan Group Holding Co. reported steady total revenues of $0.5 million for the first quarters of 2024 and 2023. The company's net loss decreased to $0.2 million in Q1 2024 compared to $0.3 million in Q1 2023. Expenses decreased to $0.7 million in Q1 2024 from $0.8 million in Q1 2023. The company had a net loss per share of $0.25 for Q1 2024, an improvement from $0.46 in the previous year.",
"Table Trac, Inc. Reports 2024 First Quarter Earnings",2024-05-10T19:24:00.000Z,Neutral,Neutral,"Table Trac, Inc. reported its 2024 first quarter financial results, showing growth and expansion in customer contracts and revenue. The company installed new systems, expanded services, and saw an increase in maintenance and service revenue compared to the previous year. With new contracts signed and expansion plans in place, Table Trac, Inc. is positioned for further growth in the coming quarters.",
Akanda Corp. Announces Plans to Be Among International First Movers Pending Completion of Landmark Change in US Drug Policy,2024-05-10T19:30:00.000Z,Neutral,Neutral,"Akanda Corp. announces plans to capitalize on the pending landmark change in US drug policy to reschedule cannabis under the Controlled Substances Act, potentially leading to significant market opportunities. The company aims to become a leader in consolidating US-based operators, following the DEA's proposal to reclassify cannabis as a Schedule III substance.",
"Nova Vision Acquisition Corp. Announces Additional Contribution to Trust Account to Extend Period to Consummate Business Combination to June 10, 2024",2024-05-10T20:00:00.000Z,No impact,Neutral,"Nova Vision Acquisition Corp. announced an additional contribution to extend the period for a business combination until June 10, 2024. The Company's sponsor deposited $69,763.37 in the Trust Account to provide more time for a potential merger or acquisition. The extension aims to facilitate the completion of a business combination within the specified timeframe.",
"Electro-Sensors, Inc. Announces First Quarter 2024 Financial Results",2024-05-10T19:15:00.000Z,Low,Neutral,"Electro-Sensors, Inc. reported first-quarter 2024 financial results, showcasing revenue growth of 9.7% to $2,244,000. The company's Gross Margin was 48.1%, with cash and investments totaling around $10.1 million. President David L. Klenk attributed the revenue increase to larger orders for facility upgrades and modernization projects, along with rising sales in wired sensors and wireless HazardPRO™ systems.",
Esperion Announces Inducement Grants Under NASDAQ Listing Rule 5635(c)(4),2024-05-10T20:00:00.000Z,Low,Very Positive,"Esperion granted 62,300 RSUs to 16 new employees under the 2017 Inducement Equity Incentive Plan. The RSUs will vest over time based on employment. Esperion focuses on developing medicines for cardiovascular diseases, striving to improve patient outcomes. For more info, visit esperion.com.",
HEI Reports First Quarter 2024 Results,2024-05-10T20:00:00.000Z,Low,Neutral,"Hawaiian Electric Industries, Inc. (NYSE: HE) reported net income of $42.1 million and EPS of $0.38 for the first quarter of 2024, compared to $54.7 million and EPS of $0.50 in the same period in 2023. The core net income was $49.3 million and EPS was $0.45. The utility is focusing on wildfire mitigation and resilience efforts, with One 'Ohana Initiative showing progress. The strategic balance sheet repositioning led to improved profitability. Hawaiian Electric's net income decreased to $39.2 million, mainly due to higher O&M expenses related to the Maui windstorm and wildfire event. American Savings Bank's net income was $20.9 million, reflecting the release of Maui wildfire-related reserves and expenses. The holding and other companies reported a net loss of $18.0 million.",
Crawford & Company Board Declares Dividends,2024-05-10T19:39:00.000Z,Low,Neutral,"Crawford & Company (CRD-A, CRD-B) announced a quarterly dividend of $0.07 per share on Class A and Class B Common Stock, payable on June 7, 2024.",
Xponential Fitness Appoints Brenda Morris as Interim CEO,2024-05-10T19:02:00.000Z,Low,Neutral,"Xponential Fitness, Inc. (NYSE: XPOF) has appointed Brenda Morris as interim CEO, replacing Anthony Geisler who has been removed from his duties. The company discloses investigations by both the SEC and USAO, forming a Special Committee to investigate. The Board reaffirms its 2024 guidance and expresses confidence in Morris' leadership.",
WNS Files Fiscal 2024 Annual Report on Form 20-F,2024-05-10T17:36:00.000Z,Neutral,Neutral,"WNS (Holdings)  filed its Annual Report on Form 20-F for the fiscal year ended March 31, 2024 with the SEC. The report is available on the company's website. WNS is a leading provider of global digital-led BPM solutions with over 600 clients worldwide.",
"The Marcus Corporation to Hold Virtual Annual Shareholders’ Meeting May 23, 2024",2024-05-10T17:15:00.000Z,Low,Neutral,"The Marcus  (NYSE: MCS) will be holding its virtual Annual Shareholders’ Meeting on May 23, 2024, to provide improved accessibility for shareholders. Shareholders can vote online, by mail, or by phone prior to the meeting. The company's proxy materials are available online for shareholders. The meeting will include a Q&A session and a live audio webcast for attendees.",
Comerica Announces Earnings Release Dates for 2025,2024-05-10T18:15:00.000Z,Low,Neutral,"Comerica Incorporated (NYSE: CMA) has announced the earnings release dates for 2025, with quarterly financial results to be released on specific dates throughout the year. The company will host conference calls for each quarter's results, providing additional information at a later date. Comerica Bank, celebrating its 175th anniversary this year, is a leading financial services company with a focus on building relationships and success. Comerica operates in multiple states, with total assets of $79.4 billion as of March 31, 2024.",
"Commencement Bancorp, Inc. (CBWA) Announces 2024 First Quarter Earnings",2024-05-10T17:40:00.000Z,Low,Neutral,"Commencement Bancorp, Inc. (CBWA) reported their 2024 First Quarter Earnings, showcasing positive financial highlights such as an increase in total loans, interest income, non-interest income, and tangible book value per share. The Bank also eliminated borrowed funds and brokered certificates of deposit, reduced nonperforming assets, and saw a rise in total assets and total deposits. However, the Bank recorded a 13% increase in non-interest expenses, with an extraordinary expense for legal fees and a reverse provision from the Allowance for Credit Losses. Despite challenges, the Bank maintains strong capital ratios, improved asset quality, and a positive outlook for future growth.",
Verizon to speak at MoffettNathanson conference May 14,2024-05-10T18:00:00.000Z,Low,Neutral,"Verizon's executive VP and CEO will speak at the MoffettNathanson conference on May 14. The company, a leading technology and communications provider, generated $134.0 billion in revenue in 2023. They offer data, video, and voice services globally, focusing on mobility and network security.",
FirstEnergy Using Helicopters and Infrared Technology for Vegetation Management Inspections,2024-05-10T18:38:00.000Z,Neutral,Neutral,"FirstEnergy Corp. (NYSE: FE) is using helicopters equipped with infrared technology to conduct aerial inspections of transmission lines to ensure they remain clear of trees and vegetation. The inspections cover nearly 7,000 miles of lines in multiple states and help prevent power outages. The company's commitment to safety, reliability, and operational excellence is showcased through this proactive approach.",
Live on TPT Global Tech’s VüMe Live PPV App Experience the Ultimate Mother’s Day Concert on the Beautiful Island of Granada,2024-05-10T17:15:00.000Z,Neutral,Positive,"TPT Global Tech, Inc. announces a free Mother's Day concert 'Wild and Open' on May 12, 2024, featuring renowned artists on the beautiful island of Grenada. The concert will be broadcasted live on TPT Global Tech's VüMe Live PPV App, marking the debut of TPT Caribbean 's launch in the Caribbean region. Viewers worldwide can enjoy the concert for free on the app available on the Apple Store and Google Play Store. The event starts at 7:00 PM EST, promising an evening of vibrant rhythms and soulful melodies in celebration of Mother's Day.",
Storm Relief: U-Haul Offers 30 Days Free Storage in Tallahassee,2024-05-10T18:36:00.000Z,Low,Neutral,"After severe storms hit Tallahassee, U-Haul is offering 30 days of free self-storage and U-Box container usage to residents in need. With three local stores participating in the relief efforts, U-Haul aims to support the community during the recovery process.",
Applied DNA Regains Compliance with Nasdaq Minimum Bid Price Requirement,2024-05-10T13:00:00.000Z,Low,Neutral,"Applied DNA Sciences, Inc. (NASDAQ:APDN) has regained compliance with the minimum bid price requirement set by the Nasdaq Stock Market, ensuring that the company's ordinary shares closed at or above $1.00 for a minimum of 10 consecutive business days, as confirmed in a recent notification letter. This achievement signifies a positive development for the company and its shareholders.",
High School Seniors Sign for Careers at HII’s Newport News Shipbuilding,2024-05-10T16:30:00.000Z,Low,Very Positive,"HII's Newport News Shipbuilding division recently welcomed over three dozen high school seniors to careers in shipbuilding through various workforce development programs. The company plans to hire approximately 3,000 skilled trade positions this year and aims to employ nearly 19,000 tradespeople within the next decade.",
Marathon Petroleum Truck Fleets Earn NPTC Safety Awards,2024-05-10T17:15:00.000Z,Low,Neutral,"Marathon Petroleum  received Silver and Bronze Seal Awards from the National Private Trucking Council for safety at the Education Management Conference. 15 fleets were recognized for their 2023 vehicle accident performance. Safety improvements were credited to Smith Systems training, fatigue policy, and in-cab safety features. The company's focus on road safety was highlighted, with tools like collision avoidance, blind spot notifications, and onboard cameras contributing to accident reduction.",
KBRA Affirms Ratings for Heritage Commerce Corp,2024-05-10T17:45:00.000Z,Low,Neutral,"KBRA affirms the ratings for Heritage Commerce Corp, including the senior unsecured debt rating of BBB+ and the subordinated debt rating of BBB. The company has demonstrated a conservative approach to liquidity and capital management, maintaining strong ratios over the years. Despite challenges in NIM due to deposit costs, HTBK remains well-positioned with a solid deposit base and ample liquidity sources. Credit quality has been excellent, supported by prudent underwriting and robust monitoring.",
TDS AND USCELLULAR TO WEBCAST ANNUAL MEETINGS OF SHAREHOLDERS,2024-05-10T19:00:00.000Z,Low,Neutral,"Telephone and Data Systems, Inc. (TDS) and United States Cellular  (USM) will be webcasting their Annual Meetings of Shareholders in May 2024. UScellular's meeting is on May 21 at 8:30 a.m. Central time, and TDS' meeting is on May 22 at 9:00 a.m. Central time. Investors can access the webcasts on the Events & Presentations pages of investors.tdsinc.com or investors.uscellular.com. Registration is recommended at least 15 minutes before each meeting.",
Bilt Rewards and Douglas Elliman Property Management Announce New Landmark Partnership,2024-05-10T16:09:00.000Z,Neutral,Very Positive,"Bilt Rewards and Douglas Elliman Property Management have formed a partnership that allows residents of Douglas Elliman managed buildings in NYC to earn rewards and benefits by making monthly condo and co-op fee payments through Bilt's platform. This collaboration expands the Bilt Rewards Alliance to over four million homes nationwide, offering exclusive benefits and rewards to residents beyond renters.",
OLM Food Solutions Introduces Hot Stuff Kitchen Stuffed Bites,2024-05-10T15:55:00.000Z,Low,Very Positive,"OLM Food Solutions, a Performance Food Group (PFG) company, has launched Hot Stuff Kitchen Stuffed Bites, featuring classic flavors in various doughs for on-the-go snacking. The product aims to increase same-store sales, providing unique, cost-effective, and tasty options for customers. The initial line includes savory and sweet flavors like Jalapeño Biscuit and Apple Pie Bites, with more to come.",
,,,,,
Optinose Announces Reporting Date for First Quarter 2024 Financial Results,2024-05-10T18:56:00.000Z,Low,Neutral,"Optinose, a pharmaceutical company specializing in ENT and allergy treatments, will announce its first quarter 2024 financial results on May 14, 2024. The company will host a conference call to discuss the results and corporate updates.",
Cleveland-Cliffs Applauds International Trade Commission’s Decision to Uphold Tariffs on Japanese Imports,2024-05-10T16:08:00.000Z,Neutral,Neutral,"Cleveland-Cliffs Inc. (NYSE: CLF) praised the International Trade Commission's decision to maintain tariffs on tin mill products from Japan, emphasizing Japan's unfair trade practices in the steel industry. The company's CEO highlighted the significance of American ownership in the steel sector and the need to address unfair trade practices through U.S. trade laws.",
Cypherpunk Announces Corporate Update on Current Holdings,2024-05-10T17:35:00.000Z,Moderate,Neutral,"Cypherpunk Holdings Inc. announced an update on their holdings, including the sale of Animoca Brands shares and Bitcoin, as well as their current assets. The company sold additional shares of Animoca Brands, receiving AUD $2,003,110. They also hold 117.09 Bitcoin and maintain investments in Chia Networks Inc. and NGRAVE.",
"SPZI: JP 3E Holdings, Inc. and Kerogen Resources LLC form Kerogen Resources II LLC to develop unconventional shale assets",2024-05-10T17:23:00.000Z,Moderate,Very Positive,"JP 3E Holdings, Inc. and Kerogen Resources  have formed Kerogen Resources II  to develop unconventional shale assets in the U.S. JP3E will have majority ownership and provide funding, while Kerogen Resources will operate and have a minority stake. This partnership marks a significant expansion of JP3E Holdings' presence in the energy sector, with plans to start funding in the third quarter of 2024.",
United-Guardian Reports Increased First Quarter Sales & Earnings,2024-05-10T19:00:00.000Z,Neutral,Neutral,"United-Guardian, Inc. (NASDAQ:UG) reported increased first quarter sales and earnings for 2024. Sales rose from $2,570,324 in 2023 to $3,254,944 in 2024, with net income increasing from $756,081 to $925,442. Cosmetic ingredients sales surged by 146%, driven by increased purchases from their largest distributor, ASI. However, pharmaceutical sales declined by 30% due to a temporary shutdown at a contract manufacturer's facility affecting Renacidin® sales. Production has since resumed, and orders are being fulfilled since March.",
WinVest Acquisition Corp. Announces Extension of Termination Date and Additional Contribution to Trust Account to Extend Termination Date,2024-05-10T13:08:00.000Z,Low,Neutral,"WinVest Acquisition Corp. (NASDAQ: WINV) has extended its termination date to June 17, 2024, to finalize an initial business combination. The extension includes a $55,000 contribution to the trust account, amounting to $0.048 per unredeemed share of common stock.",
The Journey to Carbon-Free Data Centers,2024-05-10T13:15:00.000Z,Low,Neutral,"RPD Energy's CEO and Iron Mountain's sustainability director discuss the journey to carbon-free data centers on ESG Talk. Iron Mountain pursues 24x7 carbon-free energy amidst rising electricity demands. Workiva sponsors ESG Talk, offering a unified platform for financial reporting, ESG, audit, and risk management.",
Immix Biopharma Announces Positive NXC-201 Relapsed/Refractory AL Amyloidosis Clinical Data in ASGCT 2024 Late Breaking Oral Presentation,2024-05-10T13:35:00.000Z,Moderate,Neutral,"Immix Biopharma, Inc. announced positive clinical data for NXC-201 in treating relapsed/refractory AL Amyloidosis patients, showcasing a 92% overall response rate with 75% complete responders. The impressive response rates and durability of the treatment highlight its potential as a new option for patients. The company plans to proceed with the NEXICART-2 clinical trial in mid-2024 based on the positive outcomes of the NEXICART-1 study.",
