title,datetime,impact_score,sentiment,summary,article
Getaround Appoints New Independent Directors to Its Board,2024-05-10T20:15:00.000Z,Low,Neutral,"Getaround (NYSE: GETR) announced the appointment of three new independent directors to its Board of Directors, Nikul Patel, Neil Savage, and Qais Sharif. These individuals bring significant expertise in governance, strategy, and product development. The new directors meet the New York Stock Exchange's independent director standard, enhancing the Company's corporate governance.",
"Revelation Biosciences, Inc. Announces Financial Results for the Three Months Ended March 31, 2024",2024-05-10T20:52:00.000Z,Moderate,Negative,"Revelation Biosciences, Inc. (NASDAQ: REVB) announced its financial results for the three months ended March 31, 2024. The company reported $14.6 million in cash and cash equivalents, up from $12.0 million in December 2023. They stated that the current cash is enough to fund operations through 2024. However, they reported a net loss of $2.7 million for the quarter, with significant expenses related to GEM-AKI and GEM-SSI clinical studies impacting their financials.",
Terran Orbital Schedules Conference Call to Discuss First Quarter 2024 Financial Results,2024-05-10T22:07:00.000Z,Low,Neutral,"Terran Orbital  (NYSE: LLAP) announced a conference call to discuss their first quarter 2024 financial results. The call will feature Co-Founder and CEO Marc Bell, along with Acting CFO Mathieu Riffel, discussing operational and financial highlights. The call will take place on May 14, 2024, at 11:00 a.m. E.T. The earnings release will be published before market open on the same day.",
Apollo Tactical Income Fund Inc. Declares May 2024 Monthly Distribution of $0.144 Per Share,2024-05-10T20:15:00.000Z,Low,Neutral,"Apollo Tactical Income Fund Inc. declared a monthly distribution of $0.144 per share for May 2024. The Ex-Date is May 22, 2024, the Record Date is May 23, 2024, and the Payment Date is May 31, 2024. Investors can contact Elizabeth Besen, Investor Relations Manager, for more information.",
Treasure Global Announces 2024 Annual General Meeting of Shareholders,2024-05-10T23:00:00.000Z,Neutral,Neutral,"Treasure Global Inc (NASDAQ: TGL) has announced its 2024 Annual General Meeting of Shareholders to be held on June 11, 2024, conducted virtually. The board of directors supports the proposed resolutions and urges shareholders to vote in favor. Shareholders as of the Record Date on April 29, 2024, are entitled to participate by voting online, by phone, or through mailing a proxy card.",
"Inhibrx, Inc. Announces Updated When-Issued Trading Date for Anticipated Spin-Off",2024-05-10T22:36:00.000Z,Neutral,Neutral,"Inhibrx, Inc. announced an updated when-issued trading date for the anticipated spin-off of its subsidiary Inhibrx Biosciences, Inc. The spin-off will occur after the approval of the Company's acquisition by Sanofi at a special meeting on May 24, 2024. The trading of SpinCo common stock is expected to begin on a when-issued basis on May 28, 2024, under the symbol 'INXB.' The record date for the spin-off is May 17, 2024, with the distribution scheduled for May 29, 2024. The completion of the spin-off and merger is subject to closing conditions noted in the Company's Definitive Proxy Statement.",
Edesa Biotech Reports Fiscal 2nd Quarter 2024 Results,2024-05-10T20:15:00.000Z,Neutral,Neutral,"Edesa Biotech, Inc. (Nasdaq: EDSA) reported its fiscal 2nd quarter 2024 results, showcasing financial stability and strategic growth initiatives. The company is focused on developing host-directed therapeutics for immuno-inflammatory diseases. Edesa expanded site selection activities for a Phase 3 study of its ARDS drug candidate, EB05, and received up to C$23 million from the Canadian government. The company also plans to evaluate EB05 in a broader ARDS population and file an IND for a Phase 2 study in pulmonary fibrosis. Additionally, Edesa is seeking regulatory approval for a Phase 2 study of its anti-CXCL10 monoclonal antibody in patients with nonsegmental vitiligo. Financially, the company demonstrated operational efficiency, with total operating expenses decreasing, while total other income increased. Edesa reported a net loss of $1.9 million for the quarter and $3.5 million for the six months ended March 31, 2024. With a focus on executing strategic milestones, Edesa aims to enhance its product pipeline and strengthen its position in the market.",
Siyata Mobile Announces Closing of Approximately $4.0 Million Public Offering of Common Shares and Pre-Funded Warrants,2024-05-10T20:10:00.000Z,Low,Neutral,"Siyata Mobile Inc. announced the closing of a $4.0 million public offering of common shares and pre-funded warrants. The gross proceeds were approximately $3.9 million. The company plans to use the funds for working capital, general corporate purposes, marketing, advertising services, and potential future acquisitions. The offering was made at a public offering price of $1.30 per share. Siyata aims to become a global leader in the Push-to-Talk over Cellular market, a multi-billion-dollar industry.",
IBC Advanced Alloys Closes Sale Leaseback Transaction,2024-05-10T22:20:00.000Z,Moderate,Neutral,"IBC Advanced Alloys Corp. announces the closing of a sale leaseback transaction with Flatbay Properties  for $3,850,000. Flatbay purchased a property in Indiana and leased it back to the Company's U.S. subsidiary until 2029. The transaction provided $3,850,000 in funding, with $485,000 expected for working capital after loan repayment.",
"Merrimack Pharmaceuticals, Inc. Announces Stockholder Approval of Plan of Dissolution And Cash Liquidating Dividend Amount of $15.10 Per Share of Common Stock",2024-05-10T20:30:00.000Z,Low,Neutral,"Merrimack Pharmaceuticals, Inc. announced stockholder approval of a Plan of Dissolution and declared a cash liquidating dividend of $15.10 per share of common stock. The dividend is expected to be paid on or about May 17, 2024. The common stock will trade on NASDAQ until May 17, 2024, delisting on May 20, 2024. CEO Gary Crocker expressed gratitude for shareholder support and the opportunity to return milestone proceeds to shareholders.",
Eguana Provides a Financial Update and a Bi-Weekly Update on Filing of Annual Financial Statements,2024-05-10T20:13:00.000Z,Moderate,Neutral,"Eguana Technologies Inc. provides a financial update regarding its delay in filing annual financial statements for 2023. The company faces various financial adjustments, including credit losses, inventory impairments, debt reclassification, and legal disputes. Despite challenges in the solar industry affecting liquidity, Eguana aims to complete its filings by May 31, 2024.",
"JanOne to Acquire ALT 5 Sigma Inc., a Leading Next Generation Blockchain Financial Technology Provider",2024-05-10T20:10:00.000Z,Neutral,Neutral,"JanOne Inc. (Nasdaq: JAN) has agreed to acquire ALT 5 Sigma Inc., a fintech provider specializing in blockchain technologies. ALT 5's transactional volume exceeded $1.1 billion in 2023 and $450 million in Q1 2024. The acquisition aims to leverage ALT 5's innovative solutions in the payment processing market. ALT 5 Pay and ALT 5 Prime are the two platforms offered by ALT 5, focusing on crypto-currency payment gateways and electronic OTC trading. The deal is expected to close the week of May 13th, 2024, subject to regulatory approval.",
Gossamer Bio Announces Inducement Grant Under Nasdaq Listing Rule 5635(c)(4),2024-05-10T20:30:00.000Z,Low,Very Positive,"Gossamer Bio, Inc. (NASDAQ: GOSS) granted non-executive employees stock options under the 2023 Inducement Plan. The options allow the purchase of up to 323,000 shares at $0.755 per share, vesting over four years. This grant aims to incentivize and retain new employees in accordance with Nasdaq rules.",
Westlake Corporation Declares Quarterly Dividend,2024-05-10T20:15:00.000Z,Low,Neutral,"Westlake  (NYSE: WLK) declared a quarterly dividend of $0.50 per share for the first quarter of 2024. The dividend will be payable on June 6, 2024, to stockholders of record on May 21, 2024. This marks the 79th consecutive quarterly dividend since the company's IPO in 2004.",
"Integrated BioPharma Reports Results for its Quarter Ended March 31, 2024",2024-05-10T20:30:00.000Z,High,Negative,"Integrated BioPharma, Inc. reports its financial results for the quarter ended March 31, 2024. Revenue remained stable between 2023 and 2024 at $13.1 million. The Company experienced an operating income increase from $44,000 to $0.4 million in the same period. However, for the nine-month period, revenue decreased slightly by 0.3% to $37.6 million, with an operating loss of $0.2 million compared to operating income of $41,000 in the previous year. Net income per share rose to $0.01 from $0.00 in the quarter ended March 31, 2023, but the nine-month period saw a net loss of $0.2 million compared to $74,000 in the previous year. The Company aims to reduce reliance on two major customers in the future.",
TPT Global Tech Files 10K to Regain Full SEC Compliance,2024-05-10T22:55:00.000Z,High,Neutral,"TPT Global Tech, Inc. has filed its 10K to regain SEC compliance, demonstrating a commitment to transparency and compliance. The company aims to restore its 15c2-11 status to resume standard trading practices, emphasizing its dedication to shareholders.",
Nxu Evaluates Strategic Alternatives and Announces Cost Reduction Initiatives,2024-05-10T21:00:00.000Z,Moderate,Neutral,"Nxu Inc., a technology company focused on energy storage and charging solutions, announced plans to evaluate strategic alternatives to enhance long-term value creation. The company is reducing costs through headcount reductions and cost-saving measures to lower operating expenses.",
CNH Sustainability Report Highlights Key Milestones,2024-05-10T20:10:00.000Z,No impact,Neutral,"CNH Industrial (CNH) releases its 2023 Sustainability Report, showcasing investments in technologies, communities, and global initiatives like the UN's Sustainable Development Goals. The report emphasizes the company's commitment to supporting customers, employees, and local communities.",
Chicago Rivet & Machine Co. Announces First Quarter Results of Operations,2024-05-10T20:45:00.000Z,Neutral,Neutral,"Chicago Rivet & Machine Co. reported their first quarter 2024 results, showing a decrease in net sales, income before taxes, and net income compared to the same period in 2023. The company also experienced a decline in net income per common share. These results indicate a challenging quarter for the company.",
Millicom (Tigo) share repurchase activity,2024-05-10T21:30:00.000Z,Neutral,Neutral,"Millicom (Tigo) conducted a share repurchase program resulting in the repurchase of 29,063 of its Swedish Depository Receipts (SDRs) between May 6, 2024, and May 10, 2024. The purchases were made at daily average prices ranging from SEK 230.63 to SEK 246.65, with a total daily repurchase amount exceeding SEK 1.4 million. Millicom currently holds 853,974 treasury shares out of a total of 172,096,305 outstanding shares.",
Basin Uranium Announces Acceleration of Warrant Expiry Date,2024-05-10T20:39:00.000Z,Neutral,Neutral,"Basin Uranium Corp announces the acceleration of the expiry date of outstanding share purchase warrants in accordance with the policies of the Canadian Securities Exchange. The price of the Company's common shares triggered the obligation to accelerate the expiry date of the warrants, with the new expiry date set for June 16, 2024.",
"Salem Media Group Announces the Sale of its Principal Office in Camarillo, CA",2024-05-10T20:32:00.000Z,Neutral,Neutral,"Salem Media Group announced the sale of its principal office in Camarillo, CA to Eclipse RE Holdings,  for $5.5 million, closing on May 1, 2024. Salem will leaseback the building for five years. Salem Media Group is a multimedia company specializing in Christian and conservative content.",
JBT Corporation Declares Quarterly Dividend,2024-05-10T20:15:00.000Z,Low,Neutral,"JBT  (NYSE: JBT) declared a quarterly cash dividend of $0.10 per share on May 10, 2024. The dividend will be payable on June 6, 2024, to stockholders of record as of May 23, 2024. JBT is a global technology solutions provider in the food & beverage industry, employing 5,100 people worldwide.",
W&T Offshore Announces First Quarter 2024 Results and Declares Dividend for Second Quarter of 2024,2024-05-10T21:00:00.000Z,Low,Neutral,"W&T Offshore, Inc. reported operational and financial results for Q1 2024, including a dividend declaration for Q2 2024. They acquired six Gulf of Mexico fields, increased oil production by 15%, reported adjusted EBITDA of $49.4 million, and generated positive Free Cash Flow for the 25th consecutive quarter. They declared a dividend of $0.01 per share for Q2 2024 and expanded their Board.",
Siebert Reports Fourth Quarter and Full Year 2023 Financial Results,2024-05-10T21:19:00.000Z,Moderate,Neutral,"Siebert Financial Corp (NASDAQ: SIEB) reported strong financial results for the fourth quarter and full year of 2023. The company saw a significant increase in revenue, operating income, and net income compared to the previous year. The appointment of a new CEO, expansion to Miami and New York, and a significant investment from Kakao Pay were key highlights. Siebert remains optimistic about future growth opportunities.",
FendX Announces Second Real-World Testing Site for REPELWRAP(TM) Film with Island View Place Care and Provides Corporate Update,2024-05-10T21:51:00.000Z,Neutral,Neutral,"FendX Technologies Inc. announces real-world testing of REPELWRAP(TM) film with Island View Place Care, a senior living facility, after successful completion of a manufacturing process with Dunmore International Inc. The company also plans to conduct testing at Giuletta, an Italian restaurant. Furthermore, FendX enters into an agreement with Spark Newswire for investor relations consulting services.",
Paragon Technologies News Release,2024-05-11T01:00:00.000Z,Low,Neutral,"Paragon Technologies, Inc. reported its results for the first quarter of 2024. The company's net sales increased to $31,521, with operating income at $534. However, it experienced a net loss of $(53) due to investment gains/losses. Shareholders can find detailed information in the quarterly report on the company's website.",
LivePerson Reports Inducement Grants Under NASDAQ Listing Rule 5635(c)(4),2024-05-10T20:30:00.000Z,Low,Very Positive,"LivePerson, Inc. (Nasdaq: LPSN) reported recent grants of equity-based incentive awards under the Inducement Plan for new hires. The grants included 22 grants of restricted stock units (RSUs) totaling 1,367,572 shares of Common Stock. These awards were made between June 1, 2023, and April 30, 2024. The RSUs vest over 4 years or 2 years, depending on the grant date, subject to continued employment.",
Temas Resources Completes Second and Final Tranche of Oversubscribed Private Placement,2024-05-10T20:40:00.000Z,Neutral,Neutral,"Temas Resources Corp. completed the second and final tranche of an oversubscribed private placement, raising $531,000 by issuing 2,655,000 units at $0.20 per unit. The funds will be used for exploration programs and general corporate purposes. The company also paid finders a cash fee and issued finders' warrants as compensation. Directors also participated in the financing, oversubscribing the original offering.",
"Bank of America Recommends Shareholders Reject ""Mini-Tender"" Offer by Tutanota LLC",2024-05-10T20:30:00.000Z,Low,Neutral,"Bank of America received an unsolicited 'mini-tender' offer from Tutanota  to purchase up to 1 million shares at $40.00 per share, below market price if conditions aren't met. Shareholders are advised not to tender their shares due to various conditions, including financing uncertainties. Tutanota has a history of similar offers, and investors should exercise caution and review SEC guidance.",
American Tower Corporation Announces Participation in Upcoming Investor Conferences,2024-05-10T20:30:00.000Z,Low,Neutral,"American Tower  (NYSE: AMT) will participate in several upcoming investor conferences featuring speakers like Adam Smith and Steve Vondran. The company is a leading global REIT in communications real estate, with over 224,000 communications sites and U.S. data center facilities.",
Sun Life announces election of directors,2024-05-10T20:01:00.000Z,Low,Neutral,"Sun Life Financial Inc. announced the election of 11 nominees as directors of the company at the annual meeting of common shareholders. The detailed voting results showed significant support for all directors, showcasing shareholder confidence in the company's leadership. Sun Life, a prominent financial services organization, operates globally with total assets under management of $1.47 trillion as of March 31, 2024.",
Network-1 Reports First Quarter 2024 Results,2024-05-10T20:30:00.000Z,Neutral,Neutral,"Network-1 Technologies, Inc. (NTIP) reported no revenue for Q1 2024, a decrease from $537,000 in Q1 2023 due to patent settlement. The company had a net loss of $920,000 compared to $623,000 in the same period last year. Despite losses, Network-1 holds cash and marketable securities totaling $43,394,000 and maintains a Share Repurchase Program. The company continues to pay semi-annual dividends of $0.05 per share.",
Power Nickel delineates New Polymetallic Discovery,2024-05-10T21:27:00.000Z,Neutral,Positive,"Power Nickel Inc. announces high-grade multi-elements assay results for holes PN-24-048, PN-24-052, and PN-24-053, revealing promising high-grade Copper, Platinum, Palladium, Gold, and Silver deposits. The Lion Zone discovery continues to expand near its Main Nisk Deposit, with visible high-grade core surrounded by well-mineralized edges. The company's winter 2024 drill program concluded with 15 successful holes, affirming ongoing progress in the discovery. Power Nickel plans to continue drilling in the upcoming summer season, targeting the Lion Discovery.",
QuickLogic Presents Latest RadHard eFPGA IP and FPGAs at SEE/MAPLD 2024,2024-05-10T21:14:00.000Z,Neutral,Neutral,"QuickLogic  is showcasing its latest RadHard eFPGA IP and FPGAs at the SEE/MAPLD 2024 event. The company's products are developed using proprietary technology and open-source components, emphasizing customization and transparency. QuickLogic offers radiation-hardened eFPGA IP and FPGA devices for mission-critical applications.",
VULCAN DECLARES QUARTERLY DIVIDEND ON COMMON STOCK,2024-05-10T20:30:00.000Z,Low,Neutral,"Vulcan Materials Company (NYSE: VMC) has declared a quarterly cash dividend of $0.46 cents per share on its common stock. The dividend will be payable on June 7, 2024, to shareholders of record at the close of business on May 24, 2024. Vulcan Materials Company is the nation's largest producer of construction aggregates and a major producer of aggregates-based construction materials.",
Cassava Sciences Reports Q1 2024 Financial Results and Clinical Updates on Phase 3 Trials of Simufilam,2024-05-10T20:02:00.000Z,Moderate,Neutral,"Cassava Sciences reported strong financial results for Q1 2024, with $126.3 million in total gross proceeds from warrants. Over 1,900 Alzheimer's patients are enrolled in Phase 3 trials of Simufilam, with positive clinical updates. Net income was $25.0 million, a significant improvement from a net loss of $24.3 million in 2023. Cash use for operations is expected to be $35 to $45 million for the first half of 2024.",
Atrion Reports First Quarter 2024 Results,2024-05-10T20:10:00.000Z,Low,Negative,"Atrion  (NASDAQ: ATRI) reported first quarter 2024 results with revenues of $47.3 million, operating income of $3.1 million, and net income of $2.8 million. Diluted earnings per share were $1.59. Despite revenue growth and increased operating income, net income decreased due to a one-time inventory write-off. Gross margins declined primarily due to delayed orders, excess inventory, and product mix. The company remains debt free with total cash and investments of $18.7 million.",
byNordic Acquisition Corporation Announces Extension of Deadline to Complete Business Combination,2024-05-10T20:05:00.000Z,Low,Neutral,"byNordic Acquisition  (NASDAQ: BYNO) has extended the deadline to complete a business combination by depositing $105,000 into the Trust Account, allowing an additional one-month period until June 12, 2024. This marks the fourth extension out of a possible six permitted under the August 10, 2023 amendment, giving flexibility to the board of directors until August 12, 2024.",
Crescent Point Announces 2024 Annual and Special Meeting of Shareholders Results and Changes Name to Veren,2024-05-10T20:09:00.000Z,No impact,Neutral,"Crescent Point Energy Corp. held its Annual and Special Meeting of Shareholders on May 10, 2024, where shareholders approved changing the company's name to Veren Inc. Trading under the new symbol 'VRN' is expected to begin on May 15, 2024. The meeting results and voting outcomes were positive, with all resolutions passed.",
TELA Bio Announces Inducement Grants Under Nasdaq Listing Rule 5635(c)(4),2024-05-10T20:05:00.000Z,Low,Very Positive,"TELA Bio, Inc. announced the approval of inducement grants of restricted stock units to newly-hired employees. The grants cover 20,250 shares of common stock and were approved on May 6, 2024. The restricted stock units will vest over four years, contingent on the employees' continued service with TELA Bio.",
Acri Capital Acquisition Corporation Announces Extension of the Deadline for an Initial Business Combination,2024-05-10T20:05:00.000Z,No impact,Neutral,"Acri Capital Acquisition  has extended the deadline for its initial business combination from May 14, 2024 to June 14, 2024 by depositing $50,000 into its trust account. The company can continue extending the deadline monthly until January 14, 2025 or an earlier date as decided by its board.",
Forward Reports Fiscal 2024 Second Quarter Results,2024-05-10T20:10:00.000Z,Neutral,Negative,"Forward Industries, Inc. (NASDAQ:FORD) reported a decrease in revenues to $7.8 million in the second quarter of fiscal year 2024, down by 19.6% from the previous year. Despite an increase in gross margin to 20.5%, the company faced a loss from continuing operations of $0.5 million. The net loss was $0.6 million, with basic and diluted loss per share at $0.05. The cash balance stood at $2.3 million as of March 31, 2024. CEO Terry Wise highlighted the company's focus on profitability and cost management.",
Vicinity Motor Corp. Announces Amendment to Repayment Schedule on CAD$12.0 Million Debenture to Support Near-Term Liquidity Goals,2024-05-10T20:05:00.000Z,Neutral,Neutral,"Vicinity Motor Corp. announced an amendment to its repayment schedule, deferring CAD$5.8 million in repayments from April and July of 2024 until the maturity date in October 2024. The amendment reflects the company's focus on near-term liquidity goals and operational efficiency. President Brent Phillips expressed gratitude to debtholders for their support, highlighting the company's commitment to financial discipline and operational excellence.",
"CarGurus to Present at the J.P. Morgan 52nd Annual Global Technology, Media and Communications Conference",2024-05-10T20:01:00.000Z,Low,Neutral,"CarGurus, Inc. (Nasdaq: CARG) announced that its CEO will participate in a fireside chat at the J.P. Morgan 52nd Annual Global Technology, Media and Communications Conference on May 20, 2024. The webcast will be available on the company's Investor Relations page.",
American Resources Corporation Engages GBQ Partners LLC as Independent Registered Public Accounting Firm,2024-05-10T20:05:00.000Z,Neutral,Neutral,"American Resources  has engaged GBQ Partners  as its new independent registered public accounting firm. GBQ is a top 100 tax, accounting, and consulting firm with over 70 years of experience. This move aims to support the growth of American Resources' infrastructure assets and operations. The company is focused on providing high-quality raw materials for the new infrastructure market, including metallurgical carbon and rare earth minerals.",
Tandy Leather Factory Reports First Quarter 2024 Results,2024-05-10T20:20:00.000Z,Low,Neutral,"Tandy Leather Factory, Inc. reported financial results for the first fiscal quarter of 2024. Revenues were $19.3 million, down 5.3% from 2023, with operating income of $0.7 million and net income of $0.5 million. Gross margins were 56.7%, down from 58.1% in 2023. Adjusted EBITDA was $1.1 million. The company ended the quarter with $12.3 million in cash and cash equivalents. Despite sales and gross margin challenges, the company remains focused on improving retail store performance and overall quality.",
Applied DNA Announces Second Quarter Fiscal Year 2024  Financial Results,2024-05-10T20:05:00.000Z,Moderate,Negative,"Applied DNA announced its second-quarter fiscal year 2024 financial results, reporting a decline in total revenues to $930 thousand due to the conclusion of a testing contract. Gross profit decreased to $296 thousand, with a decline in the gross profit percentage. Operating expenses decreased to $3.9 million. The loss from operations was $3.6 million, and Adjusted EBITDA was a negative $3.3 million. Cash and cash equivalents stood at $3.1 million. The company underwent a one-for-twenty reverse stock split and regained compliance with the Nasdaq minimum bid price requirement.",
Skeena Reports Q1 2024 Financial Results & Publishes ESG Report,2024-05-10T20:26:00.000Z,Low,Neutral,"Skeena Resources  (TSX:SKE)(NYSE:SKE) reported its Q1 2024 financial results and released its ESG report for the 2023 calendar year. The company's interim financial statements and MD&A are accessible on its website. Skeena showcased positive contributions across economic, environmental, social, and governance aspects, aiming to create value for shareholders and partners.",
