title,datetime,impact_score,sentiment,summary,article
"Dollar General Opens 20,000th Store",2024-02-24T20:31:00.000Z,Low,Positive,"Dollar General (DG) celebrates the opening of its 20,000th store in Alice, Texas, emphasizing its commitment to providing affordable essentials and supporting local communities. The event included donations to educational programs and recognition from Texas Governor Greg Abbott.","Dollar General Opens 20,000th Store Rhea-AI Impact (Low) Rhea-AI Sentiment (Positive) Tags Rhea-AI Summary Dollar General (DG) celebrates the opening of its 20,000th store in Alice, Texas, emphasizing its commitment to providing affordable essentials and supporting local communities. The event included donations to educational programs and recognition from Texas Governor Greg Abbott. Positive None. Negative None. 02/24/2024 - 03:31 PM GOODLETTSVILLE, Tenn.--(BUSINESS WIRE)-- This morning, Dollar General Corporation (NYSE: DG) celebrated the grand opening of its 20,000th store at its DG Market location in Alice, Texas, marking its continued commitment to providing communities with convenient and affordable access to household essentials and nutritious foods. This press release features multimedia. View the full release here: https://www.businesswire.com/news/home/20240223242813/en/Dollar General celebrates its 20,000th store grand opening in Alice, Texas. (Photo: Business Wire) “Today marks an incredible milestone in Dollar General’s history,” said Steve Deckard, Dollar General’s executive vice president of store operations and development. “From our first general store to today’s 20,000th store opening, our mission to serve others and help customers stretch their budget remains strong. We believe each store provides a positive impact in our hometowns through convenient access to affordable essentials, career growth opportunities for employees, and the ability for local nonprofits, schools and libraries to advance through Dollar General Literacy Foundation grants. On behalf of the DG leadership team, I would like to share my gratitude to the entire DG family for its ongoing commitment to our customers and communities in helping us reach this milestone.” Celebrations in Alice, Texas The milestone grand opening celebrations began at 9 a.m. this morning with senior leaders and vendors. After the official ribbon cutting, customers received a complimentary tote bag with product samples from numerous vendors, as well as refreshments from one of DG’s private brands, Clover Valley. Dollar General also awarded $20,000 to support educational and tutoring programs through a $10,000 donation each to Alicia Salinas Public Library and to the Boys & Girls Club of Alice. The Company also provided new books to Saenz Elementary School in Alice to help instill a love of reading in students. Texas Governor Greg Abbott commemorated the occasion with an official recognition, which included “I have full faith that its twenty thousandth store will be an uplifting force in Alice and beyond. During this milestone celebration and hereafter, I encourage all Dollar General employees to feel pride in their work and to reflect upon the values that launched one of America’s most iconic companies.” Dollar General proudly employs more than 17,500 Texas employees through its store, distribution center and private fleet presence in the state. Dollar General originated as a wholesale venture by J.L. Turner and his son, Cal Turner, Sr. The first Dollar General store opened nearly 70 years ago in Springfield, Kentucky in 1955. Additional information on Dollar General’s history is available at https://www.dollargeneral.com/about-us/history.html. About Dollar General Corporation Dollar General Corporation (NYSE: DG) is proud to serve as America’s neighborhood general store. Founded in 1939, Dollar General lives its mission of Serving Others every day by providing access to affordable products and services for its customers, career opportunities for its employees, and literacy and education support for its hometown communities. As of November 3, 2023, the Company’s 19,726 Dollar General, DG Market, DGX and pOpshelf stores across the United States and Mi Súper Dollar General stores in Mexico provide everyday essentials including food, health and wellness products, cleaning and laundry supplies, self-care and beauty items, and seasonal décor from our high-quality private brands alongside many of the world’s most trusted brands such as Coca Cola, PepsiCo/Frito-Lay, General Mills, Hershey, J.M. Smucker, Kraft, Mars, Nestlé, Procter & Gamble and Unilever. View source version on businesswire.com: https://www.businesswire.com/news/home/20240223242813/en/ Dollar General Public Relations dgpr@dollargeneral.com Source: Dollar General Corporation What milestone did Dollar General (DG) achieve in Alice, Texas? Dollar General celebrated the opening of its 20,000th store in Alice, Texas. What was included in the celebration at the grand opening? The celebration included a ribbon-cutting ceremony, complimentary tote bags with product samples, refreshments, donations to educational programs, and recognition from Texas Governor Greg Abbott. How many employees does Dollar General (DG) employ in Texas? Dollar General proudly employs more than 17,500 employees in Texas through its various operations. When was the first Dollar General store opened? The first Dollar General store opened almost 70 years ago in Springfield, Kentucky in 1955."
Adamas One Corp. Provides Shareholder Update,2024-02-25T04:31:00.000Z,High,Positive,"Adamas One Corp. (JEWL) provides a shareholder update outlining key initiatives, achievements, and future plans. The company focuses on producing high-quality lab-grown diamonds for various markets, expanding into jewelry and technology sectors, enhancing manufacturing capabilities, launching a luxury jewelry line, and acquiring strategic assets to become a vertically integrated lab-grown diamond company. Additionally, Adamas One aims to increase its presence in the semiconductor sector through its subsidiary, Adamas One Technologies™, and leverage artificial intelligence solutions to expand its customer base. The company's CEO emphasizes the growing market share of lab-grown diamonds and the potential for further growth in both the jewelry and technology industries.","Adamas One Corp. Provides Shareholder Update Rhea-AI Impact (High) Rhea-AI Sentiment (Positive) Tags Rhea-AI Summary Adamas One Corp. (JEWL) provides a shareholder update outlining key initiatives, achievements, and future plans. The company focuses on producing high-quality lab-grown diamonds for various markets, expanding into jewelry and technology sectors, enhancing manufacturing capabilities, launching a luxury jewelry line, and acquiring strategic assets to become a vertically integrated lab-grown diamond company. Additionally, Adamas One aims to increase its presence in the semiconductor sector through its subsidiary, Adamas One Technologies™, and leverage artificial intelligence solutions to expand its customer base. The company's CEO emphasizes the growing market share of lab-grown diamonds and the potential for further growth in both the jewelry and technology industries. Positive None. Negative None. Market Research Analyst Adamas One Corp's strategic initiatives indicate a significant push towards vertical integration within the lab-grown diamond industry. The company's focus on quality, branding and expansion into new markets, such as the technology sector, is poised to capitalize on the growing acceptance and demand for lab-grown diamonds. With over 55% of loose diamond sales in the U.S. now attributed to lab-grown varieties, Adamas One's efforts to increase production capacity and enhance their e-commerce platform could address a larger market share. The acquisition of a high-quality diamond cutter and a diamond wholesaler/retailer could streamline the supply chain, potentially improving profit margins. However, such expansions require substantial capital and the company's approach to minimize dilution for existing shareholders during fundraising will be critical to investor sentiment. Financial Analyst Adamas One's decision to engage Cappello Global Capital for capital raising to support acquisitions is a strategic move that may bolster investor confidence by professionalizing the fundraising process. The company's clear intent to avoid diluting shareholder value during this phase is a positive sign for current investors. However, the costs associated with acquisitions and the integration of new assets into the company's operations will be a critical factor to watch in the coming financial periods. Investors should closely monitor the company's financial reports, audited by the newly appointed firm Turner, Stone and Company, L.L.P., for indicators of financial health and the success of these strategic moves. Technology Industry Analyst The formation of Adamas One Technologies™ and the company's focus on leveraging lab-grown diamonds within the semiconductor space is a forward-thinking initiative. Lab-grown diamonds have superior thermal and electrical properties that make them suitable for high-performance semiconductor applications. Collaborations with a National Laboratory and the use of AI solutions through NexGen AI to extend customer base and brand position suggest a commitment to innovation. The company's progress in adapting diamond substrates for new technology opportunities could open up lucrative avenues in the semiconductor industry, provided the R&D efforts translate into viable products. 02/24/2024 - 11:31 PM SCOTTSDALE, Ariz., Feb. 24, 2024 (GLOBE NEWSWIRE) -- Adamas One Corp. (Nasdaq: JEWL) (“Adamas One,” “Adamas” or the “Company”), The Original Lab-Grown Diamond Company™, a high-tech company that leverages proprietary technology to produce high-quality, single-crystal, Lab-Grown Diamonds for jewelry and diamond materials for technology and other industrial uses, provides a shareholder update from our CEO below: Upon closing out our first year as a publicly traded company, listed on the NASDAQ exchange, we wanted to reach out to you, our shareholders, with an update on our business and to thank you for both your support and patience. Being a young company listed in a difficult market has been challenging, but we learned, adjusted and now we are looking forward to a good year ahead. At Adamas One Corp, our strategy to build a successful and profitable company is based on three key initiatives: First, deliver the highest quality lab-grown diamond materials for the markets we serve. Second, become a highly integrated and branded supplier of lab-grown diamond jewelry, in order to facilitate our path to increased revenue and propel us into the fastest growing market segment. Third, leverage the company’s extensive IP and continued R&D efforts to exploit opportunities in new sectors, starting with the technology industry. Additionally, we used a portion of our proceeds to update our factory with state of the art equipment, including 12 full-capacity reactors, extensive backup systems, testing equipment, lasers for initial rough cutting and various other essential equipment. In addition, we fine-tuned our recipes to increase the color and clarity of our diamonds in preparation for expanded distribution. We have also increased our staff to meet our production and sales & marketing needs. In the spring we completed the designs for nearly 200 different pieces of jewelry for our Elle Jolie ™ luxury jewelry line, which we anticipate officially launching in Q2 of 2024. Following the completion of the design process we began manufacturing utilizing our proprietary scalable process. We also entered into an agreement with a renowned high-end digital agency to partner with us on the branding, marketing, e-commerce, and fulfillment of the Elle Jolie™ jewelry line. Our goal is to compete with high-end retailers by bringing sustainable luxury to the lab grown diamond sector in a way that delivers increased revenue and high gross margin. We have already delivered the first Elle Jolie™ pieces to lead customers and plan to initially market the line Direct to Consumer (DTC) through our ElleJolie.com eCommerce website. In the summer we launched our redesigned corporate website - AdamasOne.com with a fresh look aimed at raising our corporate visibility and demonstrating the value we are building for our shareholders. The new site includes a shopping feature for Business-to-Business (B2B) transactions and provides educational materials to help raise awareness of the value and benefits of Adamas’ lab-grown diamonds for our customers. We also announced our intention to acquire a high-quality diamond cutter to further optimize our diamond manufacturing process and control all aspects of production, as the cut and polish capabilities of this entity will add significant value to the company’s holdings. Furthermore, we intend to acquire a lab-grown diamond wholesaler/retailer with a presence in New York’s diamond district. Combined with our manufacturing, these companies will enable us to complete the cycle from “seed to sale” and become one the most vertically integrated lab grown diamond companies in the world. We have hired Cappello Global Capital to assist with the capital raise needed to acquire the target assets. Our goal is to have minimal to no dilutive effect on our current shareholder base from the funds raised to complete the transactions. We announced plans to increase our presence in the semiconductor sector space with the launch of our wholly owned subsidiary, Adamas One Technologies™, and put together an experienced team to determine how we can best adapt our diamond substrate for use into new technology opportunities. Over the course of the last year we have worked with a National Laboratory in advanced material science to perform extensive testing on our diamond materials to help increase our knowledge on how to best exploit the extraordinary physical properties of lab-grown diamonds within the semiconductor space. Awareness of lab-grown diamonds has grown exponentially over the past year, and we believe that now is the right time to increase our PR profile and leverage that awareness to increase the profile of Adamas One. As such, our CEO has been a regular on a handful of talk and morning shows highlighting how the company plans to take advantage of the positive trends and additional focus on the lab-grown diamond industry. Being a top U.S. based manufacturer puts us in an excellent position to take advantage of the timing in order to get our name and brand out to the domestic and international consumers. Additionally, we have been working with our partner, NexGen AI to leverage artificial intelligence solutions to develop and extend our customer base and further solidify our brand position. These AI based outreach opportunities have already generated a number of significant B2B openings for the company. When Adamas One first started in the industry, lab-grown diamonds represented less than 1% of loose diamond sales in the U.S., currently that figure is over 55%. Over the course of the last year, we have worked to put ourselves in a position to take advantage of the growth in the market and place ourselves as a dominant manufacture and distributor in the U.S. and international lab-grown diamond markets for both jewelry and technologies. Our confidence is very high for the adaptation and use of lab-grown diamonds in the semiconductor industry and we want to make sure that we are in the forefront of that industry as well as the loose and finished goods jewelry industry. We have hired Turner, Stone and Company, L.L.P. as our new audit firm. We look to work closely with them to get our future filings done in a timely manner. We understand the importance of our filings and wanted to make sure we are always compliant and in good status. We are very excited by the rapid development of the market over the past year and continue to work diligently to position the company to thrive. Please follow us at https://ir.adamasone.com/ Not Mined. Not Fake. Just sped up perfection. ™ Forward-Looking StatementsThis press release may include “forward-looking statements” within the meaning of Section 27A of the Securities Act of 1933, as amended, and Section 21E of the Securities Exchange Act of 1934, as amended. To the extent that the information presented in this press release discusses financial projections, information, or expectations about our business plans, results of operations, products or markets, or otherwise makes statements about future events, such statements are forward-looking. Such forward-looking statements can be identified by the use of words such as “should”, “may,” “intends,” “anticipates,” “believes,” “estimates,” “projects,” “forecasts,” “expects,” “plans,” and “proposes.” Although we believe that the expectations reflected in these forward-looking statements are based on reasonable assumptions, there are a number of risks and uncertainties that could cause actual results to differ materially from such forward-looking statements. You are urged to carefully review and consider any cautionary statements and other disclosures, including the statements made under the heading “Risk Factors” and elsewhere in documents that we file from time to time with the Securities and Exchange Commission. Forward-looking statements speak only as of the date of the document in which they are contained, and Adamas One Corp. does not undertake any duty to update any forward-looking statements except as may be required by law. References and links to websites have been provided as a convenience, and the information contained on such websites is not incorporated by reference into this press release. Source: Adamas One Corp. What is the ticker symbol of Adamas One Corp. mentioned in the press release? The ticker symbol for Adamas One Corp. is JEWL. What are the key initiatives outlined by Adamas One Corp. in the shareholder update? Adamas One Corp. focuses on delivering high-quality lab-grown diamond materials, expanding into the jewelry and technology sectors, and leveraging its IP and R&D efforts to explore new opportunities. What equipment did Adamas One Corp. update its factory with? Adamas One Corp. updated its factory with state-of-the-art equipment, including 12 full-capacity reactors, backup systems, testing equipment, lasers for rough cutting, and other essential tools. When does Adamas One Corp. anticipate launching its Elle Jolie™ luxury jewelry line? Adamas One Corp. anticipates officially launching its Elle Jolie™ luxury jewelry line in Q2 of 2024. What is the goal of Adamas One Corp. in acquiring a high-quality diamond cutter? The goal of acquiring a high-quality diamond cutter is to optimize the diamond manufacturing process and enhance the company's production capabilities."
