title,datetime,impact_score,sentiment,summary,article
"Sienna Acquires the ""Case Lake West Cesium and Spodumene Pegmatite Project"" in Ontario",2024-05-23T07:01:00.000Z,Neutral,Neutral,"Sienna Resources has acquired the 'Case Lake West Cesium and Spodumene Pegmatite Project' in Ontario, Canada, covering approximately 2,200 acres. This new project neighbors Power Metals Corp's cesium and pegmatite discovery at Case Lake, where recent results yielded up to 18.13% cesium. Sienna's management is optimistic about the acquisition, citing the region's renowned mining history and the current positive trends in the junior market. The company also holds significant uranium and lithium projects in Canada and the USA, including the Elko Lithium Project and various uranium projects in Saskatchewan and Nevada. Management plans to expand its asset portfolio further.",
"Share Buyback Transaction Details May 16 – May 22, 2024",2024-05-23T08:00:00.000Z,No impact,Neutral,"Wolters Kluwer (Euronext: WKL), a global leader in professional information, software solutions, and services, announced the repurchase of 142,727 ordinary shares between May 16 and May 22, 2024, totaling €20.9 million at an average price of €146.74 per share. This is part of their €1 billion share buyback program for 2024, initiated on February 21, 2024. To date, they have repurchased 2,911,319 shares for €414.6 million at an average price of €142.43. A third party will manage approximately €647 million worth of buybacks until December 27, 2024. The repurchased shares will be held as treasury shares for capital reduction through share cancellation.",
E3 Lithium Outlines Inaugural 2.5 Mt LCE Inferred Mineral Resource within the Estevan Lithium District in Saskatchewan,2024-05-23T07:05:00.000Z,Moderate,Neutral,"E3 Lithium has announced its inaugural inferred mineral resource estimate of approximately 2.5 million tonnes of lithium carbonate equivalent (LCE) within the Estevan Lithium District in Saskatchewan. The company's permit area covers around 67,000 hectares. Lithium concentrations reached up to 259 mg/L in some areas. The resource estimate, reviewed by qualified professionals, includes six distinctive zones within the Duperow Formation, with a total brine volume of over 5 billion cubic meters. The detailed technical report will be available on E3 Lithium's website and SEDAR within 45 days.",
Flex LNG - First Quarter 2024 Presentation,2024-05-23T05:11:00.000Z,Low,Neutral,"Flex LNG has released its first quarter 2024 earnings report and will hold a live video webcast on May 23, 2024, at 15:00 CEST (09:00 a.m. EST) to discuss the results. A Q&A session will follow. The presentation and a short teaser video highlighting the quarter's key points are available on their website.For further details, contact Knut Traaholt, CFO, via phone or email.",
Elbit Systems Awarded a Contract of Approximately $260 Million by an International Customer,2024-05-23T07:15:00.000Z,Neutral,Neutral,"Elbit Systems (NASDAQ: ESLT) has secured a $260 million contract to supply systems to an international customer. Announced on May 23, 2024, the contract will be executed over a two-year period. Elbit Systems' CEO, Bezhalel Machlis, expressed pride in offering advanced solutions to enhance national security and technological capabilities for their international clientele. The contract reflects Elbit Systems' ongoing commitment to providing cutting-edge technology and strengthening global security measures.",
Vivoryon Therapeutics N.V. Reports Q1 2024 Financial Results and New Data Reinforcing Strategic Focus in Kidney Disease,2024-05-23T05:00:00.000Z,Neutral,Neutral,"Vivoryon Therapeutics N.V. reported financial results for Q1 2024, highlighting a strategic shift towards kidney disease following disappointing AD study results. The company observed substantial improvements in kidney function with varoglutamstat. Revenue remained zero, but R&D and administrative expenses rose, leading to a net loss of EUR 9.3 million. Cash reserves stood at EUR 22.0 million, expected to fund operations into Q2 2025. Vivoryon will focus on inflammatory and fibrotic disorders and plans to discontinue the VIVA-MIND study. The 2024 Annual General Meeting is set for June 21 in Amsterdam.",
Stellantis Announces Launch of Second Tranche of Its 2024 Share Buyback Program,2024-05-23T06:01:00.000Z,Neutral,Neutral,"Stellantis has announced the launch of the second tranche of its 2024 Share Buyback Program, which started on May 23, 2024, and will conclude by August 30, 2024. This tranche involves a maximum of €1 billion, part of the overall €3 billion Program initiated on February 15, 2024. The buyback will be executed by an independent investment firm. The company plans to cancel most of the repurchased shares, but up to €0.5 billion will be reserved for employee stock plans and equity compensation to avoid shareholder dilution. The buyback will adhere to the rules and regulations, including the Market Abuse Regulation 596/2014.",
Caledonia Mining Corporation Plc: Notification of relevant change to significant shareholder,2024-05-23T06:00:00.000Z,Neutral,Neutral,"Caledonia Mining  announced that BlackRock, Inc. has crossed a notification threshold concerning its shareholding in Caledonia as of May 21, 2024. The notification was received on May 22, 2024. BlackRock, Inc.'s updated position shows a decrease in voting rights from 4.76% to 4.67%, comprising 3.97% from shares and 0.70% from financial instruments. This change is significant per AIM Rules for Companies.",
WEC Energy Group announces pricing of $750 million of 4.375% Convertible Senior Notes due 2027 and $750 million of 4.375% Convertible Senior Notes due 2029,2024-05-23T04:00:00.000Z,Low,Neutral,"WEC Energy Group announced the pricing of $750 million in 4.375% convertible senior notes due 2027 and another $750 million in 4.375% convertible senior notes due 2029. The offering is aimed at qualified institutional buyers under Rule 144A.The notes are expected to close on May 28, 2024, with interest paid semiannually. The 2027 notes mature on June 1, 2027, and the 2029 notes mature on June 1, 2029. Conversion rates are set at 10.1243 shares per $1,000, translating to a conversion price of approximately $98.77 per share, a 20% premium over the last sale price on May 22, 2024. WEC intends to use the proceeds for corporate purposes, including debt repayment.",
Flex LNG - First Quarter 2024 Earnings Release,2024-05-23T05:18:00.000Z,Low,Neutral,"Flex LNG reported its unaudited financial results for Q1 2024, with revenues of $90.2 million, down from $97.2 million in Q4 2023. Net income rose to $33.2 million from $19.4 million in the previous quarter, with EPS increasing to $0.62. Adjusted net income and EPS remained steady at $37.9 million and $0.70, respectively. Despite lower revenues, the company extended contracts for multiple vessels, adding 6.2 years to its backlog. Flex LNG declared a $0.75 per share dividend, maintaining a strong balance sheet with $383 million in cash. CEO Øystein M. Kalleklev emphasized the company's increased earnings visibility and protection against market weaknesses.",
Sandvik secures major underground mining equipment order from Hindustan Zinc,2024-05-23T07:12:00.000Z,Moderate,Neutral,"Sandvik has secured a significant order from Hindustan Zinc  for underground mining equipment worth approximately SEK 345 million. The order was booked in Q2 2024, with deliveries scheduled through the end of 2024. This contract strengthens the long-standing partnership between the two companies and includes development drills, production drills, trucks, and loaders. Additionally, the deal offers substantial aftermarket value, enhancing productivity, safety, and sustainability in Hindustan Zinc's operations.Mats Eriksson, President of Sandvik Mining and Rock Solutions, expressed his satisfaction with the expanded partnership and highlighted the benefits of Sandvik's advanced mining solutions.",
Aker Solutions doubles down on consultancy business and unveils new name,2024-05-23T07:03:00.000Z,Low,Very Positive,"Aker Solutions has announced plans to double its consultancy business, rebranding it as Entr, with aspirations to double revenues and headcount by 2030. This growth will be driven by increasing demand for early phase offerings and adapting services for new markets. Entr plans to expand its workforce from 300 to over 600 employees globally. The consultancy secured 170 studies in areas such as low carbon solutions and offshore wind. Entr aims to de-risk commercial, technical, and ESG aspects of energy projects, leveraging Aker Solutions' extensive industry expertise and project delivery heritage. The company launched its consultancy business in 2021, aiming to engage earlier in the value chain and further accelerate its transformation within the global energy industry.",
Coca-Cola Europacific Partners plc Announces Appointment of Chief Financial Officer,2024-05-23T06:20:00.000Z,Low,Very Positive,"Coca-Cola Europacific Partners (CCEP) has announced the appointment of Ed Walker as Chief Financial Officer (CFO), effective July 1, 2024. Ed Walker, who has been with CCEP since its formation and has over 30 years of finance leadership experience, will replace outgoing CFO Nik Jhangiani. Ed's extensive background includes roles as Group Controller of CCEP and CFO of the Coca-Cola bottler in Canada. The transition period will be supported by Nik Jhangiani until August 2024 and CCEP's half-year results.CEO Damian Gammell praised Ed Walker's broad finance experience within the Coca-Cola system and expressed confidence in his ability to drive the business forward. Ed Walker expressed excitement about his new role and his commitment to working collaboratively with the team to achieve shared goals.",
Borr Drilling Limited - Dividend declaration and key information relating to the cash distribution for the first quarter 2024,2024-05-23T05:59:00.000Z,Low,Neutral,"Borr Drilling  (NYSE: BORR, OSE: BORR) announced a cash distribution of US$0.10 per share for Q1 2024. The Board approved this on May 22, 2024. Key dates are: last day including right on OSE is May 30, 2024, and on NYSE is May 31, 2024. Ex-dividend dates are May 31, 2024 (OSE) and June 3, 2024 (NYSE). Record date for both exchanges is June 3, 2024. Payment date is expected around June 17, 2024, with distributions to Euronext VPS shareholders around June 20, 2024. This announcement follows the implementation of the Central Securities Depository Regulation in Norway, impacting settlement bases of NYSE (T+1) and OSE (T+2).",
"Burning Rock Schedules First Quarter of 2024 Earnings Release on May 29, 2024",2024-05-23T06:00:00.000Z,Low,Neutral,"Burning Rock Biotech (NASDAQ: BNR; LSE: BNR) will release its unaudited financial results for Q1 2024 on May 29, 2024, before the U.S. market opens. The company will host a conference call at 8:00 a.m. ET (8:00 p.m. Hong Kong time) on the same day to discuss the results. Interested participants should register in advance and join the call 15 minutes early. A live and archived webcast of the call will be available on the company’s investor relations website for 12 months. Visit the investor relations website on May 29, 2024, to access the earnings release.",
Desert Control releases its Q1 2024 Report and Year-to-Date Company Update,2024-05-23T04:48:00.000Z,Neutral,Neutral,"Desert Control (DSRT) released its Q1 2024 report showing notable progress. The company completed its first large-scale commercial project in Yuma, Arizona, and secured a significant contract in the Middle East through its partner, Mawarid. Financially, Desert Control ended Q1 2024 with a positive cash balance of NOK 105.1M and no interest-bearing debt. Despite a revenue drop to NOK 1.3M from NOK 1.9M in Q1 2023, the company improved its EBITDA from a loss of NOK 23.4M to NOK 14.7M. Net income also improved, moving from a loss of NOK 19.3M to NOK 7.8M. The equity ratio increased from 89% to 96.7%, reflecting a stronger financial position.",
KPS CAPITAL PARTNERS TO ACQUIRE TATE & LYLE'S OWNERSHIP INTEREST IN PRIMIENT,2024-05-23T06:08:00.000Z,Neutral,Very Positive,"KPS Capital Partners has agreed to acquire Tate & Lyle's remaining 49.7% stake in Primient for $350 million, with the transaction expected to close by July 2024. Primient, founded in 1906, is a leading producer of plant-based, renewable food and industrial ingredients, employing 1,800 people across six facilities in the US and Brazil. KPS initially acquired a controlling interest in Primient in April 2022, and this new investment underscores its commitment to the company. KPS plans to modernize Primient's operations, with over $700 million allocated for capital investments over the next five years. The acquisition will be financed through a mix of equity and debt, with Barclays leading the debt financing.",
Lenovo Group: Q4 and Full Year Financial Results 2023/24,2024-05-23T04:19:00.000Z,Neutral,Positive,"Lenovo Group (HKSE: 992, ADR: LNVGY) announced its Q4 and full-year results for the fiscal year 2023/24, showing significant growth. Q4 revenue increased by nearly 10% year-on-year to $13.8 billion, and net income doubled to $248 million. For the full year, revenue was $56.9 billion with a net income of $1 billion. The Solutions and Services Group (SSG) saw a 12% annual growth in revenue, while the Infrastructure Solutions Group (ISG) achieved a record Q4 revenue of $2.5 billion. The Intelligent Devices Group (IDG) reported $44.6 billion in annual revenue, with PCs resuming growth in the second half. Lenovo's AI strategy, featuring new AI PCs, is expected to drive further growth. The Board declared a final dividend of 3.8 US cents per share.",
"SQM REPORTS EARNINGS FOR THE THREE MONTHS ENDED MARCH 31, 2024|",2024-05-23T04:11:00.000Z,Neutral,Positive,"SQM reported earnings for Q1 2024, revealing a net loss of $869.5 million ($3.04 per share), starkly down from a net income of $749.9 million ($2.63 per share) in Q1 2023. Total revenues plummeted 52.1% year-on-year to $1,084.5 million. Excluding one-time adjustments, net income was $228.1 million, showing a 69.6% decline. Despite revenue drops, SQM saw over 30% year-on-year growth in lithium sales volumes, hitting over 43,000 metric tons in Q1 2024. The company also reported record-high iodine sales of 3,700 metric tons. Key developments include the acquisition of the Andover lithium project in Australia and the completion of the Dixin lithium hydroxide facility ramp-up in China. The company has revised its FY2024 lithium sales volumes guidance upward.",
Tencent Announces Winners of Flagship CarbonX Program to Combat Climate Change,2024-05-23T04:05:00.000Z,No impact,Very Positive,"Tencent has announced the winners of its first phase of the CarbonX Program, aimed at advancing climate technologies. Thirteen teams emerged victorious from over 300 applicants, receiving approximately RMB 100 million (US$14 million) in financial support. Launched in March 2023, CarbonX focuses on carbon capture, utilization, and storage (CCUS) and technology-based carbon removal. Tencent has pledged RMB 200 million (US$28 million) over three years to support these initiatives. Projects include innovations in converting CO2 to sustainable fuels and using steel slag for carbon capture. The program aligns with Tencent's commitment to sustainable social value and aims to facilitate commercial scaling of these technologies. The next phase of CarbonX will be launched globally later this year.",
Wipro Annual Report 2024 on Form 20-F Available Online for ADS Holders,2024-05-23T03:58:00.000Z,Low,Neutral,"Wipro  (NYSE: WIT), a prominent technology services and consulting firm, has filed its Annual Report on Form 20-F for the fiscal year ending March 31, 2024, with the U.S. SEC on May 22, 2024. The report, prepared according to IFRS standards, is accessible online on Wipro's website. The company will provide physical and email copies to American Depository Shares (ADS) holders upon request, complying with NYSE rules.",
Cytokinetics Announces Pricing of Public Offering of Common Stock,2024-05-23T03:30:00.000Z,Moderate,Neutral,"Cytokinetics announced the pricing of a public offering of 9,803,922 shares of its common stock at $51.00 per share.Expected gross proceeds are approximately $500 million before underwriting discounts and other expenses.The offering is set to close on May 28, 2024, subject to customary conditions.The company has also given underwriters a 30-day option to buy an additional 1,470,588 shares at the public offering price, less underwriting discounts and commissions.J.P. Morgan, Goldman Sachs, and Morgan Stanley are acting as joint book-running managers for the offering.",
Fidelis Insurance Group Announces Pricing of Secondary Offering of its Common Shares,2024-05-23T02:02:00.000Z,Neutral,Neutral,"Fidelis Insurance Group (NYSE: FIHL) announced the pricing of a secondary public offering of 9,000,000 common shares at $16.00 per share by existing shareholders. The underwriters have a 30-day option to purchase an additional 1,350,000 shares. Fidelis will not receive any proceeds from this offering. The offering is set to close on May 28, 2024, subject to standard closing conditions. Barclays, J.P. Morgan, and Goldman Sachs are among the lead managers. A registration statement was declared effective by the SEC on May 22, 2024. The offering is only available via a prospectus filed with the SEC.",
"DMG Blockchain Solutions Reports Second Quarter 2024 Results Ending March 31, 2024",2024-05-23T03:05:00.000Z,Moderate,Neutral,"DMG Blockchain Solutions announced its fiscal Q2 2024 results. Key highlights include a 31% revenue increase to $10M, driven by a 39% rise in self-mining revenues. Net income was slightly positive, maintaining profitability for the second consecutive quarter despite a 22% drop in bitcoin mined. The company recorded $4.5M in cash flow from operations, a 19% rise from the previous quarter, and holds $43.6M in cash and digital currency. Plans include deploying Bitmain T21 miners to achieve a hashrate of 1.7 EH/s by June, with a long-term target of 2 EH/s. Operating and maintenance costs rose to $5.3M, impacting net pool revenue negatively by $1.3M.",
"GlobalFoundries Announces Pricing of $950 Million Secondary Offering of Ordinary Shares, Including Concurrent $200 Million Share Repurchase",2024-05-23T03:53:00.000Z,Moderate,Negative,"GlobalFoundries (Nasdaq: GFS) announced a $950 million secondary offering of its ordinary shares priced at $50.75 per share. Mubadala Technology Investment Company, GF's largest shareholder, is the selling shareholder. The offering includes a concurrent $200 million share repurchase by GF. The underwriters have a 30-day option to purchase an additional $112.5 million of shares. The offering closes on May 28, 2024, under customary conditions. GF will not receive any proceeds from the sale. The share repurchase will be funded by GF's cash reserves, with no underwriting discounts or commissions applied. Lead managers include Morgan Stanley, BofA Securities, Citigroup, Goldman Sachs, and J.P. Morgan.",
Charter Announces Upsize and Early Tender Results for 4.908% Senior Secured Notes due 2025,2024-05-23T01:25:00.000Z,Neutral,Neutral,"Charter Communications (NASDAQ: CHTR) announced early tender results for its cash tender offer of 4.908% senior secured notes due 2025. The company increased the repurchase amount from $2.5 billion to $2.7 billion in principal. As of May 22, 2024, $3.51 billion of notes were tendered, representing 78.02% of outstanding notes. Due to oversubscription, accepted notes will be prorated. Payment for validly tendered notes will be made on May 24, 2024. Notes tendered after the early tender time are unlikely to be accepted. Morgan Stanley & Co.  acts as the dealer manager for the offer.",
BlackRock® Canada Announces Final May Cash Distributions for the iShares® Premium Money Market ETF,2024-05-23T03:00:00.000Z,Low,Neutral,"BlackRock Canada, a subsidiary of BlackRock, announced final May 2024 cash distributions for its iShares Premium Money Market ETF. Unitholders recorded on May 23, 2024, will receive a cash distribution of $0.188 per unit, payable on May 31, 2024. This announcement pertains to the iShares Premium Money Market ETF with the ticker CM.R. Further details are available on the BlackRock website.",
"KKR prices ¥91,400,000,000 of senior notes",2024-05-23T02:21:00.000Z,Low,Neutral,"KKR has announced the pricing of ¥91.4 billion in senior notes, split across five tranches with varying maturity dates and interest rates. The largest tranche, ¥44.6 billion, is due in 2029 with a 1.559% interest rate. Smaller tranches include ¥1 billion due in 2031 at 1.762%, ¥26.2 billion due in 2034 at 2.083%, ¥10 billion due in 2044 at 2.719%, and ¥9.6 billion due in 2054 at 3.008%. KKR intends to use the proceeds for general corporate purposes. The offering is targeted at qualified institutional buyers in the U.S. and international buyers, complying with Rule 144A and Regulation S under the Securities Act of 1933. The notes are unregistered and cannot be sold in the U.S. without proper registration or exemption. This announcement follows Rule 135c guidelines.",
From the Boroughs to the ‘Burgh: JetBlue Flights From New York to Edinburgh Taking Off Today,2024-05-23T00:38:00.000Z,Neutral,Very Positive,"JetBlue (Nasdaq: JBLU) has expanded its transatlantic offerings with new nonstop flights from New York's JFK to Edinburgh, starting today and running through September 30, 2024. This daily seasonal service introduces JetBlue's Mint® and Core product offerings to Edinburgh, enhancing competition in a market dominated by high-fare legacy carriers. The launch features introductory roundtrip fares starting at £399/$499 for Core and £1999/$2999 for Mint. The flights will operate on JetBlue's Airbus A321neo with Mint, which offers increased fuel efficiency and extended range. The service aims to strengthen cultural and economic ties between the U.S. and Scotland.",
Bowhead Specialty Announces Pricing of Upsized Initial Public Offering,2024-05-22T23:28:00.000Z,Low,Positive,"Bowhead Specialty Holdings announced the pricing of its upsized Initial Public Offering (IPO) at $17.00 per share, offering 7,529,412 shares. This is expected to generate $128 million in gross proceeds before costs. An additional 1,129,411 shares may be purchased by underwriters within 30 days at the same price. Trading begins on the NYSE on May 23, 2024, under the symbol “BOW,” with the offering closing on May 28, 2024. The IPO aims to boost capitalization, financial flexibility, and create a public market for its stock, with proceeds supporting business growth and general corporate purposes. The IPO is managed by J.P. Morgan, Morgan Stanley, and Keefe, Bruyette & Woods, among others.",
GoDaddy 2023 Sustainability Report: Our Customers | Inclusive Entrepreneurship,2024-05-23T00:10:00.000Z,No impact,Positive,"GoDaddy's 2023 Sustainability Report highlights its commitment to inclusive entrepreneurship. The Empower by GoDaddy program, launched in 2017, supports underserved communities through education, mentorship, and networking. In 2023, it served nearly 2,900 entrepreneurs with over $1 million in funding. The Venture Forward initiative, surveying over 30,000 entrepreneurs since 2018, provides critical data on microbusinesses, noting that 1/7 of pandemic-era microbusinesses were founded by Black women. New initiatives include the acquisition of the .gay domain to support LGBTQIA+ communities. Future plans involve expanding support to more communities and enhancing program metrics.",
The Hackett Group Recognized as the 2024 Finance Transformation Award Winner by OneStream Software,2024-05-23T00:00:00.000Z,No impact,Positive,"The Hackett Group (NASDAQ: HCKT) has been honored with OneStream Software's 2024 Finance Transformation Award. This accolade was presented at the OneStream Splash event in Las Vegas, recognizing Hackett's exceptional work in transforming Pella's financial operations. The project unified Pella's budgeting, profitability, forecasting, tax reporting, and lease accounting into one platform, drastically reducing consolidation times and improving decision-making speed. Allocation execution times dropped from a day to five minutes per iteration, significantly enhancing operational efficiency. The comprehensive solution provided strategic insights and detailed income statements, enabling Pella to adapt swiftly to market changes and optimize profitability. Paulo Dominguez and Trey Robbins from The Hackett Group highlighted the team's expertise and commitment, while Stephanie Cramp from OneStream praised the project's complexity and impact.",
Tritium Will Not Appeal Nasdaq Delisting Determination,2024-05-23T00:36:00.000Z,Low,Negative,"Tritium DCFC  (OTC: DCFCQ), a global developer of DC fast chargers for electric vehicles, announced it will not appeal Nasdaq's decision to delist its securities. On April 18, 2024, Tritium reported insolvency and appointed administrators for itself and three subsidiaries. Receivers and Managers were appointed to oversee most of the Companies' assets and operations. Consequently, Nasdaq determined to suspend trading of Tritium's shares and warrants from April 22, 2024, and initiated delisting procedures, effective May 28, 2024. Trading of Tritium's securities is restricted without administrator consent due to Australian law. Tritium does not plan to challenge this delisting.",
