title,datetime,impact_score,sentiment,summary,article
Federal Realty Investment Trust Announces Second Quarter 2024 Earnings Release Date and Conference Call Information,2024-05-22T20:30:00.000Z,Low,Neutral,"Federal Realty Investment Trust (NYSE: FRT) will release its second-quarter 2024 earnings after market close on Thursday, August 1, 2024. A conference call will follow at 5:00 PM ET the same day. The call will be accessible via live webcast or by dialing provided numbers. A replay will be available on the company's website and via telephonic replay until August 15, 2024.Federal Realty specializes in owning and operating retail-based properties in major coastal markets and has a record of 56 consecutive years of dividend increases. The company manages 102 properties with 3,300 tenants and 3,100 residential units.",
IsoEnergy Announces Results Following Annual General and Special Meeting of Shareholders,2024-05-22T21:00:00.000Z,Neutral,Neutral,"IsoEnergy held its annual general and special meeting of shareholders on May 22, 2024, approving all matters presented. Key decisions include re-electing director nominees, appointing KPMG LLP as auditors, and approving the Omnibus Long Term Incentive Plan. Additionally, the company will move its  from British Columbia to Ontario and authorized the Board to decide the number of directors. A total of 101,386,101 shares, representing 56.82% of votes, were cast at the meeting.",
BetterInvesting™ Magazine Update on FedEx and Gap,2024-05-22T20:30:00.000Z,Low,Neutral,"BetterInvesting Magazine's August 2024 issue has highlighted FedEx (NYSE: FDX) as the 'Stock to Study' and Gap (NYSE: GPS) as the 'Undervalued Stock'. This selection aims to provide informational and educational insights for investors.The National Association of Investors' CEO, Ken Zendel, emphasized the utility of the Stock Selection Guide (SSG), a tool employed by investors for evaluating stock prices. The announcement was made during the annual BetterInvesting National Convention, which saw significant attendance for workshops and keynote addresses.Committee members comprising CFA professionals reviewed stocks like Apple, Nvidia, and Tesla as part of their analysis. Investors are encouraged to use the SSG and its trial version to delve into the investment potential of FedEx by reviewing fundamental data and making informed judgments. Importantly, these picks are not official endorsements for purchase by BetterInvesting or NAIC.",
Genpact Announced a Change to Presentation Time at William Blair's 44th Annual Growth Stock Conference,2024-05-22T20:30:00.000Z,Low,Neutral,"Genpact announced a change in the schedule for its presentation at William Blair's 44th Annual Growth Stock Conference. The event is set for June 5, 2024, in Chicago, IL. Balkrishan 'BK' Kalra, President and CEO, will now present at 12:00 PM Central Time. Investors can access a live webcast of the presentation on Genpact's investor page.",
Riskified to Attend Upcoming Conferences,2024-05-22T20:30:00.000Z,Low,Neutral,"Riskified, a leader in ecommerce fraud and risk intelligence, announced its upcoming conference schedule. Management will present and host investor meetings at the William Blair 44th Annual Growth Stock Conference in Chicago on June 4th at 11:00 AM ET, with a live webcast available on their Investor Relations website. Additionally, they will participate virtually in the Oppenheimer 25th Annual Israeli Conference on May 29th. Investors can access archived presentations on the company's website.",
RYAM President and CEO to Present at Stifel Cross Sector Insight Conference,2024-05-22T20:30:00.000Z,Low,Neutral,"Rayonier Advanced Materials (NYSE: RYAM), a global leader in High Purity Cellulose, has announced that its President and CEO, De Lyle Bloomquist, will meet with investors at the Stifel Cross Sector Insight Conference. The conference will take place on June 5, 2024, with a group presentation scheduled for 2:25 PM ET. Interested attendees can register through RYAM's website.",
Universal Corporation Announces 54th Annual Dividend Increase and Sets Annual Meeting Date,2024-05-22T20:15:00.000Z,Low,Neutral,"Universal  (NYSE: UVV) announced a quarterly dividend increase to $0.81 per share, reflecting an annualized rate of $3.24 per share and a yield of approximately 6.08% based on the May 20, 2024, closing price of $53.29. The dividend is payable on August 5, 2024, to shareholders of record at the close of business on July 8, 2024. This marks the 54th annual dividend increase for the company, signaling the Board's confidence in its business strategy and investment decisions.The annual meeting of shareholders is set for August 6, 2024, at the company's headquarters. The record date for the meeting is June 6, 2024. Universal , a global agricultural company with over 100 years of experience, operates in over 30 countries and focuses on providing high-quality, traceable products through a diverse network of farmers and partners.",
Crown Castle Declares Quarterly Common Stock Dividend,2024-05-22T20:15:00.000Z,Low,Neutral,"Crown Castle (NYSE: CCI) has announced a quarterly cash dividend of $1.565 per common share.This dividend is scheduled to be paid on June 28, 2024, to shareholders who are on record as of June 14, 2024.Future dividends will require approval from Crown Castle's Board of Directors.",
Chimera Investment Corporation Announces Closing of Public Offering of $65 Million Senior Notes,2024-05-22T20:15:00.000Z,Low,Negative,"Chimera Investment  (NYSE: CIM) announced the closing of its public offering of $65 million in 9.000% senior notes due 2029. The notes are expected to trade on the NYSE under the symbol 'CIMN' starting May 28, 2024, and received a BBB investment grade rating from Egan-Jones. The offering aims to diversify Chimera's capital structure and support the acquisition of high-yielding assets. The transaction was managed by prominent financial firms including Morgan Stanley and RBC Capital Markets. Legal advisors included Hunton Andrews Kurth LLP and Venable LLP.",
Allient Names James A. Michaud as Chief Financial Officer,2024-05-22T20:15:00.000Z,Low,Positive,"Allient (Nasdaq: ALNT) has appointed James A. Michaud as Chief Financial Officer, effective June 3, 2024. Michaud succeeds Michael R. Leach, who is retiring. With over 25 years of experience, Michaud has held senior roles in both public and private multinational companies, most recently at Elior North America. CEO Dick Warzala highlighted Michaud's expertise in business operations, risk management, and financial planning, noting his fit for Allient's goal of generating $1 billion in revenue. Michaud holds a B.S. in Accountancy from Bentley University and is a Certified Public Accountant.",
OPW Clean Energy Solutions Expands Model CV Valve Product Line for Hydrogen Market,2024-05-22T20:15:00.000Z,Neutral,Neutral,"On May 22, 2024, ACME Cryogenics, a segment of OPW Clean Energy Solutions and Dover (NYSE: DOV), announced new 6"" and 8"" valves for its Model CV Valve product line. These larger valves meet the increasing demand for hydrogen applications. Dan Hutchinson, Technical Sales Manager, emphasized that these additions highlight the company's commitment to supporting the expanding hydrogen infrastructure. The Model CV valves, ideal for hydrogen handling, also comply with ASME B31.3 and CSA B51 regulations. They cater to various industries, including aerospace, food & beverage, electronics, vehicle refueling, industrial manufacturing, and medical.",
Auna Announces 1Q24 Financial Results,2024-05-22T20:15:00.000Z,Neutral,Neutral,"Auna (NYSE: AUNA), a major player in Latin America's healthcare sector, announced its unaudited 1Q24 financial results. Revenue increased by 20% YoY to S/1,076 million, and operating profit rose by 26% to S/182 million. Adjusted EBITDA grew 14% YoY to S/241 million with a margin of 22.4%, though it decreased by 1.2 percentage points YoY. Net income improved to S/22 million from a break-even position in 1Q23. Geographically, revenue growth was observed across all markets. In Peru, the adjusted EBITDA margin reached 20.4%, aligning with targets. Significant investments are being made in Mexico, particularly in Monterrey and the upcoming OncoMexico launch, expected to bolster returns in the latter half of 2024. The company forecasts adjusted EBITDA growth of 20% or more for the full year. The leverage ratio improved to 4.29x.These financial results reflect Auna's integrated healthcare model's strength and its ability to generate substantial returns, emphasizing the company's commitment to modernizing healthcare in the region.",
Dillard’s Launches DANNIJO for Gianni Bini,2024-05-22T20:15:00.000Z,Low,Very Positive,"Dillard’s (NYSE: DDS) has launched a -edition fashion collaboration called DANNIJO for Gianni Bini, featuring designs by sisters Danielle and Jodie Snyder. This collection, available exclusively at Dillard's stores and online, includes 75 styles of ladies' apparel, swimwear, footwear, jewelry, and girls' apparel. Emphasizing a summer-ready aesthetic, the collection offers items such as slip dresses, jeweled sandals, and crocheted swimwear. Alexandra Dillard Lucie, VP of Merchandising, praised the collection for its elevated summer vibe and appeal to both loyal and younger customers.",
Darden Restaurants to Host Fiscal 2024 Fourth Quarter Conference Call on June 20,2024-05-22T20:15:00.000Z,Low,Neutral,"Darden Restaurants (NYSE: DRI) will release its fiscal 2024 fourth quarter financial results on June 20, 2024, before the market opens.The company will host a conference call at 8:30 am ET on the same day with CEO Rick Cardenas and other senior management to discuss the results and engage in a Q&A session.The conference call can be accessed live via the Internet or by dialing 877-407-9219. A replay will be available shortly after the call.",
"KNOT Offshore Partners LP Earnings Release—Interim Results for the Period Ended March 31, 2024",2024-05-22T20:15:00.000Z,Neutral,Neutral,"KNOT Offshore Partners LP reported Q1 2024 financial results.Key highlights include: revenues of $76.6 million, operating income of $19.7 million, and net income of $7.4 million. EBITDA adjusted to $47.5 million.Fleet utilization stood at 97.6%, and available liquidity was $55.2 million.Key events: declaration of cash distributions, vessel contracts renewals, and the signing of new time charters. The Dan Cisne returned post-charter and is assessing new operations.The company signed a $60 million loan facility and achieved refinancing milestones. CEO Derek Lowe highlighted contract coverage, fleet utilization, and improving market outlooks in Brazil and the North Sea.Revenue and operating income increased compared to Q4 2023 and Q1 2023.Interest expenses decreased due to lower rates and debt.Overall, KNOT Offshore Partners LP reported a strong operational and financial performance for Q1 2024.",
"Uniti Group Inc. to Present at the TD Cowen 52nd Annual Technology, Media and Telecom Conference",2024-05-22T20:15:00.000Z,Low,Neutral,"Uniti Group announced that its President and CEO, Kenny Gunderman, along with SVP, CFO, and Treasurer, Paul Bullington, will present at the TD Cowen 52nd Annual Global Technology, Media and Telecom Conference.The presentation is scheduled for 9:40 AM EDT on May 29, 2024, in New York, NY. A live webcast of the event will be available on Uniti's Investor Relations website, and it will be accessible for replay for a  time.",
Immersion Signs License Agreement with Samsung Electronics Co.,2024-05-22T20:15:00.000Z,Neutral,Neutral,"Immersion  (NASDAQ: IMMR) announced the renewal of its license agreement with Samsung Electronics. This extension allows Samsung to continue using Immersion's haptic feedback technology in its devices, enhancing user experiences in gaming, computing, and software applications. Eric Singer, President and CEO of Immersion, expressed delight at the renewal, emphasizing the growing importance of high-quality tactile effects in consumer devices.",
Equitable Holdings Increases Common Stock Dividend and Declares Preferred Stock Dividends,2024-05-22T20:15:00.000Z,Low,Neutral,"Equitable Holdings (NYSE: EQH) has declared a quarterly cash dividend of $0.24 per share of common stock, marking a 9% increase over the previous quarter. The dividend is payable on June 10, 2024, to shareholders of record as of June 3, 2024.Additionally, the company’s board has declared several dividends for preferred stocks. For Series A 5.25% Non-Cumulative Perpetual Preferred Stock, a quarterly dividend of $328.125 per share (or $0.328125 per depositary share) is payable on June 17, 2024, to holders of record on June 4, 2024.For Series B 4.95% Non-Cumulative Perpetual Preferred Stock, a semi-annual dividend of $618.750 per share (or $24.75 per depositary share) is payable on June 17, 2024, to holders of record on June 4, 2024.For Series C 4.30% Non-Cumulative Perpetual Preferred Stock, a quarterly dividend of $268.750 per share (or $0.26875 per depositary share) is payable on June 17, 2024, to holders of record on June 4, 2024.",
Morningstar to Appoint Rod Diefendorf as President and Chief Operating Officer of PitchBook,2024-05-22T20:15:00.000Z,Low,Very Positive,"Morningstar (Nasdaq: MORN) has announced that Rod Diefendorf will be appointed as the new President and Chief Operating Officer of PitchBook, following the departure of founder John Gabbert. Diefendorf, who has been with PitchBook since 2016, has nearly 30 years of experience in the technology sector. He has been instrumental in driving PitchBook's strategic roadmap and global operations. CEO Kunal Kapoor expressed confidence in Diefendorf's ability to continue the company's growth and uphold its commitment to providing transparent investment insights. Diefendorf emphasized his dedication to maintaining the company's vision and passion.",
Keurig Dr Pepper to Participate in Deutsche Bank dbAccess Global Consumer Conference,2024-05-22T20:15:00.000Z,Low,Neutral,"Keurig Dr Pepper (NASDAQ: KDP) has announced that CEO Tim Cofer and CFO Sudhanshu Priyadarshi will present at the Deutsche Bank dbAccess Global Consumer Conference on June 5, 2024, at 8:45 AM ET.The presentation will be accessible via a live webcast on the company's website, with a recorded version and transcript available later in the Investors section.For more information, stakeholders can contact Keurig Dr Pepper's Investor Relations or Media Contact.",
Lara Agrees Sale of the Curionopolis Iron Project,2024-05-22T20:15:00.000Z,Neutral,Neutral,"Lara Exploration has agreed to sell its Curionopolis Iron Project to Ferrous Technology Mineracao Limitada (Fertec) for staged payments totaling approximately US$2 million. The initial payment of R$6.85 million, including R$1.5 million as advanced royalties, has been received. The remaining R$3 million will be paid once the license transfer is completed. Additionally, Lara will earn a 3% gross sales royalty on future production with a minimum of US$150,000 in annual advance royalties starting from the third year. The Curionopolis Project covers a 1,226.53-hectare area in Brazil's Carajas District, with significant drilling and resource assessments already conducted. Fertec is moving forward with environmental studies and plans to apply for a pilot mining license soon.",
"Saga Communications, Inc. Declares a Quarterly Cash Dividend of $0.25 per Share",2024-05-22T20:15:00.000Z,Low,Neutral,"Saga Communications (Nasdaq - SGA) announced a quarterly cash dividend of $0.25 per share, payable on June 28, 2024, to shareholders of record as of June 3, 2024. The total payment will be approximately $1.6 million, funded by existing cash reserves. Since 2012, Saga has distributed around $132 million in dividends. The company adheres to a variable dividend policy aimed at maintaining a robust balance sheet, rewarding shareholders, and facilitating growth through strategic acquisitions. Future dividends and potential stock buybacks will be decided by the Board based on financial performance, cash needs, and other factors. Saga operates in 27 markets, managing 79 FM and 31 AM radio stations along with 78 metro signals.",
Rayonier CEO to Present at REITweek,2024-05-22T20:15:00.000Z,Low,Neutral,"Rayonier announced that CEO Mark McHugh will present at Nareit's REITweek: 2024 Investor Conference on June 4 at 11:45 a.m. ET in New York, NY.The live webcast will be accessible via the Investor Relations section of Rayonier's website, with a replay available afterward.",
Molina Healthcare of Wisconsin Receives Notice of Intent to Award New Region 5 Contract,2024-05-22T20:15:00.000Z,Neutral,Neutral,"Molina Healthcare (NYSE: MOH) announced that the Wisconsin Department of Health Services intends to award a new contract for Region 5 to Molina Healthcare of Wisconsin. The contract is set to begin on January 1, 2025, for two years, with options for three, two-year extensions. The program, branded as My Choice Wisconsin, currently serves 5,600 members in the Family Care and Family Care Partnership programs, out of the 55,000 total members in Wisconsin.",
JPMorgan Chase Financial Company LLC Declares Quarterly Coupon on Alerian MLP Index ETN,2024-05-22T20:15:00.000Z,Low,Neutral,"JPMorgan Chase Financial Company announced the quarterly coupon for the Alerian MLP Index ETN (AMJB), due January 28, 2044. The coupon amount is $0.4535 per note, with a current yield of 6.3%. Key dates include the declaration date on May 22, 2024, the ex-date and record date on May 29, 2024, and the payment date on June 6, 2024. These notes are senior, unsecured obligations guaranteed by JPMorgan Chase & Co.",
UL Solutions Announces Quarterly Dividend,2024-05-22T20:15:00.000Z,Low,Neutral,"UL Solutions, listed on the NYSE under the ticker symbol ULS, has declared a quarterly dividend of $0.125 per share. This dividend will be distributed on June 18, 2024, to shareholders who are recorded in the company's books as of June 3, 2024. The announcement underscores UL Solutions' commitment to delivering shareholder value, highlighting its ongoing efforts in applied safety science.",
"Shuttle Pharma to Participate in the Lytham Partners Spring 2024 Investor Conference on May 30, 2024",2024-05-22T20:15:00.000Z,Low,Neutral,"Shuttle Pharmaceuticals (Nasdaq: SHPH) will participate in the Lytham Partners Spring 2024 Investor Conference on May 30, 2024. CEO Dr. Anatoly Dritschilo will present updates on the Phase 2 clinical trial of Ropidoxuridine for glioblastoma and the development of predictive biomarkers for prostate cancer by Shuttle Diagnostics, Inc. The webcast presentation will be at 11:00 am ET, with virtual one-on-one meetings available throughout the event. The webcast can be accessed via the conference homepage or directly. Shuttle Pharmaceuticals focuses on enhancing radiation therapy outcomes for cancer patients.",
"California Water Service Group Bolsters Environmental, Social, and Governance Program, Reaffirms Commitment to Safe and Reliable Water Supply for Communities",2024-05-22T20:15:00.000Z,Low,Neutral,"California Water Service Group (NYSE: CWT) has released its 2023 ESG Report, showcasing significant achievements and ongoing efforts in its environmental, social, and governance (ESG) program. Key highlights include a commitment to reduce greenhouse gas emissions by 63% by 2035, $383.7 million invested in infrastructure, and saving nearly 95 million gallons of water annually through conservation programs. The company achieved 100% compliance with water quality standards, secured $83 million in funding for customer arrearages, and donated over $1.5 million to community organizations. Workforce engagement efforts included $728,000 invested in training and a doubling of veteran hires. Governance achievements feature a diverse Board of Directors and 27.2% of net procurement with diverse suppliers.",
Elastic to Present in Upcoming Investor Conferences,2024-05-22T20:15:00.000Z,Low,Neutral,"Elastic (NYSE: ESTC), a leading Search AI company, announced its participation in two upcoming investor conferences. Management will present at the Bank of America Global Technology Conference on June 4, 2024, at 3:20 p.m. PT / 6:20 p.m. ET and at the Rosenblatt Technology Summit on June 13, 2024, at 12:00 p.m. PT / 3:00 p.m. ET. Live webcasts and replays of these events will be available on Elastic’s Investor Relations page.",
COMPX ANNOUNCES REGULAR QUARTERLY DIVIDEND AND RESULTS OF THE ANNUAL STOCKHOLDER MEETING,2024-05-22T20:15:00.000Z,Low,Neutral,"CompX International (NYSE American: CIX) announced a regular quarterly dividend of $0.30 per share for its class A common stock, payable on June 18, 2024, to stockholders of record on June 10, 2024. During the annual stockholder meeting on May 22, 2024, CompX stockholders elected eight directors for a one-year term and approved, on a nonbinding advisory basis, the compensation of its named executive officers. CompX is a prominent manufacturer of security products and recreational marine components.",
Horace Mann declares quarterly dividend,2024-05-22T20:15:00.000Z,Low,Neutral,"Horace Mann Educators  (NYSE: HMN) has declared a quarterly cash dividend of $0.34 per share.The dividend will be payable on June 28, 2024, to shareholders who are on record as of June 13, 2024.",
"Elevai Labs Inc Subsidiary, Elevai Biosciences, to Present at the UCLA LA-BEST 2024 Conference",2024-05-22T20:15:00.000Z,Low,Neutral,"Elevai Labs, a leader in medical aesthetics, announced that CEO Dr. Jordan R. Plews will present at the LA-BEST 2024 conference on May 23, 2024. This event, organized by UCLA Technology Development Group, brings together around 1,000 participants to foster biotech innovation. Dr. Plews will discuss Elevai Biosciences' engineered probiotic approach for muscle loss prevention in obesity, particularly focusing on combining this approach with GLP-1 receptor agonists. He will highlight their lead candidate, EL-22, which aims to preserve muscle mass through mucosal immunity and anti-myostatin antibodies. The conference aims to promote biotech partnerships and showcase pioneering research.",
,,,,,
News Corp and OpenAI Sign Landmark Multi-Year Global Partnership,2024-05-22T20:13:00.000Z,Neutral,Very Positive,"News Corp and OpenAI have signed a multi-year global partnership, allowing OpenAI to access and display content from News Corp's various publications. This historic agreement aims to enrich OpenAI's generative AI products with reliable news and information, enhancing users' ability to make informed choices. Key publications involved include The Wall Street Journal, Barron’s, MarketWatch, Investor’s Business Daily, The Times, The Sunday Times, The Sun, The Australian, and more.OpenAI will also benefit from News Corp’s journalistic expertise to maintain high standards. Robert Thomson, Chief Executive of News Corp, emphasized the significance of this partnership, highlighting its potential to set new standards for veracity and value in the digital age. Sam Altman, CEO of OpenAI, expressed excitement about enhancing access to high-quality reporting.",
VF Corporation Appoints Paul Vogel Chief Financial Officer,2024-05-22T20:08:00.000Z,Low,Neutral,"VF  (NYSE: VFC) announced the appointment of Paul Vogel as Chief Financial Officer, effective July 8, 2024. Vogel will replace Matt Puckett, who is stepping down. Vogel brings extensive experience from his previous role as CFO of Spotify Technology, where he significantly improved the company's financial health, nearly doubling revenue and users while expanding margins and cash flow. VF's CEO, Bracken Darrell, emphasized Vogel's operational and financial expertise, expecting him to drive VF’s return to profitable growth. Vogel expressed excitement about leveraging VF's strong brand portfolio and innovative culture to enhance growth and value creation for shareholders. The company also thanked Matt Puckett for his 23 years of service.",
ePlus Reports Fourth Quarter and Fiscal Year 2024 Financial Results and Announces New Share Repurchase Program,2024-05-22T20:05:00.000Z,Moderate,Neutral,"ePlus reported financial results for Q4 and fiscal year 2024, noting a 12.7% increase in net sales to $554.5 million and a 12.6% rise in technology business sales. However, the company saw a 33.1% drop in net earnings to $22 million and a 24.4% decrease in adjusted EBITDA to $36.8 million.Annual net sales grew 7.6% to $2.225 billion, with a 6.4% rise in consolidated gross profit to $550.8 million. Despite revenue growth, net earnings fell 3% to $115.8 million, and adjusted EBITDA slightly decreased. The company announced a new share repurchase plan to buy back up to 1.25 million shares.ePlus highlighted a strong cash position of $253 million and outlined guidance for 2025, projecting 3-6% revenue growth and $200-$215 million in adjusted EBITDA.",
Nordstrom Board of Directors Approves Quarterly Dividend,2024-05-22T20:05:00.000Z,Low,Neutral,"Nordstrom, a leading fashion retailer, announced that its board of directors has approved a quarterly dividend of 19 cents per share.This dividend will be payable on June 19, 2024, to shareholders who are recorded as of the close of business on June 4, 2024.This announcement highlights Nordstrom's ongoing commitment to returning value to its shareholders.",
